,Video ID,Published Date,Title,View Count,Like Count,Comment Count,Channel Title,Subscriber Count
0,JHNHDF2muwU,2024-05-13T02:35:00Z,"Abi Carter: ""The Chain"" from Guardians of the Galaxy Vol. 2 on Disney Night - American Idol 2024",246077,3504,398,American Idol,3640000
1,BJ4SLyE-K3s,2024-05-09T09:17:29Z,How to play Chain Guardians' NFT Mining #chainguardians #nftmining_com #skalenetwork #rpg #dmission,559,2,1,Thắng Đoàn,0
2,BMMiCnqvBns,2024-05-13T02:59:30Z,"Abi Carter sings ""The Chain"" Guardians of the Galaxy Vol. 2 | Disney Night - American Idol 2024",529,28,0,Top World Talent HD,44900
3,TFjFJ67Wkdo,2024-05-04T18:59:22Z,The Chain Fleetwood Muc (Sonic the hedgehog 3 Guardians of the Galaxy Vol 2) HD,31,0,0,ARON Picsart Music,524
4,nR9Chvyaumw,2024-05-18T14:00:36Z,Abi Carter - The Chain (From Guardians of the Galaxy 2) - First Time Reaction,259,12,1,meaningfullyvacant,46100
5,67KA8Q03u3w,2024-05-21T17:00:47Z,The Chain | Marvel's Guardians of the Galaxy Music,645,24,3,Mysikt,3020
