,Video ID,Published Date,Title,View Count,Like Count,Comment Count,Channel Title,Subscriber Count
0,bmesdi-WO68,2024-04-04T04:59:06Z,Simple Guide: Install Hychain Nodes CORRECTLY on VPS and Linux,561,19,39,Dr. Wookiee,3880
1,CC_CbHreMGo,2024-04-04T11:15:14Z,How to install hychain node on windows and run it on your own pc #hychainnode #hychain #topianode,161,13,5,johns crypto channel,560
2,7TMsXLZ1bL4,2024-04-09T01:57:10Z,Simple Guide to Claiming Hychain Node Rewards,149,10,4,Dr. Wookiee,3880
3,qstwiWb3tSE,2024-04-04T21:23:58Z,COMO RODAR E CONFIGURAR NODE HYCHAIN RÁPIDO FÁCIL,713,49,12,Seroy,32900
4,2W96xQmDXR4,2024-04-04T07:30:10Z,How to setup and run Hychain node on VPS complete guide,197,8,8,Cryptopion,128
