,Video ID,Published Date,Title,View Count,Like Count,Comment Count,Channel Title,Subscriber Count
0,bmesdi-WO68,2024-04-04T04:59:06Z,Simple Guide: Install Hychain Nodes CORRECTLY on VPS and Linux,756,23,45,Dr. Wookiee,3910
1,CC_CbHreMGo,2024-04-04T11:15:14Z,How to install hychain node on windows and run it on your own pc #hychainnode #hychain #topianode,240,15,12,johns crypto channel,562
2,7TMsXLZ1bL4,2024-04-09T01:57:10Z,Simple Guide to Claiming Hychain Node Rewards,337,15,9,Dr. Wookiee,3910
3,YgKEjuAWp4s,2024-04-11T08:07:49Z,How to recive your Topia tokens from your hychain node,21,1,2,johns crypto channel,562
4,_D0wfW0OOrs,2024-03-30T04:21:06Z,How to Run Your Hychain Guardian Nodes in a Single Click,627,3,0,NodeOps,7
5,2W96xQmDXR4,2024-04-04T07:30:10Z,How to setup and run Hychain node on VPS complete guide,255,10,9,Cryptopion,152
