,Video ID,Published Date,Title,View Count,Like Count,Comment Count,Channel Title,Subscriber Count
0,CC_CbHreMGo,2024-04-04T11:15:14Z,How to install hychain node on windows and run it on your own pc #hychainnode #hychain #topianode,176,13,5,johns crypto channel,561
1,bmesdi-WO68,2024-04-04T04:59:06Z,Simple Guide: Install Hychain Nodes CORRECTLY on VPS and Linux,612,22,39,Dr. Wookiee,3890
2,7TMsXLZ1bL4,2024-04-09T01:57:10Z,Simple Guide to Claiming Hychain Node Rewards,229,14,5,Dr. Wookiee,3890
3,qstwiWb3tSE,2024-04-04T21:23:58Z,COMO RODAR E CONFIGURAR NODE HYCHAIN RÁPIDO FÁCIL,734,49,12,Seroy,33000
4,_D0wfW0OOrs,2024-03-30T04:21:06Z,How to Run Your Hychain Guardian Nodes in a Single Click,586,3,0,NodeOps,7
