,Video ID,Published Date,Title,View Count,Like Count,Comment Count,Channel Title,Subscriber Count
0,isY_4jcftrA,2024-06-07T18:00:07Z,Illuvium: Official Release Date Trailer | Collectible RPG & Autobattler Game,58657,1486,287,Illuvium,51600
1,B7EtggtnUCk,2024-06-16T00:53:44Z,NEW Changes to Airdrop challenge w/ New Holos Update | Illuvium overworld,1056,54,15,illuvinomics - Godson,3070
2,YajjmZD8SqM,2024-06-24T01:23:51Z,BEST PvP Illuvial - Jotun Behemoth Verdant | Illuvium Overworld Guide | Illuvium Airdrop,553,33,8,Web3 Gaming Tv,2100
3,yF33XutOXMg,2024-06-11T03:30:44Z,These 3 Deposits Are Epic for Tier 5 Drops | Illuvium Overworld,689,41,12,illuvinomics - Godson,3070
4,ndtZMMjje4c,2024-06-17T21:00:34Z,Illuvium's Future: Massive Gains or Overhyped?,784,28,13,Dollar Cost Crypto,33000
5,_SQL64Dj8g0,2024-05-28T03:54:47Z,5 Tips To Earn Big In Illuvium Open Beta!,2183,35,10,Bulldog1205,21000
6,aHbkXtyR_Js,2024-06-05T21:31:18Z,Easy Farming Guide for EVERY Deposit | illuvium Overworld,1800,87,11,illuvinomics - Godson,3070
7,6Hl9asefwpQ,2024-06-11T14:00:07Z,How can you not be bullish on Illuvium by now...,1406,97,17,Scoriox,6420
8,bzxR_y7NChM,2024-06-23T22:39:04Z,Illuvium | Open Beta Testnet - Completando Todo el set de Illuvials | Objetivo: Dark Holo #dia 23,101,7,0,jagemetal,527
9,I7y2dHvZyUw,2024-05-28T23:43:15Z,How to Maximize Your Illuvium Airdrop... $1.7 Million $ILV Rewards!,4141,73,37,Jeff Losaria,1470
10,Bgul9q3QubY,2024-05-31T14:00:08Z,Is the Illuvium crypto gaming airdrop worth it? | Earnings calculated,4669,163,51,Scoriox,6420
11,gbJIXRu3iuE,2024-06-13T03:53:15Z,POWER LEVEL With Slayers | FULL Tier 5 Fusion In 1 Run | Illuvium Overworld Guide | Illuvium Airdrop,3269,156,126,Web3 Gaming Tv,2100
12,WUh1BBz1dl8,2024-06-17T01:05:59Z,BEST Way To Farm Airdrop Points! NEW Illuvium Update | Illuvium Overworld Guide | Illuvium Airdrop,3355,144,179,Web3 Gaming Tv,2100
13,B0ANnTSWFaY,2024-05-29T21:08:09Z,The ULTIMATE Tutorial Guide for Illuvium Overworld Beginner (Airdrop-farmer ;),2238,82,11,Viper_ilv,1010
14,s_7nR7C901Q,2024-06-13T21:28:58Z,Illuvium - 5 Tips For Beginners to MAXIMIZE Your Start,891,39,25,CryptoStache,94100
15,0gAc_RM4NBo,2024-05-28T04:34:45Z,"Mastering Illuvium: 10 Tips to Excel in the Overworld"" ( For Advance and new Players)",1825,73,6,illuvinomics - Godson,3070
16,tZ9F-UEfsW8,2024-06-14T14:00:51Z,This Illuvium leak will define bullish things for the game,1495,82,7,Scoriox,6420
17,3HMBvuCCW9Q,2024-06-14T07:10:59Z,Illuvium Overworld HUGE UPDATES! $25 Million Airdrop Farming | Illuvium Overworld Gameplay,1034,53,8,Web3 Gaming Tv,2100
18,OQVZo9u_rho,2024-06-15T04:11:34Z,Illuvium: Catch Holos For MASSIVE Airdrop Points,392,7,8,Bulldog1205,21000
19,1lQC4roP0Ng,2024-06-04T14:00:02Z,We need to talk about Illuvium PB4...,3295,154,82,Scoriox,6420
20,FL_pMtTLcXA,2024-06-03T11:45:06Z,Pro Player Secrets: Overexplained Mining Techniques in Illuvium | Illuvium Overworld Guide,1454,54,10,Viper_ilv,1010
21,cGbz2tULKgk,2024-05-28T03:38:53Z,QUICK BEGINNERS Guide To Illuvium Overworld | Beginners Illuvium Guide,3226,123,38,Web3 Gaming Tv,2100
22,P7ZJzicDn0c,2024-06-08T07:30:48Z,Illuvium Trailer breakdown,942,80,40,Polemos,1860
23,XQjXSrTjp_Q,2024-06-02T12:04:12Z,HOW TO WIN BIG $$$ Playing Illuvium | Play To Earn Illuvium | Beginners Illuvium Guide,1526,61,73,Web3 Gaming Tv,2100
24,TqH1Mvvk0d4,2024-06-08T06:42:58Z,Breaking down the Illuvium trailer LIVE | Illuvium is FINALLY Here,1030,79,13,Scoriox,6420
25,aFzTzfZzpQc,2024-06-18T07:44:36Z,Illuvium Overworld HOLO HUNTING! $25 Million Airdrop Farming | Illuvium Overworld Gameplay,1420,43,25,Web3 Gaming Tv,2100
26,mdOYiUmH_oI,2024-06-09T12:45:14Z,Illuvium Overworld is WAY better if you change these two settings!,208,17,9,Crypto Quick Chat,72
27,JX9IBQTM710,2024-05-30T19:50:06Z,Illuvium May Highlights: Exclusive Leaks and Stunning Updates!,2295,164,27,Illuvium,51600
28,IjQCAsAid0c,2024-06-01T13:00:15Z,Tudo que vc precisa saber pra se dar bem no Illuvium Overworld,6547,450,75,Gustavo Nenesk,50200
29,iPRxo_T1740,2024-06-01T11:28:58Z,【Illuvium】遊戲打金、空投、新手全攻略！區塊鏈遊戲大規模空投來襲,2232,49,22,區塊鏈遊戲 - AJ GameFi Club,9660
30,kQ6RrzwsTjo,2024-06-15T09:29:20Z,Why did Illuvium do this?,1911,102,36,Polemos,1860
31,dI8cRTF7nDM,2024-05-28T12:00:40Z,Gaming Opportunity Of A Lifetime: Illuvium,471,34,2,Nijafe_Plays GameFi,2540
32,86irTjX47dc,2024-06-08T00:22:20Z,Illuvium Town Hall with Kieran Warwick! June 2024,1734,105,3,Illuvium+,1350
33,sLohy1UuFxY,2024-06-17T12:00:50Z,Drone Equipment Guide For Illuvium Testnet Airdrop,164,7,4,Nijafe_Plays GameFi,2540
34,qpuql709fgk,2024-06-15T21:31:35Z,GANHE MAIS QUE TODOS NO AIRDROP DO ILLUVIUM!,4281,284,78,Storming,9820
35,ZlyE3uLwVVk,2024-05-30T12:38:00Z,Comment participer au play to airdrop colossal d'Illuvium ?,1125,62,27,YoanGJ,8040
36,zEIaTD4UvYw,2024-06-15T12:05:32Z,Illuvium Yeni Airdrop Puanları Geldi! | Oyuna Başlamanın Tam Zamanı | İlluvium Türkçe,414,10,7,TURGOOD WEB3,3710
37,ZUz_L5rvaSY,2024-06-10T04:57:30Z,Illuvium Overworld $55000 Prize Hunting! | Illuvium Overworld Gameplay | Illuvium Airdrop,769,25,13,Web3 Gaming Tv,2100
38,3-5gAygdnMo,2024-06-18T14:00:03Z,Did Illuvium Land just flip the ILV Token?,1447,86,18,Scoriox,6420
39,vbNRprUOs_E,2024-05-28T14:00:48Z,Tier List of the best early game captures in Illuvium,2650,81,12,Scoriox,6420
40,LNIzmVekVcU,2024-06-19T15:00:16Z,ILLUVIUM - PRIMEIRAS IMPRESSÕES,8372,598,59,Zeus Ghostz MMORPGs,65500
41,5QLr-yqMW9M,2024-06-01T16:10:24Z,"CORRE ! Illuvium COMEÇOU, esse JOGO NFT vai pagar MUITO !!! Tutorial Iniciante ao Avançado + DICAS !",4902,428,49,Smirnokk - SNK DAO,13900
42,CkS1nsdZEKs,2024-06-13T12:00:20Z,Illuvium's Open Beta Testnet Brings Desired Changes,174,11,3,Nijafe_Plays GameFi,2540
43,QrfVDkcHrts,2024-06-02T00:15:03Z,Illuvium Airdrop Boost: New Rewards on Top of $1.6M ILV!,654,12,15,Jeff Losaria,1470
44,08EVXQbqgnc,2024-06-14T18:30:57Z,Losing the world's first dark holo illuvium,935,43,23,Polemos,1860
45,wFEo5vVkOHM,2024-06-11T09:16:28Z,Illuvium Consumables: Pop Spore - Geyyser - Reflect Pure Damage,173,6,0,Illuvihub,294
46,UfdEKg5npXE,2024-05-28T13:18:11Z,best drone chips for illuvium | overworld drone crafting guide,1296,50,13,Polemos,1860
47,x616KnPyTIU,2024-06-21T14:00:48Z,Noob's Guide to farming the Illuvium Airdrop - Super Easy & Simple,1725,78,15,Scoriox,6420
48,-A-9fxIjcSI,2024-06-10T18:55:30Z,Illuvium News Roundup: Essential Updates You Need to Know!,741,38,15,Viper_ilv,1010
49,-YxMpzs23Hw,2024-06-17T22:34:42Z,PASSO A PASSO ILLUVIUM FARM $$$,1942,151,17,Storming,9820
50,5QLr-yqMW9M,2024-06-01T16:10:24Z,"CORRE ! Illuvium COMEÇOU, esse JOGO NFT vai pagar MUITO !!! Tutorial Iniciante ao Avançado + DICAS !",4902,428,49,Smirnokk - SNK DAO,13900
51,ZUz_L5rvaSY,2024-06-10T04:57:30Z,Illuvium Overworld $55000 Prize Hunting! | Illuvium Overworld Gameplay | Illuvium Airdrop,769,25,13,Web3 Gaming Tv,2100
52,VNPYGX4iZAY,2024-05-28T16:17:11Z,🔥I BOUGHT  96 ILLUVIUM ILV Crypto Coins at $104 28 ! LAST CHANCE,31,0,0,DailyTrending007,4570
53,xXbUCHLMZmw,2024-06-08T18:52:57Z,Phantom Bounty Hunt 5 🔴 Illuvium Overworld Event - $1500 on the Line!,177,10,0,Paz ♊️ illuvination,1800
54,y61oSI8eSuY,2024-05-30T16:09:12Z,ILLUVIUM TO 10X (PLUS OTHER NEWS),44,2,3,LLCrypto,343
55,JGQOWn-RGnM,2024-05-28T10:00:07Z,🚨 ILLUVIUM (aka ILV) 🔥 LA PEPITE GAMING DU CPT GANG 👀 CE TOKEN NOUS RESERVE UNE BELLE SURPRISE 🎁,9288,1248,191,Crypto pour Tous,65000
56,KSx5UCqoWkU,2024-06-08T14:00:14Z,Polemos X Illuvium To Bring Mass Adoption Through Lending,146,11,8,Nijafe_Plays GameFi,2540
57,TBMnVOb1kqE,2024-06-12T22:10:00Z,Illuvium | Open Beta Testnet - The Mega Hunt | La Evolución de Dualeph | #dia 12,158,14,0,jagemetal,527
58,3Ql7u5pzk2M,2024-06-15T18:01:44Z,GUIA ILLUVIUM: Podes GANAR MUCHO DINERO ! Nuevos EVENTOS en este JUEGO NFT con GRAN AIRDROP !,970,60,21,EL REA,39500
59,YRl0AmcSq5A,2024-06-12T07:39:49Z,30 Hints at the illuvium Lore | Scene by Scene breakdown,167,18,2,illuvinomics - Godson,3070
60,8tt3AqF7AXg,2024-05-29T19:04:14Z,ILLUVIUM OVERWORLD | First Impresion 🔴 Crypto Game Learning & Play 💰 ILLUVIUM NFT,49,2,0,CosminCoX ,724
61,hG69D_gbobs,2024-06-13T22:09:18Z,Illuvium | Open Beta Testnet - The Mega Hunt | Objetivo Phosphorus | #dia 13,134,12,0,jagemetal,527
62,B6w2aBZoUTc,2024-06-16T23:09:14Z,Illuvium | Open Beta Testnet - The Mega Hunt  #dia 16 | Objetivo: Dark Holo,154,10,0,jagemetal,527
63,au4nAFYC-qs,2024-05-31T15:34:33Z,Illuvium Overworld How to play like a whale / Open Beta Gameplay,41,0,0,Story,5
64,q783pGgcsvU,2024-06-15T23:42:18Z,Beginners Guide to Illuvium Overworld Air-drop,178,6,4,Paid2Play,4810
65,tNm6fvhVbNg,2024-06-19T16:11:21Z,Illuvium: Holo Hunting Abyssal Basin Stage 3,124,4,4,Nijafe_Plays GameFi,2540
66,sXauPKmecUE,2024-06-03T12:00:51Z,The Hunt IS ON! Farm $ILV Now in Illuvium,491,23,9,Nijafe_Plays GameFi,2540
67,WUh1BBz1dl8,2024-06-17T01:05:59Z,BEST Way To Farm Airdrop Points! NEW Illuvium Update | Illuvium Overworld Guide | Illuvium Airdrop,3355,144,179,Web3 Gaming Tv,2100
68,f49sXbIVW0Q,2024-06-07T18:32:51Z,Illuvium: Overworld - How to Fuse illuvials? I Fused an Air Volante!,65,2,0,ethlizard,0
69,iD11A4TYCRM,2024-06-09T10:23:44Z,MAGMA ENCHANTER Easy Stage 3 Wins | Illuvium Overworld Guide | Illuvium Arena,2239,66,27,Web3 Gaming Tv,2100
70,L240Qr_5ACs,2024-06-14T02:01:46Z,Illuvium - How to Earn More Airdrop Points,195,3,0,GachaWade,92100
71,BqRhwq5uIvs,2024-06-01T09:57:02Z,"ILLUVIUM el MEJOR JUEGO NFT, pero...",820,32,26,COTETO,32800
72,esceRGZNtDQ,2024-06-04T16:49:58Z,🎮 JOUE et gagne de l'argent avec ILLUVIUM : présentation !,269,10,5,Dim Decrypt,10300
73,yiYb1tRVwAs,2024-06-18T22:12:33Z,NOVA CAMPANHA DA ILLUVIUM DANDO $15 MILHÕES - GUIA COMPLETO PARA GANHAR ESSE AIRDROP GRATUITAMENTE!,7040,351,40,Rodrigo Moura Crypto ,46100
74,FAl2HXufoLg,2024-05-28T04:02:06Z,Illuvium Open Beta Launch Day Tips! #Illuvium #Play2Earn #web3gaming,159,3,0,Bulldog1205,21000
75,NmFeIxQO4f8,2024-06-02T12:00:19Z,CORRE Começou o maior Play To Airdrop Grátis! Jogo Illuvium Lançou PAGANDO MUITO - Tutorial Completo,5013,274,45,Rex investe,10900
76,W40ST3pYj4o,2024-06-21T21:00:28Z,Estratégia Roubada no Illuvium Arena - Tutorial/Guia,1019,82,18,Gustavo Nenesk,50200
77,tdtCu2Uk65k,2024-06-11T23:32:06Z,Illuvium | Zero - DAY 63 - Level 1238,50,3,3,PherosisPK,90
78,BUxJzDpQNRc,2024-05-31T08:15:51Z,The Illuvium Mega Hunt,357,37,2,Illuvium,51600
79,KeSQJ8fu5_E,2024-06-12T20:01:35Z,3 COSAS que Debes Saber Sobre ILLUVIUM | NFT GAMES,104,2,2,Harold875,3130
80,Alv0ArAyMFM,2024-06-19T15:26:56Z,ILLUVIUM - MONTE A MELHOR COMP!,1224,124,35,Storming,9820
81,QDr5-CSeN20,2024-06-21T17:18:40Z,Illuvium Arena: The Ultimate Game Review & Gameplay Guide,189,18,4,Funjible Games,7060
82,bUjcVP3hcZ0,2024-06-03T17:20:35Z,Illuvium BETA (4) Video 8: How to farm effective,38,0,0,deergaming,7
83,xSAuJCP5Jco,2024-06-04T15:00:51Z,ILLUVIUM: GUIA COMPLETO PARA INICIANTES DE COMO JOGAR E GANHAR - JOGO NFT GRÁTIS PAGANDO MUITO,4409,196,41,Clem FF,57500
84,Z90zpb1EbjI,2024-05-30T12:00:23Z,This Made Illuvium Overworld Streaming Watchable,156,6,0,Nijafe_Plays GameFi,2540
85,smgzuUJggq8,2024-06-11T22:54:54Z,"Mais um dia de Farm Infinito - Beacon . Illuvium, Kaidro - Spirit Guardian",72,7,0,Coletor NFT,162
86,xRa_uRgmnhs,2024-06-05T05:20:00Z,ILLUVIUM BIG PUMP POTENTIAL IN MAY 2024‼️ ILV CRYPTO NEW GOAL‼️ ILLUVIUM GO TO GREAT PRICE,47,1,0,CryptosUS ,8760
87,h05rzg9DWA8,2024-06-07T09:51:10Z,Как быстро прокачать иллювиалов в Illuvium? Объединение иллювиалов.,459,18,22,Winnie,182
88,jslHPjAGibg,2024-06-19T15:00:48Z,How To Build OP Teams in Illuvium Overworld! Easy Airdrop Points Farming | Illuvium Overworld Guide,1056,54,12,Viper_ilv,1010
89,3Ca56CvQ6Z4,2024-05-30T16:48:45Z,Illuvium OPEN BETA + PLAY TO AIRDROP EXPLICADO + COMO COMEÇAR,1116,130,21,Lauro (CryptoNerd),2090
90,83ajlxfkAUg,2024-06-04T10:48:08Z,illuvium Airdrop - بازی کن توکن بگیر,1239,32,20,bluepoint crypto,1060
91,WlpDmIauVHA,2024-05-29T14:27:23Z,best ways to earn airdrop points | maximise your illuvium airdrop,3380,114,36,Polemos,1860
92,FeUTKmXK2RM,2024-06-16T15:56:31Z,Illuvium private Beta Testnet,4,0,0,The Rokn Gamer,12
93,jFjmpeTX-K8,2024-06-22T19:25:16Z,FINALS IS HERE DAY- 3  / TEAM YUKSHAS / Illuvium / SOULCITY ECHO RP #soulcity #illuvium !goal,2835,186,0,GEAR 69,2400
94,hYu9KxLxIwU,2024-06-02T14:47:45Z,How to Get the Most Money Playing Illuvium.,893,56,20,Paz ♊️ illuvination,1800
95,oaKfG2cWF3Q,2024-06-21T05:51:32Z,Illuvium Overworld HOLO HUNTING! $25 Million Airdrop Farming | Illuvium Overworld Gameplay,1153,42,6,Web3 Gaming Tv,2100
96,DMDz4dDBbyw,2024-06-04T16:19:40Z,Illuvium Beta 4 | How do you make Squizz laugh?,45,6,3,PherosisPK,90
97,C9TUZs-nH74,2024-06-07T11:06:03Z,"Illuvium Играй и зарабатывай, делим пул наград на 25 млн $",59,4,0,Ректабельность ,189
98,GjT-v47Fge8,2024-06-23T17:24:44Z,YK IT IS !! SIGI FINALS   / TEAM YUKSHAS / Illuvium / SOULCITY ECHO RP #soulcity #illuvium !goal,8300,362,1,GEAR 69,2400
99,dyxevq6T8s4,2024-05-25T17:17:14Z,Gear Stage1/3 Comparison | Illuvium Overworld,24,2,0,FlairPlaying,252
100,smgzuUJggq8,2024-06-11T22:54:54Z,"Mais um dia de Farm Infinito - Beacon . Illuvium, Kaidro - Spirit Guardian",72,7,0,Coletor NFT,162
101,xRa_uRgmnhs,2024-06-05T05:20:00Z,ILLUVIUM BIG PUMP POTENTIAL IN MAY 2024‼️ ILV CRYPTO NEW GOAL‼️ ILLUVIUM GO TO GREAT PRICE,47,1,0,CryptosUS ,8760
102,3Ca56CvQ6Z4,2024-05-30T16:48:45Z,Illuvium OPEN BETA + PLAY TO AIRDROP EXPLICADO + COMO COMEÇAR,1116,130,21,Lauro (CryptoNerd),2090
103,jslHPjAGibg,2024-06-19T15:00:48Z,How To Build OP Teams in Illuvium Overworld! Easy Airdrop Points Farming | Illuvium Overworld Guide,1056,54,12,Viper_ilv,1010
104,DJNcJ89WkGc,2024-05-28T20:55:06Z,Ya abrio ILLUVIUM para TODOS ! Nueva informacion del AIRDROP de ILLUVIUM ! Juego WEB3 con p2a,1806,102,49,EL REA,39500
105,83ajlxfkAUg,2024-06-04T10:48:08Z,illuvium Airdrop - بازی کن توکن بگیر,1239,32,20,bluepoint crypto,1060
106,L240Qr_5ACs,2024-06-14T02:01:46Z,Illuvium - How to Earn More Airdrop Points,195,3,0,GachaWade,92100
107,55M0doZU7V8,2024-05-30T12:00:07Z,【Illuvium】イルビウム：ついにスタート！エアドロ付きオープンβでプレイすればポイントゲット #556,256,1,0,29cueGuild,428
108,gEeAGxBk9Ng,2024-05-25T17:17:23Z,Useful Tip & Trick in 4 mins | Illuvium Overworld Guide,322,7,1,FlairPlaying,252
109,GjT-v47Fge8,2024-06-23T17:24:44Z,YK IT IS !! SIGI FINALS   / TEAM YUKSHAS / Illuvium / SOULCITY ECHO RP #soulcity #illuvium !goal,8300,362,1,GEAR 69,2400
110,BUxJzDpQNRc,2024-05-31T08:15:51Z,The Illuvium Mega Hunt,357,37,2,Illuvium,51600
111,X5KoJfkfdFU,2024-06-06T12:00:07Z,Illuvium Hướng Dẫn Chơi Game Miễn Phí Airdrop 1000$ Cho Người Mới,1572,21,35,Vỹ Million,25100
112,oaKfG2cWF3Q,2024-06-21T05:51:32Z,Illuvium Overworld HOLO HUNTING! $25 Million Airdrop Farming | Illuvium Overworld Gameplay,1153,42,6,Web3 Gaming Tv,2100
113,DMDz4dDBbyw,2024-06-04T16:19:40Z,Illuvium Beta 4 | How do you make Squizz laugh?,45,6,3,PherosisPK,90
114,WxGIrrvr6nU,2024-05-25T16:34:14Z,Illuvium Overworld Testing Economy Tracker,227,15,4,Nijafe_Plays GameFi,2540
115,tdtCu2Uk65k,2024-06-11T23:32:06Z,Illuvium | Zero - DAY 63 - Level 1238,50,3,3,PherosisPK,90
116,yD5kxUt6BxI,2024-06-04T11:51:26Z,Capturing the Most Important Illuvial | Illuvium Overworld,509,17,2,Paz ♊️ illuvination,1800
117,kx7MIQnUgp0,2024-06-06T19:08:44Z,Can this Illuvium Overworld Deck Beat Stage 3?,415,8,1,Paz ♊️ illuvination,1800
118,dyxevq6T8s4,2024-05-25T17:17:14Z,Gear Stage1/3 Comparison | Illuvium Overworld,24,2,0,FlairPlaying,252
119,j2JKlMUmgSI,2024-06-19T13:35:21Z,Catching a Synalph T5 Illuvial Stage 2 in DARK HOLO #illuvium😱🦞,92,5,1,Hans Gans,78
120,0fRmFziOqGk,2024-06-20T19:37:56Z,"🛑 - PARTICIPE AGORA DO MEGA AIRDROP DO ILLUVIUM, DE GRAÇA!",1760,196,24,Bitnoob,56000
121,04ZeeeE_Wao,2024-06-11T22:25:14Z,ILLUVIUM - MELHOR JOGO DO ANO GRÁTIS PASSO A PASSO TUTORIAL COMPLETO COMEÇANDO BEM JOGO NFT AIRDROP,20562,469,66,Seroy,35900
122,_q0Sjiw_wsY,2024-05-30T03:24:16Z,Illuvium - Wednesday night live stream,57,6,0,Crypto Quick Chat,72
123,lZBWNzzp60U,2024-06-02T18:50:37Z,Lets Win $15000 in Illuvium 🔴 Illuvium Overworld Mega Hunt Event!,350,17,5,Paz ♊️ illuvination,1800
124,rUkSkoNB0IQ,2024-06-06T05:32:10Z,GAMEPLAY / ILLUVIUM overworld with [BIG]Ben,9,0,0,[BIG]NastyCat,7
125,J8v3CvLwFwg,2024-06-18T10:53:01Z,КРИПТО ИГРА БЕЗ ВЛОЖЕНИЙ P2E - КАК ЗАРАБОТАТЬ ИГРАЯ В ILLUVIUM,2595,156,109,W3BGODS - NFT x P2E КРИПТО ИГРЫ,3130
126,TagmcG7j1Z8,2024-06-07T17:26:17Z,Illuvium Mejores equipos para Stage 3,322,4,6,Proteus Games,393
127,LMYXKw4Eyms,2024-05-30T02:56:25Z,Charting with Crypto Hotep | $ILV (Illuvium),18,2,1,Trader Crypto Hotep,51
128,1mwy-YkBhXw,2024-06-08T01:32:14Z,Illuvium - Farming for Airdrop Rewards | Ways to Earn in Testnet Version (Tagalog),312,9,7,GachaWade,92100
129,Ai3dyKso6TY,2024-06-11T10:38:59Z,Illuvium ilv Price Prediction For Bull Run | ilv Coin Prediction For 2024 and 2025,149,3,2,Trading Rocket7393,4330
130,jsQt0XV-Tfs,2024-05-30T18:47:57Z,ILLUVIUM OPEN BETA LIBERADO A TODOS COMO FICAR ELEGIVEL,308,20,3,INVESTCHE,7810
131,xyPhKplPlsQ,2024-06-18T22:25:50Z,Illuvium | Open Beta Testnet - The Mega Hunt  #dia 18 | Objetivo: Dark Holo,103,3,0,jagemetal,527
132,aWY8VkM3G-w,2024-06-18T13:17:09Z,🔴 JOGANDO ILLUVIUM... Outros Games e Assuntos Web3!,477,51,0,ANTARES ESPECULADOR,31400
133,h05rzg9DWA8,2024-06-07T09:51:10Z,Как быстро прокачать иллювиалов в Illuvium? Объединение иллювиалов.,459,18,22,Winnie,182
134,QJ0yP8TivP4,2024-06-01T23:41:41Z,Illuvium | Open Beta Testnet - Dia #4 | The Mega Hunt - 550 ILV en premios,231,11,0,jagemetal,527
135,SMsCXcgpC-s,2024-05-29T23:14:08Z,GAMEPLAY / Illuvium Beta 4 with [BIG]NastyCat,17,0,0,[BIG]NastyCat,7
136,Jc6hujjjTFo,2024-05-30T16:03:51Z,Illuvium gameplay Live,16,2,0,Scythe,46
137,ye34yFlXQu8,2024-05-28T11:12:02Z,Как получить AIRDROP ILLUVIUM? ВАЖНЫЕ НОВОСТИ,572,22,16,Winnie,182
138,gjhRta9ycRk,2024-06-14T00:03:58Z,New games are coming to Illuvium sooner than you think | The Download Illuvium News E47,828,45,9,Scoriox,6420
139,zjjf_H541Ek,2024-06-20T17:36:39Z,FINALS IS HERE DAY- 1  / TEAM YUKSHAS / Illuvium / SOULCITY ECHO RP #soulcity #illuvium !goal,2287,156,0,GEAR 69,2400
140,C9TUZs-nH74,2024-06-07T11:06:03Z,"Illuvium Играй и зарабатывай, делим пул наград на 25 млн $",59,4,0,Ректабельность ,189
141,n1A03CmhhSk,2024-06-03T12:59:20Z,Eye POPPING Leaks | May Reactions | ILLUVIUM,170,15,6,OskaMattGaming- Web 3,1630
142,K1c8pUKIqZk,2024-06-10T12:00:17Z,"[Illuvium] Hướng Dẫn Kiếm ETH Sepolia Testnet Miễn Phí Chơi Illuvium Và Chi Tiết ""Play To Airdrop""",2603,27,31,DIF GameFi,15000
143,FeUTKmXK2RM,2024-06-16T15:56:31Z,Illuvium private Beta Testnet,4,0,0,The Rokn Gamer,12
144,0MInvr0gy3Q,2024-06-14T23:05:33Z,Illuvium | Open Beta Testnet - The Mega Hunt  #dia 14 | Objetivo: Holo,185,8,4,jagemetal,527
145,AJlbjgMjtVs,2024-06-08T17:03:02Z,Illuvium,3,1,0,Tailless ♊️,7
146,f-j6QFuDpek,2024-06-16T17:35:22Z,"Illuvium - Всё про Airdrop , который уже составляет 3млн$! Советы / Гайд по игре!",390,17,8,Bruel Games,4940
147,1wDSLH7QrfM,2024-06-07T06:55:56Z,Illuvium Overworld $55000 Prize Hunting! | Illuvium Overworld Gameplay | Illuvium Airdrop,1084,41,8,Web3 Gaming Tv,2100
148,POVrWc0EbP8,2024-05-30T19:00:16Z,ILLUVIUM: Доступ открыт! За что насыпят? 💰💸,636,21,24,Крипто Тестер P2E,2050
149,GmLfWVdQPFM,2024-06-12T21:14:20Z,How much Money Can we Spend on Shards in Illuvium?,368,16,15,Paz ♊️ illuvination,1800
150,XFkQib2x_H0,2024-06-06T01:42:35Z,Get hyped!! Illuvium officially going to mainnet July 25th! Illuvium live stream,61,7,6,Crypto Quick Chat,72
151,DMDz4dDBbyw,2024-06-04T16:19:40Z,Illuvium Beta 4 | How do you make Squizz laugh?,45,6,3,PherosisPK,90
152,esceRGZNtDQ,2024-06-04T16:49:58Z,🎮 JOUE et gagne de l'argent avec ILLUVIUM : présentation !,269,10,5,Dim Decrypt,10300
153,xRa_uRgmnhs,2024-06-05T05:20:00Z,ILLUVIUM BIG PUMP POTENTIAL IN MAY 2024‼️ ILV CRYPTO NEW GOAL‼️ ILLUVIUM GO TO GREAT PRICE,47,1,0,CryptosUS ,8760
154,f49sXbIVW0Q,2024-06-07T18:32:51Z,Illuvium: Overworld - How to Fuse illuvials? I Fused an Air Volante!,65,2,0,ethlizard,0
155,sx7UOp6nz4E,2024-05-27T12:00:55Z,【Illuvium】イルビウム：イルビアル捕獲失敗しがちな たにやんに代わり、特別ゲストの実演に注目！ #555,188,5,2,29cueGuild,428
156,Wkzt9jHDpsA,2024-06-07T23:11:32Z,ILLUVIUM - Como fazer Claim de ETH + DICAS para otimizar o PLay 2 airdrop.,807,61,10,Lauro (CryptoNerd),2090
157,QDr5-CSeN20,2024-06-21T17:18:40Z,Illuvium Arena: The Ultimate Game Review & Gameplay Guide,189,18,4,Funjible Games,7060
158,zHRo_iqUhVY,2024-06-05T21:12:59Z,Illuvium | Open Beta Testnet | The Mega Hunt Dia #5 | Atrapando a todos los Illuvials,129,6,0,jagemetal,527
159,J8v3CvLwFwg,2024-06-18T10:53:01Z,КРИПТО ИГРА БЕЗ ВЛОЖЕНИЙ P2E - КАК ЗАРАБОТАТЬ ИГРАЯ В ILLUVIUM,2595,156,109,W3BGODS - NFT x P2E КРИПТО ИГРЫ,3130
160,oaKfG2cWF3Q,2024-06-21T05:51:32Z,Illuvium Overworld HOLO HUNTING! $25 Million Airdrop Farming | Illuvium Overworld Gameplay,1153,42,6,Web3 Gaming Tv,2100
161,QK379bOaVEI,2024-06-12T11:00:24Z,Illuvium | Chi tiết cách bắt pet - Xếp đội hình và một số tips,861,11,25,zBlue,3930
162,w7Lqw7r6ct0,2024-06-01T07:38:35Z,Illuvium | Open Beta Testnet | Que versión jugar?,254,24,14,jagemetal,527
163,nkfK3_qeeQc,2024-06-07T18:46:14Z,Cinematic Trailer Is HERE!! | ILLUVIUM,77,13,4,OskaMattGaming- Web 3,1630
164,tdtCu2Uk65k,2024-06-11T23:32:06Z,Illuvium | Zero - DAY 63 - Level 1238,50,3,3,PherosisPK,90
165,jotaCy-WZRQ,2024-06-01T14:00:37Z,GameFi Rundown E46: Illuvium Testnet Launches and Polemos Builds Lending System,320,26,13,Nijafe_Plays GameFi,2540
166,BUxJzDpQNRc,2024-05-31T08:15:51Z,The Illuvium Mega Hunt,357,37,2,Illuvium,51600
167,GjT-v47Fge8,2024-06-23T17:24:44Z,YK IT IS !! SIGI FINALS   / TEAM YUKSHAS / Illuvium / SOULCITY ECHO RP #soulcity #illuvium !goal,8300,362,1,GEAR 69,2400
168,TkadHPkSOs4,2024-06-03T00:48:33Z,Illuvium Open Beta Testnet | Earn Points for Airdrop Rewards (Tagalog),153,6,3,GachaWade,92100
169,JCURlzyg6Eo,2024-06-01T12:27:39Z,Illuvium Open Beta / Başlangıç Rehberi / 2 Milyon 💲 Airdrop!,2608,24,12,Play2EarnTR,2660
170,DiE7rm82zeM,2024-06-20T00:26:38Z,🔴LIVE ILLUVIUM FREE PLAY TO AIRDROP + SOUL LAND NFT GIVEAWAY | PARAPOL GCASH SA LUCKY WINNERS,915,74,10,ALROCK,64000
171,ZivZG8kq1H0,2024-05-29T12:15:46Z,Illuvium Hunt for AIRDROP Starts NOW! Open Beta Testnet 🔴 Gameplay Guide,341,12,2,Paz ♊️ illuvination,1800
172,t6fyvCaR7rg,2024-05-31T20:30:03Z,Bounty Hunt 3 | Illuvium Overworld Event! PrizePool: $1000!!,208,8,2,Paz ♊️ illuvination,1800
173,DYWaFJNPz4o,2024-06-19T21:35:06Z,Illuvium | Open Beta Testnet - Speedrun Lands | Objetivo: Dark Holo #dia 19,127,5,0,jagemetal,527
174,hx6EsjHsnEc,2024-06-21T01:58:48Z,Illuvium Open Beta Testnet | Let's Find More Dark Holo (Tagalog),99,3,3,GachaWade,92100
175,2KkfTRf4AOM,2024-05-30T03:03:01Z,AIRDROP STARTS NOW! ILLUVIUM OPEN BETA DAY 1 #illuvium #gaming #openbeta #openworld #nft,33,7,0,JustJanwoo,150
176,Qu29NoNYrME,2024-06-21T21:46:34Z,Illuvium | Open Beta Testnet - Completando Todo el set de Illuvials | Objetivo: Dark Holo #dia 21,109,2,0,jagemetal,527
177,qZGG-FOE6W4,2024-06-22T20:16:21Z,Illuvium Open Beta Testnet | Lucky Find of Holo and Dark Holo in One Run (Tagalog),98,4,0,GachaWade,92100
178,IBgeD0G2cao,2024-05-31T19:37:39Z,Secretly OP Teleporter Spots in Illuvium  #gaming #illuvium #illuviumoverworld  #nftgaming,517,11,0,Viper_ilv,1010
179,LFkZQDaRTtc,2024-06-20T01:50:24Z,Illuvium live gameplay! Wednesday night hunt!,36,5,0,Crypto Quick Chat,72
180,TFRFOAN74F8,2024-06-19T19:52:44Z,LIVE ON:  BLACK DESERT 2.0 E ILLUVIUM,3296,166,0,Zeus Ghostz MMORPGs,65500
181,f-L5yKCNH2o,2024-06-19T02:01:17Z,LIVE ON:  TEMOS QUE PEGAR !ILLUVIUM,2016,109,0,Zeus Ghostz MMORPGs,65500
182,FZGbem4fB2M,2024-06-17T12:55:16Z,Illuvium private Beta Testnet,5,0,0,The Rokn Gamer,12
183,JENKyKQQji0,2024-06-06T02:45:07Z,ILLUVIUM! JUEGAZO NFT GRATIS!! AIRDROP A PUNTO DE EXPLOTAR!! SIN INVERSION!✅,52,5,0,Elnato.07,6810
184,0J0F4DndKK8,2024-06-06T23:00:00Z,ILLUVIUM - Illuvium Arena - LESSON 1,14,2,0,Metaverse Gamer,814
185,aZKj4uTIrdU,2024-06-22T18:41:54Z,Phantom Bounty Hunt #7 🔴 Illuvium Overworld Event - $1500,169,3,0,Paz ♊️ illuvination,1800
186,XWOs5qLi830,2024-06-04T12:45:04Z,"Săn airdrop illuvium - Game bom tấn, chơi miễn phí lại được thưởng airdrop",1963,73,43,Airdroping,4410
187,wk6dEUA4tZo,2024-06-16T23:00:28Z,MAIOR Airdrop 2024 pool de 20.000 $ILV no Open Beta ️️ [ Illuvium ] +DICAS 🛑 | LIVE |,319,11,0,Explanador Cripto,397
188,Wkzt9jHDpsA,2024-06-07T23:11:32Z,ILLUVIUM - Como fazer Claim de ETH + DICAS para otimizar o PLay 2 airdrop.,807,61,10,Lauro (CryptoNerd),2090
189,3IUm1Sw4Mzo,2024-05-25T13:27:48Z,"""Tuto"" overworld illuvium",501,35,28,Alex illuvium,58
190,F6a5yd-4Mtk,2024-06-13T05:57:39Z,Lesser Aapon - Earth - Empath #illuvium #fightforeth #gaming #web3gaming,313,27,0,Illuvium,51600
191,PAoVp9tmT1Q,2024-06-10T14:34:52Z,"Crypto Futures: ARB’s Rise, Bitcoin’s Calm Before the Storm & Illuvium’s Launch | June 10, 2024",37,1,0,Cryptopolitan,49800
192,D9Oat9_uX90,2024-06-03T03:15:08Z,"Video 12 Illuvium:  ""Fuse"" 3 identical Illuvials from lv.2 to lv.3 ( Nâng cấp Quái vật )",182,5,0,Cộng đồng Game NFT  Airdrop ,65
193,KHcxllit5m8,2024-06-11T07:02:56Z,Earn Big with Illuvium! 💰 $22 Million Giveaway for Players! #p2e @InspectorMindblow,24,3,0,Mindblow Bites,73
