,Video ID,Published Date,Title,View Count,Like Count,Comment Count,Channel Title,Subscriber Count
0,JEqpC-O4gc4,2024-07-27T12:17:06Z,LONG-AWAITED Play to Earn Crypto Game is OUT! (Illuvium First Look),5448,125,88,Inspector Mindblow,78600
1,W3ZOGzhJD8k,2024-07-27T03:35:51Z,Illuvium Free-2-Play Quick Guide!,2094,61,28,Bulldog1205,21200
2,k8KFbE8UhiE,2024-07-28T14:53:49Z,Airdrop and other Ways to Earn in Illuvium,1013,52,14,Illuvination,2100
3,zsuoYxxonWA,2024-07-21T19:13:20Z,Illuvium | Enter a Universe of Games | Official Gameplay Launch Trailer,14237,897,118,Illuvium,51900
4,MsPPb-breK4,2024-07-18T21:00:12Z,Illuvium - Official Cinematic Release Date Trailer,32444,1444,424,IGN,18300000
5,JokPVlHVdT8,2024-07-26T07:42:00Z,GOING FOR WORLD FIRST | Illuvium Overworld Day 1| Illuvium Overworld Gameplay,3124,57,25,Web3 Gaming Tv,2470
6,gnPW81upBRI,2024-07-12T12:00:46Z,I Have a Completely NEW Perspective on Illuvium,3121,111,50,Scoriox,6690
7,ZZ_9468Zb1U,2024-07-18T23:40:01Z,"We grill the CEO of Illuvium, the NUMBER 1 CRYPTO GAME | Kieran Warwick",3106,221,61,Scoriox,6690
8,oE87BMX6OGE,2024-07-27T09:41:51Z,Illuvium Overworld - 24Hours Gameplay Experience | My First Feedback (Tagalog),371,10,7,GachaWade,91900
9,X81rAA1kclE,2024-07-06T05:49:07Z,Illuvium 2024 Review & Overview: Stunning Blockchain RPG with NFTs & Gameplay Insights!,3856,36,5,Itemswap,71900
10,Y6Ng_7o9oM4,2024-07-19T14:03:32Z,Illuvium (ILV) is a $500 coin (currently $66.16),4427,79,83,Crypto With James,66500
11,1OQVkrSuIho,2024-07-20T21:00:00Z,Accumulate or Sell? Illuvium's Current Market Insights,672,42,2,Cultivate Crypto,32400
12,4o1z3M_lCAY,2024-07-18T11:30:02Z,What is illuvium?,1340,69,21,Polemos,2010
13,vxfyK4fZr-E,2024-07-28T10:01:01Z,The ULTIMATE Illuvium Gauntlet Beginners Guide,494,38,9,Scoriox,6690
14,B5y5LNE-kss,2024-07-16T11:00:14Z,Learn to hunt Illuvials like an expert in 5 minutes - Illuvium Guide,773,39,18,Scoriox,6690
15,LTb3zsrgx8M,2024-07-12T22:11:26Z,Illuvium Overworld Tutorial Walkthrough: Step by Step Guide for Beginners,194,6,2,Jeff Losaria,1510
16,Bda8pf_bkbI,2024-07-29T00:07:51Z,Lets Go for Rank #1 in the Illuvium Ascendant Arena,1061,40,0,Illuvination,2100
17,dU-o5ZH8RXU,2024-07-24T18:00:16Z,The ULTIMATE Illuvium Zero Beginners Guide,5069,170,44,Scoriox,6690
18,vXakQw8Qza0,2024-07-19T00:00:34Z,What is illuvium,424,11,1,Polemos_Action,4090
19,5CNqZlPhsgk,2024-07-28T15:00:04Z,ILLUVIUM - FINALMENTE FOI LANÇADO,3306,222,23,Zeus Ghostz MMORPGs,67300
20,jaLePoMlqT4,2024-07-18T07:33:05Z,TOP 7 Illuvium Zero Open Beta FAQs!,544,27,10,Rockon,101
21,_YbdsFoTP-0,2024-07-05T19:18:51Z,Ultimate Beginner’s Guide to Illuvium Overworld: Fast-Track to Mastery,579,28,18,Jeff Losaria,1510
22,C1z1S8oCYl4,2024-07-21T12:00:20Z,Illuvium CEO Townhall Recap. July 2024,550,39,16,Nijafe_Plays GameFi,2610
23,5uME6gnwPVs,2024-07-05T10:21:59Z,Best way to earn airdrop points season 2 Illuvium,2048,84,62,Polemos,2010
24,n1KnNA9oRxg,2024-07-02T12:00:48Z,Illuvium's SECRET daily player count revealed,2417,125,29,Scoriox,6690
25,fL6A3ryIMFE,2024-07-05T12:00:44Z,Watch this analysis BEFORE you Stake ILV - Illuvium Revdis,1395,74,21,Scoriox,6690
26,OBOI4rrOjek,2024-07-16T06:34:47Z,Illuvium Overworld and Arena! $20 Million Airdrop Campaign | Illuvium Overworld Gameplay,2532,72,26,Web3 Gaming Tv,2470
27,RqTTey9NdTk,2024-07-28T11:00:21Z,Illuvium: How to Get Free XP for Leveling and Fusing your Illuvials!,70,5,1,Tales from the Crypt Mancer,1600
28,K4Qv8_1xA50,2024-07-09T12:00:30Z,Simple guide to farming season 2 of the Illuvium Airdrop,1639,67,36,Scoriox,6690
29,WAJTOdTRHDk,2024-07-02T08:14:30Z,Illuvium Open Beta Testnet | Start of Season 2 Mission (Tagalog),208,5,1,GachaWade,91900
30,PKxBAb6mI4U,2024-07-17T12:00:32Z,I Played Illuvium's Gauntlet: First Impressions,571,51,27,Nijafe_Plays GameFi,2610
31,7ykvARr7uT8,2024-07-02T06:41:32Z,Illuvium Overworld HUGE UPDATES! $25 Million Airdrop Farming | Illuvium Overworld Gameplay,1223,23,20,Web3 Gaming Tv,2470
32,J0SNEVE3OsM,2024-07-08T11:29:46Z,Illuvium NFT Game Overview | Huge Airdrop | Free To Play Mobile Game On Immutable Blockchain,142,8,1,Warrior Lion Gaming,2360
33,Ct39jleBGsU,2024-07-25T17:19:42Z,Illuvium Launch Party w/ Kieran Warwick,1441,172,32,Dollar Cost Crypto,33400
34,hZWv0BRPmGQ,2024-07-09T05:42:23Z,Illuvium Overworld AIRDROP FARMING! $20 Million Airdrop Campaign | Illuvium Overworld Gameplay,960,23,8,Web3 Gaming Tv,2470
35,aeT3rBfmeRU,2024-07-03T12:00:03Z,Illuvium Staking Rewards Have Ended. Here’s What Happens Now!,732,52,22,Nijafe_Plays GameFi,2610
36,wqnLUvI1r7g,2024-07-18T03:45:59Z,Illuvium Overworld and Arena! $20 Million Airdrop Campaign | Illuvium Overworld Gameplay,3156,121,24,Web3 Gaming Tv,2470
37,OC6BJJvpr6o,2024-07-27T12:29:25Z,ILLUVIUM - COMO FARMEI MUITO EM 30 HORAS!,3311,237,31,Storming,11000
38,6PP646tR4TQ,2024-07-28T09:52:30Z,Illuvium - Buying Illuvial | How to Know Which One Is Better? | Illuvidex Guide (Tagalog),95,6,4,GachaWade,91900
39,l2GGSuPRifQ,2024-07-12T03:36:06Z,HUGE Illuvium Zero Update Overview for Open Beta!!,1209,49,28,Rockon,101
40,TRAqEgY_s88,2024-07-26T20:03:17Z,Illuvium AirDrop: Tutorial e Dicas Como Jogar (COMECE CERTO),1777,153,15,Ramon Cunha - O Pulo do Gato,39500
41,Z4Sf30yGi0o,2024-07-04T09:10:00Z,"Dominate the New Illuvium Patch! Review, Tips and Tricks! | Illuvium Overworld Guide",789,40,18,Viper_ilv,1100
42,NIBpEKrXYCI,2024-07-11T12:00:31Z,Missions Will Hurt The Illuvium Economy. Unpopular Opinion,309,19,12,Nijafe_Plays GameFi,2610
43,5z3-vL-hJnY,2024-07-11T04:36:40Z,Illuvium SURVIVAL MODE Wave 30! $20 Million Airdrop Campaign | Illuvium Overworld Gameplay,1123,23,5,Web3 Gaming Tv,2470
44,G8LNvUqUt0g,2024-07-28T12:00:39Z,Must-Know ILLUVIUM Overworld Tips for Beginners,64,6,1,OskaMattGaming- Web 3,1650
45,M_52DASCtJo,2024-07-21T13:47:18Z,Illuvium Beginners Guide - How the basic affinities work,78,5,2,Crypto Quick Chat,107
46,q9GF0hO4-YM,2024-07-26T06:00:32Z,Illuvium: Official Cinematic | Collectible RPG & Autobattler Game,4115,434,49,Illuvium,51900
47,7BOEhisVCdg,2024-07-28T13:49:19Z,PROBANDO ILLUVIUM - DESCARGALO PARA ENTRAR EN SORTEO DE SKINS,834,24,0,Navalha - Freestyle Gaming,360000
48,myTwgnahaRo,2024-07-05T05:13:07Z,Illuvium Overworld AIRDROP FARMING! $20 Million Airdrop | Illuvium Overworld Gameplay,594,22,8,Web3 Gaming Tv,2470
49,YDyS9wmKAx4,2024-07-25T17:00:32Z,Move your Crypto onto IMX from Metamask or CEX to play Illuvium,889,35,14,Scoriox,6690
50,kLZj8nzZtls,2024-07-05T18:53:47Z,Illuvium Yeni Sezon Başladı İlk Sezon Ödülleri Açıklandı Yeni Sezonu Kaçırma 10.000 $ILV Ödül,3298,65,8,Berkay Berksun,32900
51,UgD2ilE3O18,2024-07-06T14:20:00Z,Illuvium - Nova season desse JOGO NFT que vai pagar mais de R$3 MILHÕES !! Tutorial + DICAS !!!,1744,101,20,Smirnokk - SNK DAO,14500
52,LIMRMxUsWik,2024-07-21T14:23:58Z,Illuvium Zero Beginner's Guide!,489,23,9,Rockon,101
53,yRknne0XF2Q,2024-07-28T20:39:42Z,DICAS PARA GANHAR PONTOS DO PLAY TO AIRDROP ILLUVIUM   $12 500 MILHÕES,281,23,7,Torugão Crypto,21500
54,QMT4-r-HYX8,2024-07-19T12:00:33Z,Kieran Says Illuvium Zero May Be The Dark Horse In The Race,166,11,0,Nijafe_Plays GameFi,2610
55,S9GJrzMJ5fE,2024-07-15T12:45:01Z,This Changed the Whole Gameplay Loop in Illuvium,821,41,7,Illuvination,2100
56,tP0pUzToumY,2024-07-15T05:55:18Z,Illuvium - How to Earn in Different Ways | Best Approach Starting July 25th Mainnet (Tagalog),243,6,8,GachaWade,91900
57,Jh1zWf6qDTo,2024-07-13T05:23:22Z,Illuvium - Gauntlet First Look Premier! Alpha play by Core Contributors!,219,11,1,ZenMasterSoda,13
58,7BOEhisVCdg,2024-07-28T13:49:19Z,PROBANDO ILLUVIUM - DESCARGALO PARA ENTRAR EN SORTEO DE SKINS,834,24,0,Navalha - Freestyle Gaming,360000
59,vxfyK4fZr-E,2024-07-28T10:01:01Z,The ULTIMATE Illuvium Gauntlet Beginners Guide,494,38,9,Scoriox,6690
60,DconzuwxcgY,2024-06-30T12:46:08Z,Illuvium Combat 101: Positioning Techniques to Dominate the Field! | Illuvium Overworked Guide!,692,31,6,Viper_ilv,1100
61,j8yJkV-n7eI,2024-07-18T16:51:36Z,Illuvium (ILV) Crypto Coin Is About To Break The Wedge!,89,2,1,moon333,27200
62,Gh2ZrOeAXKU,2024-07-26T06:49:35Z,FULL Illuvium Guide - From Beginner To ILV Expert,860,43,13,Illuvination,2100
63,rZEC-8cbkRY,2024-07-28T23:00:23Z,Illuvium: How to Help Ensure You Catch Those Valuable Illuvials!,32,5,2,Tales from the Crypt Mancer,1600
64,zLJePBOTleo,2024-07-12T04:12:56Z,Illuvium Overworld and Arena! $20 Million Airdrop Campaign | Illuvium Overworld Gameplay,877,23,11,Web3 Gaming Tv,2470
65,JW19se_aoyo,2024-07-23T11:00:25Z,7 Signs Illuvium will be a MASSIVE Success,1449,104,62,Scoriox,6690
66,Tvt6SG9ZhUs,2024-07-16T14:50:51Z,Illuvium (ILV) Crypto Coin Is About To Break The Wedge!,206,6,0,moon333,27200
67,u-0VRIDIOPc,2024-07-20T02:13:01Z,Illuvium - Official Cinematic Release Date Trailer - Reaction,6,0,0,Xsezz,7500
68,V85TXp69r_g,2024-07-05T00:32:50Z,Illuvium Overworld AIRDROP FARMING! $20 Million Airdrop | Illuvium Overworld Gameplay,190,4,2,Web3 Gaming Tv,2470
69,uMgLW9BX0so,2024-07-26T15:46:25Z,Farming FUELS already! Illuvium Zero,105,4,5,JC3,628
70,HUoIIgxOV7A,2024-07-21T23:52:26Z,Illuvium Zero | gameplay (pc videogame),22,1,0,Play2it,499
71,5HEDlI2HZuU,2024-07-28T00:22:31Z,This Felt Unreal #illuvium #worldfirst,552,22,1,Illuvination,2100
72,j5fsXcIuaXg,2024-07-11T15:40:58Z,Ascendant Arena Pro Guide - The Illuvium Tutorial to Dominate,600,34,9,Illuvination,2100
73,qNtqo_RKKGM,2024-07-12T15:49:27Z,"Illuvium (ILV) Crypto Coin Update! | 12th July, 2024",155,13,0,moon333,27200
74,KNzOYLuL254,2024-07-21T16:08:03Z,Illuvium Official Cinematic Release Date Trailer Reaction,8,1,0,globoireactz,4000
75,4D0oOrrT6OQ,2024-07-16T12:48:05Z,Adventure on: Illuvium | Official Music Video,164,19,7,Illuvination,2100
76,qqkGb1DVqB0,2024-07-26T22:17:47Z,Illuvium is real! Day 1 Live stream!,83,3,2,Crypto Quick Chat,107
77,kPAMDCkMvtk,2024-07-26T21:15:03Z,ILLUVIUM LANÇAMENTO OFICIAL GRATIS PAGANDO 2 MILHOES DOLARES POR MES #illuvium #illuviumoverworld,929,38,20,Seroy,36700
78,jnTHZ0caOBY,2024-07-25T21:07:10Z,Illuvium Zero - Tier One Boogie,119,9,4,Metaverse News 1,689
79,3uWqg5gYBtQ,2024-07-13T18:00:01Z,Illuvium Airdrop - Best way to farm Points in Overworld,229,5,1,Cryptocat-Guru,1160
80,yVuik9zfw90,2024-07-27T18:45:03Z,"🛑 - NOVO AIRDROP DE 14MILHÕES NO ILLUVIUM, COMO PARTICIPAR?!",739,73,11,Bitnoob,57800
81,Soy0fpI2cy8,2024-07-04T23:50:09Z,Gauntlet will drive Mass Adoption for Illuvium | The Download Illuvium News E50,992,64,17,Scoriox,6690
82,aRXrqjtg4k0,2024-07-06T20:24:50Z,"Airdrop FREE no Illuvium! Season 1 PAGOU, Bora farmar a Season 2!!",680,66,16,Ayrton TV,1370
83,kZLXoGyWNKw,2024-07-17T20:17:12Z,Wave 40 in Illuvium Survival (1 Million Airdrop Points) is Possible Today!!,1350,37,2,Illuvination,2100
84,89zrpXNAh_Q,2024-07-25T12:28:36Z,Illuvium Zero Launch quick tips!,121,7,2,Crypto Quick Chat,107
85,Zzp52INPtpA,2024-07-20T15:00:26Z,"GHOSTZ NEWS - ILLUVIUM, DIABLO 4, PATH OF EXILE, DRAKANTOS, TREE OF SAVIOR, UNCECEMBER, LAST EPOCH",3729,420,27,Zeus Ghostz MMORPGs,67300
86,Y8NaR9RxmWU,2024-07-28T10:04:44Z,Illuvium zero Walkthrough,29,2,0,Crypto House Husband,14
87,0u1S3FHriYk,2024-07-14T20:29:31Z,Illuvium Zero gameplay - GogetaSuperx,125,0,0,Gogeta Superx,4990
88,2tYefsPesd0,2024-06-29T17:38:35Z,Effortless Illuvial Leveling: Get Powerful Quickly! #illuvium #illuviumoverworld  #gaming,506,7,0,Viper_ilv,1100
89,HMddRYRQCxI,2024-07-02T17:00:20Z,ILLUVIUM se REINICIO ! Nueva oportunidad para NUEVOS JUGADORES ! Como funciona el NUEVO AIRDROP,799,43,10,EL REA,39600
90,yn2ag3ryxVg,2024-07-29T14:46:07Z,🔴 Stage 3 Illuvium Overworld Runs then Illuvium Arena | Wave 40 Possible today?,50,8,0,Illuvination,2100
91,2btnsRXTlE0,2024-07-11T22:00:02Z,Adoredo  #illuvium #gameplay #ilv,196,9,0,Illuvination,2100
92,4cEYYf7tc-s,2024-07-26T02:49:30Z,ILLUVIUM APÓS 8 HORAS - REALIDADE,5401,288,48,Storming,11000
93,X6Mdlt78Cdw,2024-06-30T12:09:01Z,Give Weapon Upgrades #illuvium #gameplay #games,533,6,0,Illuvination,2100
94,K5wu3lqyECc,2024-07-18T11:31:13Z,Illuvium -Gauntlet - Early Access First look,43,1,0,ZenMasterSoda,13
95,O3eFYcfTzhc,2024-07-12T16:11:17Z,Illuvium guntlet mode,16,1,0,hisapio,6
96,rC2SRHo2_aA,2024-07-26T06:10:12Z,Long-Awaited Ethereum Game Illuvium Launches on Epic Store!,34,0,0,Lets Talk ETH,0
97,OfKmg3D9lAA,2024-07-18T22:04:26Z,Illuvium на PC  в 4K - Part 8,125,0,0,MisterGame999,67500
98,9MqJdr6WyK0,2024-07-26T10:00:08Z,How will gamers play illuvium,431,13,0,Polemos,2010
99,HzjMVB-paWg,2024-07-06T22:07:15Z,"+ 282 DÓLARES NO AIRDROP DA ETHER.FI PARA TODOS! CLAIM JUPITER, ILLUVIUM, DOP, PARCL, ZKSYNC, E +!",6238,476,81,Rodrigo Moura Crypto ,49700
100,aG1DCZneY7E,2024-07-02T00:45:00Z,Illuvium Open Beta Season 2 July 1st New Patch airdrop Play to earn Youtube gameplay,26,0,0,Wakandian ,15
101,HMddRYRQCxI,2024-07-02T17:00:20Z,ILLUVIUM se REINICIO ! Nueva oportunidad para NUEVOS JUGADORES ! Como funciona el NUEVO AIRDROP,799,43,10,EL REA,39600
102,jW_fVk4b4H0,2024-07-25T16:16:36Z,next illuvium game?,242,5,0,Polemos,2010
103,sT7bvM4dIAM,2024-07-24T02:18:37Z,MINIMUM Team Required For Overworld | Stage 1-3 | Illuvium Overworld Guide | Illuvium Airdrop,1781,79,45,Web3 Gaming Tv,2470
104,S1Ej5zviw_4,2024-07-29T12:44:34Z,Illuvium | Open Beta Mainnet | Overworld + Arena + Zero | Gameplay en español #5,12,0,0,jagemetal,596
105,HzjMVB-paWg,2024-07-06T22:07:15Z,"+ 282 DÓLARES NO AIRDROP DA ETHER.FI PARA TODOS! CLAIM JUPITER, ILLUVIUM, DOP, PARCL, ZKSYNC, E +!",6238,476,81,Rodrigo Moura Crypto ,49700
106,ldcyDnbxyG4,2024-07-27T09:59:09Z,Illuvium Launch 2024,8,0,0,Illuvination-Wildfire ,0
107,Sm2gQgPwTpE,2024-07-08T18:48:20Z,Farm de Minerios Illuvium,38,2,1,Gabriel Moura,75
108,5QiogmxlksU,2024-07-24T00:09:04Z,ILLUVIUM - 14M DE DÓLARES - ENTENDA TUDO E COMECE BEM!!!,10210,661,199,Storming,11000
109,qbbBFvuET2k,2024-07-16T11:00:48Z,Illuvium's Master Shard vs Pokemon's Master Ball,1071,34,0,Nijafe_Plays GameFi,2610
110,w1I0MrvyQ4w,2024-07-23T14:42:56Z,1st time playing Illuvium LFG #games #crypto #illuvium #shorts,211,7,1,Caffeina,469
111,5fEIQQVc5Ok,2024-07-04T04:32:39Z,Illuvium Overworld HUGE UPDATES! $20 Million Airdrop Farming | Illuvium Overworld Gameplay,758,23,7,Web3 Gaming Tv,2470
112,KvTi9vf3zNU,2024-07-13T18:17:45Z,COMO FARMAR MAIS PONTOS NO ILLUVIUM - FAÇA MUITO DINHEIRO NESSE AIRDROP!,60,4,2,NFT World,1
113,7tAqA8-0PO8,2024-07-19T17:01:53Z,Illuvium Overworld MUST Fix These 7 Things Before Launch,190,21,13,Metaverse News 1,689
114,XaUJFQY_sRc,2024-07-12T22:00:30Z,Tier and Stage explained  #illuvium #gameplay #ilv,274,8,0,Illuvination,2100
115,0WCG-siEIpU,2024-07-04T01:53:39Z,ILLUVIUM - ULTIMA CHANCE PARA GANHAR TOKENS GRÁTIS AIRDROP,2851,241,32,Seroy,36700
116,VdXEaDmVyng,2024-07-26T22:05:16Z,Illuvium | Open Beta Mainnet | Mejorando el Team en Overworld + Zero + Arena | #dia2,228,5,0,jagemetal,596
117,qEs4Zp-Y-uQ,2024-07-25T19:34:10Z,Illuvium Overworld First Game Trailer and Tutorial,164,11,5,GachaWade,91900
118,SO2eAscHyv0,2024-07-25T23:07:16Z,add money to your illuvium account from coinbase #illuvium #coinbase #nft #shorts,5,1,1,ArisSeaWorth,503
119,PFAz3d2dsLA,2024-07-09T11:29:18Z,illuvium Season 2 tips Milestones Guide Maximize Airdrop Points,930,43,5,AruelPlays,5390
120,0n2ASi_2PIA,2024-07-11T23:51:59Z,The Illuvium Airdrop Season 2 ends soon - What's next? | The Download Illuvium News E51,940,58,11,Scoriox,6690
121,os0LkvGW66s,2024-07-22T00:30:25Z,Pokemon or Illuvium For The Next 20 Years,451,12,3,Nijafe_Plays GameFi,2610
122,rWqVYDWxCoI,2024-06-30T20:46:48Z,LIVE Playing ILLUVIUM Closed Beta on Epic Games! - Download Now!,40,4,0,Timothy Randy,2270
123,PU3OnNa2exM,2024-07-29T06:20:36Z,New Features Coming To illuvium!!!,204,21,1,Dollar Cost Crypto,33400
124,goHqEUTTPwA,2024-07-29T11:22:41Z,ILLUVIUM FULL RELEASE! MAPLESTORY BETA LIVE! WEB3 GAMING HEATING UP!,48,9,0,Web3 Gaming,7280
125,qUqMjkvfClY,2024-07-25T08:41:50Z,[GMV] Illuvium | Breathe Me In,69,8,4,DAMIENthGMV,2410
126,y5tZaqZtIZI,2024-07-29T14:46:26Z,Talking ILLUVIUM ZERO after 5 days on my tier 3 lands,0,0,0,JC3,628
127,7uNezjoMI4E,2024-07-10T19:46:34Z,Illuvium Over World Second Mission | How to Pass Missions in Illuvium ?,17,2,0,No More Games,89
128,dFWWKSxK8CI,2024-07-01T19:16:20Z,This Illuvium Patch is the Best one I've ever seen!,981,56,18,Illuvination,2100
129,lL50pIsHXVA,2024-07-20T05:25:04Z,Illuvium Zero Beta 4 | Speed Run - Day ... 2?,136,6,2,PherosisPK,118
130,DzmOA_juXQ0,2024-07-03T13:28:00Z,NUEVO AIRDROP EN ILLUVIUM - MISIONES,76,4,6,Freesalex,8
131,dsk0xWk0gLM,2024-07-02T12:06:05Z,"Illuvium Pre-Season 2: New Missions, Airdrop Points & Update 0.4.2! (Illuvium Overworld & Arena)",84,2,0,Illuvidata,19
132,1q8wmS-xK4U,2024-07-28T20:46:13Z,Illuvium Sunday Sesh,84,6,1,Crypto Quick Chat,107
133,PiQM-ENOTLk,2024-07-18T18:43:37Z,First Look at the New Illuvium Game: Gauntlet,569,12,5,Illuvination,2100
134,7oRrSuYOHgo,2024-07-14T17:20:27Z,Illuvium ZERO & Overworld Missions. AMA & Gameplay,227,14,2,Nijafe_Plays GameFi,2610
135,W8M02QINRw8,2024-07-28T01:10:06Z,Illuvium: Guia para Iniciantes - Dicas de Como Começar! 14 Milhões de Dólares em Airdrop!,178,24,2,Silvão das Criptos,3140
136,qqkGb1DVqB0,2024-07-26T22:17:47Z,Illuvium is real! Day 1 Live stream!,85,3,2,Crypto Quick Chat,107
137,RBwce7DW2P8,2024-07-01T11:00:22Z,The First Ophisto I caught! #illuvium #games #gameplay,709,11,3,Illuvination,2100
138,qKBLm24TAaM,2024-07-28T19:03:57Z,Illuvium Training Missions,3,0,0,No More Games,89
139,AMnwMUrG4yQ,2024-07-25T19:03:36Z,Como depositar ETH na Immutable Passport do Illuvium!!,146,19,3,Ayrton TV,1370
140,f-aml7j0SDE,2024-07-24T14:58:48Z,I Finally Got it!! #illuvium #merch #ilv,96,11,2,Illuvination,2100
141,_HEyica1fdQ,2024-07-27T03:05:26Z,Illuvium Launch,9,2,0,Neon Space,136
142,E3GxtIOAtyo,2024-07-08T12:00:14Z,Illuvium's Gauntlet Mode Is Better Than Ascendant,199,14,0,Nijafe_Plays GameFi,2610
143,BLQdbqjkWTw,2024-07-28T20:58:40Z,Illuvium | Open Beta Mainnet | Overworld + Arena + Zero | Gameplay en español #4,172,4,0,jagemetal,596
144,AfWcSQ-oD_0,2024-07-04T04:52:11Z,Arena Match #illuvium,21,2,0,alley oop,2
145,bW8YxhTu5oQ,2024-07-26T02:44:03Z,Illuvium | Open Beta Mainnet | La aventura Empieza! #día1,519,15,2,jagemetal,596
146,_TKGBnuurwI,2024-07-25T20:03:45Z,Illuvium Official Launch Party!,4306,308,7,Illuvium,51900
147,xi71CtMsw4M,2024-07-29T12:00:56Z,【Illuvium】イルビウム：オーバーワールド キャラメイクからチュートリアルまで全部見せちゃう #573,8,0,0,29cueGuild,432
148,5r-Yu2H2vp4,2024-06-30T18:45:14Z,Illuvium Market Place! 🔴 Come Trade Illuvials for Maximum Airdrop Points!!,474,33,2,Illuvination,2100
149,lGUuGEMNw54,2024-07-29T10:25:13Z,Jump into Illuvium! Tutorial and First Impressions,7,0,0,ThanatosGM,281
150,lL50pIsHXVA,2024-07-20T05:25:04Z,Illuvium Zero Beta 4 | Speed Run - Day ... 2?,136,6,2,PherosisPK,118
151,njrW-aqGzVs,2024-07-24T04:45:04Z,Migrate Illuvium Assets To IMX Passport Now So You Can Play,1308,41,29,Nijafe_Plays GameFi,2610
152,aKwRHz7yvRk,2024-07-23T14:56:51Z,Which Illuvium Faction Matches Your Personality?,557,21,6,Illuvihub,335
153,rWqVYDWxCoI,2024-06-30T20:46:48Z,LIVE Playing ILLUVIUM Closed Beta on Epic Games! - Download Now!,40,4,0,Timothy Randy,2270
154,dFWWKSxK8CI,2024-07-01T19:16:20Z,This Illuvium Patch is the Best one I've ever seen!,981,56,18,Illuvination,2100
155,dsk0xWk0gLM,2024-07-02T12:06:05Z,"Illuvium Pre-Season 2: New Missions, Airdrop Points & Update 0.4.2! (Illuvium Overworld & Arena)",84,2,0,Illuvidata,19
156,0WCG-siEIpU,2024-07-04T01:53:39Z,ILLUVIUM - ULTIMA CHANCE PARA GANHAR TOKENS GRÁTIS AIRDROP,2851,241,32,Seroy,36700
157,N4jaSsFu1Gg,2024-07-04T17:45:18Z,Maior Airdrop de 2024 - Illuvium || Cryptogames   !membros !illuvium,275,23,0,Liga do Jorel,39400
158,BxuH0FJqvJI,2024-07-27T02:21:30Z,SAIBA TUDO SOBRE O ILLUVIUM E FAÇA MUITO DINHEIRO SEGUINDO ESSES PASSOS !,215,19,3,0xCokinha,2220
159,5r-Yu2H2vp4,2024-06-30T18:45:14Z,Illuvium Market Place! 🔴 Come Trade Illuvials for Maximum Airdrop Points!!,474,33,2,Illuvination,2100
160,7uNezjoMI4E,2024-07-10T19:46:34Z,Illuvium Over World Second Mission | How to Pass Missions in Illuvium ?,17,2,0,No More Games,89
161,k0-rJBXlgJ8,2024-07-22T21:00:22Z,NEW Reasons to Own Land for Illuvium Zero!?!,968,51,14,Rockon,101
162,c_Z7Wed8h1w,2024-07-08T15:16:50Z,[ILLUVIUM] Gros airdrop a farm gratuitement + quelques tips pour bien débuter le jeux !,160,4,0,GoldSpirit,195
163,gKFPzsZuV4U,2024-07-23T15:45:50Z,How to play Illuvium Zero,665,28,8,Crypto Quick Chat,107
164,7VwkCSSboB0,2024-07-20T19:32:12Z,Illuvium -Gauntlet - Kieran's Guild Tournament!,72,4,0,ZenMasterSoda,13
165,cicaWbH2Qds,2024-07-28T12:00:07Z,ILLUVIUM (ILV) LÀ GÌ? | HỆ SINH THÁI GAMEFI NỔI BẬT ĐƯỢC ANIMOCA BRANDS CHỐNG LƯNG | [TCVN],338,112,0,TradeCoinVN,49100
166,JlelU-opI7I,2024-07-04T17:26:15Z,ILLUVIUM - GAME ESTILO POKEMON GAMEPLAY,31,5,2,Costela,864
167,AfWcSQ-oD_0,2024-07-04T04:52:11Z,Arena Match #illuvium,21,2,0,alley oop,2
168,oJ1-ap1UPBQ,2024-07-25T08:56:02Z,Master the Launch: Your Ultimate Guide to Starting Illuvium Overworld!,1127,46,15,Viper_ilv,1100
169,BHyMP3xfBWY,2024-07-24T12:00:06Z,How Illuvium Proved Everyone Wrong? | Lessons In Building | Interview with Kieran Warwick,6078,61,24,PlayToEarn,18500
170,5kgowNfj85w,2024-07-24T17:43:53Z,Unlock the Secrets of Illuvium Zero: Beginner’s Guide to Success!,464,25,11,Viper_ilv,1100
171,DQcBwdmvx10,2024-07-05T13:02:05Z,If You Bought Just $100 of Illuvium ILV in 2021! 🤯📈🚀 #Shorts,12,1,0,DailyTrending007,7260
172,tOj7nUGmKEI,2024-07-28T01:35:05Z,How-To Move SILV2 to Illuvium From Metamask Crypto Transfer,10,0,0,ILV Store,1
173,kPAMDCkMvtk,2024-07-26T21:15:03Z,ILLUVIUM LANÇAMENTO OFICIAL GRATIS PAGANDO 2 MILHOES DOLARES POR MES #illuvium #illuviumoverworld,929,38,20,Seroy,36700
174,CSxhwTna6Zk,2024-07-13T21:51:53Z,Illuvium | Open Beta Testnet | MIsiones y Tareas #dia13,180,6,0,jagemetal,596
175,LxL0IFu6GeQ,2024-06-29T18:57:58Z,PHANTOM BOUNTY HUNT #8 🔴 ILLUVIUM OVERWORLD EVENT 1500$,191,6,0,Illuvination,2100
176,oeC9KhJUPlk,2024-07-26T01:15:09Z,Live Stream: Illuvium Day 1 Launch Party,65,4,0,Tales from the Crypt Mancer,1600
177,uON3DrDIc3Y,2024-07-08T12:00:47Z,[Illuvium] Hướng Dẫn Chi Tiết Cách Chơi Season 2 Illuvium Cho Người Mới | NFT Game,1782,20,12,DIF GameFi,16500
178,yGnXHemR-KI,2024-07-19T01:15:43Z,Ultimo dia Illuvium! !airdrop !illuvium !membro !nuuvem,248,13,0,Liga do Jorel,39400
179,SzZg7dPPaCU,2024-07-26T09:57:53Z,Illuvium Trailer,18,0,0,GM Wolf,1510
180,xK98YR9NsVQ,2024-07-02T03:56:05Z,Illuvium | Open Beta Testnet | Nuevo Evento: Objetivos y Tareas #dia 1,440,12,0,jagemetal,596
181,kPJWKENG1Es,2024-07-26T18:59:17Z,Illuvium is out!!!!,8,1,0,Tailless ♊️,9
182,TUo5twpNYio,2024-07-01T12:32:35Z,Illuvium: Final Hour Holo Hunting For Airdrop Points,163,7,2,Nijafe_Plays GameFi,2610
183,7DI18yEwfd0,2024-07-15T06:24:59Z,Cách Săn $1000 Airdrop Illuvium Zero - Game Đang Beta & Có Airdrop Khủng,1800,16,4,Đầu Tư Tiền Điện Tử,54800
184,n5hwWF8JOgM,2024-07-26T11:45:03Z,This Game Will Overtake Teamfight Tactics - Illuvium Mainnet Launch!,66,5,0,Crypto Grit,1200
185,08p3VbEEfnI,2024-07-11T19:30:00Z,Have You Tried this Game #illuvium #gameplay #ilv,528,12,0,Illuvination,2100
186,s3yGv6KbqUw,2024-07-24T01:27:52Z,Comece MUITO BEM no lançamento de Illuvium na Mainnet!!,1172,85,91,Ayrton TV,1370
187,yyjtHy_mTlE,2024-07-01T19:25:18Z,V3 Grind and Illuvium Later ! | #soulcity  #illuvium,1807,167,1,WHIZZER GAMING,7410
188,SF-IGxY3g-c,2024-06-30T22:32:36Z,Intro to Illuvium Arena Gameplay,58,3,0,McChillin,184
189,gnDZowJ9HhM,2024-07-27T16:54:36Z,Tips pour escalader les montagnes rapidement sur Illuvium,496,9,0,GoldSpirit,195
190,jokupZqlZLw,2024-07-05T21:18:44Z,Illuvium | Open Beta Testnet | Misiones y Tareas #dia 5,122,9,0,jagemetal,596
191,g2qxrGTS0CE,2024-07-26T15:41:48Z,TOP 1 TEEMO EUW - LUEGO ILLUVIUM !ad - Wild Rift,6403,216,9,Navalha - Freestyle Gaming,360000
192,mjQIh-dBes8,2024-07-03T02:03:17Z,Illuvium Beta 4 | Why is the math book sad?,30,0,0,PherosisPK,118
193,VymezlOradc,2024-07-26T08:59:31Z,Illuvium Trailer | Illuvium Overworld | HD,12,0,0,GM Wolf,1510
194,jGQyV2Yy8yY,2024-07-14T23:41:52Z,Illuvium Pre-Season e Airdrop Seraph! 👾SURA NEWS no ar!,49,3,0,Sura Brasil,469
195,_Y8S60TDwuo,2024-07-25T16:18:41Z,ILLUVIUM ZERO LAUNCH DAY IS HERE!,24,3,0,JC3,628
196,086QUDYF9NU,2024-07-27T10:44:30Z,Illuvium Open Beta Ita,38,0,0,Crypto Simplex,314
197,oKtsbdljpLk,2024-07-07T18:42:59Z,Illuvium OverWorld First Mission | How to Pass First Mission in Illuvium ?,56,3,2,No More Games,89
198,wzF4vVZ1cms,2024-06-30T08:09:26Z,Illuvium Em busca do Ophisto,23,1,0,Gabriel Moura,75
199,YDyS9wmKAx4,2024-07-25T17:00:32Z,Move your Crypto onto IMX from Metamask or CEX to play Illuvium,889,35,14,Scoriox,6690
200,f0LShHP8eo4,2024-07-25T14:18:24Z,GameFi Rundown 50 LIVE! Celebrating Illuvium's Open Beta Launch With High Profile Guests!,271,27,3,Nijafe_Plays GameFi,2610
201,CSxhwTna6Zk,2024-07-13T21:51:53Z,Illuvium | Open Beta Testnet | MIsiones y Tareas #dia13,180,6,0,jagemetal,596
202,jokupZqlZLw,2024-07-05T21:18:44Z,Illuvium | Open Beta Testnet | Misiones y Tareas #dia 5,122,9,0,jagemetal,596
203,1mwePjX5Pfk,2024-07-26T14:10:07Z,YOda mandando bala no Illuvium e League of Legends em live incrível! #RAMatéMorrrer #Dungeonborne #Y,445,6,0,EG Clips Shorts,113
204,jGQyV2Yy8yY,2024-07-14T23:41:52Z,Illuvium Pre-Season e Airdrop Seraph! 👾SURA NEWS no ar!,49,3,0,Sura Brasil,469
205,cicaWbH2Qds,2024-07-28T12:00:07Z,ILLUVIUM (ILV) LÀ GÌ? | HỆ SINH THÁI GAMEFI NỔI BẬT ĐƯỢC ANIMOCA BRANDS CHỐNG LƯNG | [TCVN],338,112,0,TradeCoinVN,49100
206,zCBuCpa1bys,2024-07-15T23:41:45Z,Julien Cryptonite - Illuvium Land (Music Video),28,1,0,Julien Cryptonite,5
207,b-gbNOZP0sQ,2024-07-01T05:44:56Z,Illuvium Em busca do Ophisto,19,0,0,Gabriel Moura,75
208,Du9Kc4LOX6E,2024-07-18T01:02:56Z,Illuvium Arena Beta Battle,4,0,0,BluePrint402,0
209,yGnXHemR-KI,2024-07-19T01:15:43Z,Ultimo dia Illuvium! !airdrop !illuvium !membro !nuuvem,248,13,0,Liga do Jorel,39400
