,Video ID,Published Date,Title,View Count,Like Count,Comment Count,Channel Title,Subscriber Count
0,Y9UslzZ1_Jk,2024-06-07T23:00:06Z,Are SPIDER TANKS any good? A Tankers View | Anime | Sci Fi,1464,152,61,A Tankers View,6550
1,UO4ABt6rySc,2024-05-28T16:35:16Z,Gala Games Lawsuit UPDATE! | Spider Tanks Speaks Out!,2504,130,48,Jesus Martinez,27200
2,l01OBv_Xx1c,2024-05-29T05:31:51Z,Official Statement from GAMEDIA! Spider Tanks Creators,466,38,24,lycanwarlord,5630
3,4N4aNajYMds,2024-06-06T17:22:14Z,Now even Spider Tanks are calling out Gala Games,207,14,16,FrugalBC,4060
4,19Ib9Vp5Pd0,2024-06-22T22:15:29Z,The Good 'Ole Days in Spider Tanks,26,4,1,C-Money37,103
5,yQwP0Pzdtwg,2024-05-26T20:38:15Z,Win traders in Spider Tanks May 26 2024,27,0,0,Spider Tanks Go,0
6,JWSKMDninjA,2024-06-10T11:05:44Z,Middle Finger to Gala Games 🤡 for killing Spider Tanks a brilliant game made by Gamedia Games ❤️,57,7,0,Caffeina,466
7,rcCtL81yRBw,2024-06-02T17:12:48Z,My baby girll! #melaniemartinez #jumpingspiders #spider #tanks,518,7,0,Bumblebee ,39
8,FZarng2jYUQ,2024-06-01T16:49:43Z,TANK VS SPIDER STICKMAN ROPE HERO VS COPS & TANKS (Stickman Rope Hero Gameplay),324,5,1,Gamesturday,385000
