,Video ID,Published Date,Title,View Count,Like Count,Comment Count,Channel Title,Subscriber Count
0,YNPNnwQ3aCE,2024-07-28T17:30:26Z,The American Spider Tanks Technology 2025: New American Technology Upcoming !!,263,1,1,TechVeil,2
1,ganauEqTHmk,2024-07-08T08:27:44Z,Spider Tanks - Non Stop Grapnel,12,1,1,Spider Tanks Go,0
2,HwqmrpGPBgM,2024-07-08T08:32:34Z,Spider Tanks - non stop speed,14,1,1,Spider Tanks Go,0
3,N5JVufkxVis,2024-07-09T08:00:21Z,Transformer Tanks: Discover the Hidden Secrets of the Menzi Muck Spider Excavator | Arena Tank,13821,91,1,ARENA TANK CARTOON,377000
4,b3D2Oj8hWJ0,2024-07-04T11:30:06Z,Team bad Guy Jocker tanks attack Spider Wedding: All superhero mission Rescue the Spider Bride,70391,2220,3,Spider Power TV,29500
5,TVLyGuvFHTM,2024-07-02T21:30:03Z,SPIDER TANKS #callofduty #advancedwarfare #letsplay,3,0,0,BulletThunderZ,0
6,c8Cr7Twy148,2024-07-02T08:30:11Z,"GUNSHIP BATTLE ,Episode 7,Mission 2, Target Spider Tanks -Short(446)-SR PlayH Short Clips",0,0,0,SR PlayH Short Clips,333
7,FT3aE-W3OxU,2024-07-23T09:00:09Z,GTAV5 Red Spider Man Fights With pak Army|Tanks And Rocket Blast|Spider Man Kills The Army In Army |,18,2,2,Tech GTAV5 51k views•2hours ago,3
8,iV1rc5D-KHQ,2024-07-09T23:39:31Z,"Spiderman edit, tanks for the attention❤️❤️❤️#edits #spiderman #spider #song #kompapasion #music",147,8,1,GK Artist,4
