,Video ID,Published Date,Title,View Count,Like Count,Comment Count,Channel Title,Subscriber Count
0,ZYz63Kh54-c,2024-04-03T16:33:06Z,Splinterlands GLINT Deep dive!  What is the best way to spend it?,745,61,28,Gathering The Magic,786
1,5KiFrXwJRoc,2024-03-22T13:16:49Z,THE SPLINTERLANDS MOBILE APP IS BEING PHASED OUT,545,38,14,AfterSound Gaming,2510
2,Q9XsHkc3XEM,2024-03-14T16:58:34Z,Splinterlands Town Hall,1263,83,5,Splinterlands Official,3950
3,t9cpJWSYuEY,2024-04-02T20:19:50Z,Splinterlands Final End of Season Chest rewards + first look at the new Reward Shop!,257,27,16,Gathering The Magic,786
4,9Z3oQgGnD1o,2024-04-04T23:14:35Z,Splinterlands GLINT Deep Dive Part 2 - Maximizing cards/Gold Foils/ Legendaries!,487,47,10,Gathering The Magic,786
5,8p6FjABhJls,2024-03-18T04:15:00Z,EARNING OVER $120 PER MONTH IN SPLINTERLANDS,649,44,10,AfterSound Gaming,2510
6,PSJHM0_NVFc,2024-04-04T07:00:10Z,Concerned BUT Hopeful | Comments on Modern Rank in Splinterlands,815,42,42,Dwayne Cunningham,6400
7,NK8GmzsU1zk,2024-04-10T14:36:56Z,Splinterlands Baron's Bounty Bitcoin Halving Promo Event details!,346,31,6,Gathering The Magic,786
8,GsvDylupkq0,2024-04-11T00:21:51Z,Baron's Bounty Splinterlands Halving Event Details Announced!,250,37,14,Bronzedrag0n Gaming,609
9,jSxgRNagViQ,2024-03-26T07:00:21Z,The End or Opportunity | Splinterlands,931,51,60,Dwayne Cunningham,6400
10,oUoGgbCk2P0,2024-04-01T05:00:25Z,SOULKEEP WILL SAVE SPLINTERLANDS,741,47,17,AfterSound Gaming,2510
11,H2rHw74PifE,2024-04-09T00:11:56Z,SPLINTERLANDS NEEDS A FREE-TO-PLAY MODE,339,27,17,AfterSound Gaming,2510
12,1sbGYQ_qE6A,2024-03-31T13:00:06Z,SPLINTERLANDS: Returning AFTER 2 MONTHS Checking Land Update GOLD FOIL MARKET PRICES CHECK NFT GAME,126,9,4,Single Player Gamer,1230
13,anXhSpuhVdU,2024-04-07T22:50:53Z,Possible Hot Takes on Splinterlands New Player Strategy and Rewards Shop Changes,333,37,19,Bronzedrag0n Gaming,609
14,X1yTlfpz3zM,2024-04-06T18:53:54Z,TOP SPLINTERLANDS PLAYERS ARE EARNING OVER $10/DAY,617,45,16,AfterSound Gaming,2510
15,uTNUYwdzgkM,2024-04-02T07:30:11Z,ANSWERING SPLINTERLANDS COMMENTS - 4.1.2024,489,41,6,AfterSound Gaming,2510
16,dxnUvT0qe1o,2024-04-12T18:05:49Z,Splinterlands 101 - Ep 118: Behind The Avatar @gamesontheblock,27,6,0,Bobaphet,170
17,n08gWRquCew,2024-03-16T07:00:20Z,Matt Calls for Patience in Splinterlands,884,49,30,Dwayne Cunningham,6400
18,SQ5xCspldi8,2024-03-29T07:00:14Z,Solving The Bot Problem | Splinterlands,772,41,39,Dwayne Cunningham,6400
19,Ha2tIRQc3nQ,2024-03-19T07:00:08Z,Selling ALL MY GOLD FOILS | Splinterlands,835,41,19,Dwayne Cunningham,6400
20,n6WuR3AIOxs,2024-04-10T16:36:45Z,Splinterlands - How to save the Glint store!,395,42,23,Gathering The Magic,786
21,sTNbcYjp9mw,2024-04-09T23:55:03Z,A Huge Rewards Change Went Live Today in Splinterlands!,294,37,22,Bronzedrag0n Gaming,609
22,_YA8xVkF-SE,2024-04-09T07:00:14Z,Burning Soul Bound Cards for Glint | Splinterlands,485,30,18,Dwayne Cunningham,6400
23,By_eOaE-kOw,2024-03-28T18:26:53Z,New Glint Rewards Coming To Splinterlands!,933,54,17,Bulldog1205,19500
24,1h60hfNs0jY,2024-04-06T07:00:02Z,Talking Glint Rewards with Gathering & Twelve58 | Splinterlands,603,42,14,Dwayne Cunningham,6400
25,zWowUOt6rUQ,2024-03-18T15:13:56Z,"Venka the Vile! Talking Venka, Kai, and Airdrops! Splinterlands!",197,16,9,The Psilence,210
26,PkKVEdBtVyo,2024-03-21T13:28:27Z,CEO of Blockbuster Blockchain Game: Splinterlands!,615,84,7,The Official Koinos Blockchain Channel,1180
27,gv2717PDFEQ,2024-04-07T13:00:06Z,Splinterlands: ALPHA & BETA GOLD FOIL CARDS MASSIVE PRICE DROP! MARKET #splinterlands #nftgame #nft,82,6,0,Single Player Gamer,1230
28,nri9nFinacs,2024-04-06T15:32:57Z,Splinterlands Market Watch #8  plus a couple market purchases!,222,19,9,Gathering The Magic,786
29,MCKJ51WvM3A,2024-03-26T22:52:06Z,Splinterlands Ranked Battle Overhaul Pt. 2 Juicy Details Released!,285,41,9,Bronzedrag0n Gaming,609
30,_ca_avUYwr0,2024-03-24T18:03:47Z,Splinterlands Market Watch #7 What deals are out there?,204,16,10,Gathering The Magic,786
31,Sli5D0j2TQg,2024-03-27T07:00:21Z,How I am Climbing in Splinterlands Modern | Splinter Coach Data,329,22,3,Dwayne Cunningham,6400
32,riBqRdI4ueA,2024-04-11T13:30:07Z,EMERGENCY GLINT UPDATE IN SPLINTERLANDS! PLAYERS ANGRY  REACTIONS! MANY PLAYERS QUIT! #nftgame,45,7,8,Single Player Gamer,1230
33,qxVJpu_VHfk,2024-04-10T13:30:06Z,Splinterlands: HOW TO BUY $SPS USING HIVE ENGINE | MASSIVE PRICE DECLINE IN 2024 SO I BOUGHT! #NFT,38,4,2,Single Player Gamer,1230
34,o4OJXjqrB30,2024-03-23T07:00:23Z,Debating Binance Listing with Gathering the Magic | Splinterlands,475,25,20,Dwayne Cunningham,6400
35,ki674lGHZZ0,2024-03-28T14:12:15Z,"KGM JAM Splinterlands  Daily DCA, Land claims and pac openings 03-28-24 #splinterlands #nft #crypto",53,9,3,KGM JAM,615
36,QAj43zOb9XE,2024-03-24T07:00:16Z,The Path to PEG for DEC & Vouchers | Splinterlands,340,20,8,Dwayne Cunningham,6400
37,zihTVPn_nJo,2024-03-22T17:00:51Z,ANSWERING SPLINTERLANDS COMMENTS - 3.22.2024,465,53,7,AfterSound Gaming,2510
38,CvfmD3VofpY,2024-03-16T15:07:17Z,Splinterlands  My Great burning event! What's left? How much DEC did I earn?,356,25,9,Gathering The Magic,786
39,1TZMXw8m5Bo,2024-04-04T08:30:00Z,ANSWERING SPLINTERLANDS COMMENTS - 4.3.2024,442,36,10,AfterSound Gaming,2510
40,DpKPeYH3kEM,2024-03-20T00:37:55Z,Splinterlands Updates Live Today and Promo Event News,262,38,10,Bronzedrag0n Gaming,609
41,6mnHdjusabU,2024-04-03T00:34:34Z,Surprising Last End of Season Splinterlands Chest Opening!,158,22,11,Bronzedrag0n Gaming,609
42,7c_Kdxj0ANc,2024-03-15T14:49:51Z,Splinterlands End of season Rewards 3/15 and Splinterforge Update is LIVE,107,16,7,Gathering The Magic,786
43,JcYAmyHOHv4,2024-03-20T07:00:08Z,Patience & Bid Buys for the Win | Splinterlands,400,25,6,Dwayne Cunningham,6400
44,zbq7a3pYe3Q,2024-03-27T09:30:15Z,ANSWERING SPLINTERLANDS COMMENTS - 3.26.2024,418,43,10,AfterSound Gaming,2510
45,KautSjiaolk,2024-03-14T07:00:07Z,PUSHING for Diamond and Exploring the Modern Meta | Splinterlands,328,16,6,Dwayne Cunningham,6400
46,VvHgp3VIEnM,2024-04-02T18:57:11Z,Splinterlands End Of Season Rewards Opening! #1 on the Leaderboard Thanks to Mondroid!,62,6,2,clove71,2370
47,PlGFXG1ukEE,2024-03-24T22:58:30Z,Splinterlands - Will this event pump vouchers?,243,21,5,Gathering The Magic,786
48,77PBS3swxn0,2024-04-08T07:00:04Z,How will I stay in MODERN after Chaos Legion? | Splinterlands,500,36,12,Dwayne Cunningham,6400
49,Di42CP0U1rc,2024-03-17T18:37:47Z,"KGM JAM Splinterlands  Daily DCA, Land claims and pac openings 03-17-24 #splinterlands #nft #crypto",43,9,9,KGM JAM,615
50,Di42CP0U1rc,2024-03-17T18:37:47Z,"KGM JAM Splinterlands  Daily DCA, Land claims and pac openings 03-17-24 #splinterlands #nft #crypto",43,9,9,KGM JAM,615
51,jQxin6Cjh-c,2024-03-30T00:26:23Z,ANSWERING SPLINTERLANDS COMMENTS - 3.29.2024,397,34,3,AfterSound Gaming,2510
52,lsp0QtGc2Oc,2024-04-01T13:00:06Z,Splinterlands: Rental Card System Update! How I make MONEY in the #CRYPTO BEAR MARKET #nft GOLD,57,8,4,Single Player Gamer,1230
53,3ek1h1taCWA,2024-03-15T07:00:03Z,Breaking the GRIMBARDEN SMITH Meta | Splinterlands,303,20,10,Dwayne Cunningham,6400
54,XariRiIul9o,2024-04-03T04:34:36Z,#94 The Sylar Hire | The People's Guild: A Splinterlands Podcast,241,23,13,The People's Guild,421
55,hWKj5kjJC-w,2024-03-20T16:42:52Z,Splinterlands  Daily Rewards 3/20 plus how are my accounts doing?,99,11,4,Gathering The Magic,786
56,G-Zt97jhBF4,2024-03-17T07:00:06Z,MAJOR EXCHANGE LISTING | Splinterlands,709,41,30,Dwayne Cunningham,6400
57,GXJ7JmN8ylk,2024-04-01T15:24:33Z,"Battle Mage Secrets Challenge,  FabFour ruleset from Splinterlands game",5,1,0,poplar2155,5
58,gEgExkuUH5E,2024-03-31T12:00:35Z,Modern | Rank Battles W/Narrative | Splinterlands | 03-21-24,46,7,3,Boltz85,26
59,-uv-0p-3S7E,2024-03-15T00:42:06Z,Huge Amount of Updates Dropped in the Splinterlands Townhall!,337,59,16,Bronzedrag0n Gaming,609
60,5qTfjYizH5o,2024-03-25T04:45:00Z,ANSWERING SPLINTERLANDS COMMENTS - 3.24.2024,373,32,10,AfterSound Gaming,2510
61,L-WUD7cCNt0,2024-03-26T01:07:00Z,Splinterlands Game News and a Surprise After I Burn Some Gold Foil Gladius Cards!,270,31,9,Bronzedrag0n Gaming,609
62,Yy1zGhIdoYA,2024-03-23T12:00:35Z,#93 A People's Guild Roundtable | The People's Guild: A Splinterlands Podcast,338,36,24,The People's Guild,421
63,Osl_gQf4yBA,2024-03-30T15:36:39Z,"My Daily Routine - Splinterlands, Splinterforge and Golem Overlord",234,20,7,Gathering The Magic,786
64,PIQxEQE2tcI,2024-04-08T13:52:31Z,KGM JAM Two Legendary cards in one pack! 04-08-24 #splinterlands #nft #crypto #dcrops #golemoverlord,35,9,5,KGM JAM,615
65,9hJ_H0tv0ts,2024-03-22T16:52:12Z,"Battle Mage Secrets Challenge,  Explosive Weaponry ruleset from Splinterlands game",3,0,0,poplar2155,5
66,7lmufnY6t3w,2024-04-06T13:00:06Z,Splinterlands: 5 Reasons PeakMonsters is GREAT for NFTs! Why I love RENTING & MAKING MONEY for YEARS,17,4,0,Single Player Gamer,1230
67,BZo4Ln1a6m4,2024-03-27T16:02:23Z,Splinterlands  Daily Rewards 3/27 - Diamonds are exactly what i needed!,101,13,7,Gathering The Magic,786
68,x086o8uygh0,2024-04-11T12:30:41Z,#96 An iProto Conversation | The People's Guild: A Splinterlands Podcast,186,13,10,The People's Guild,421
69,o29rysIOUmo,2024-04-02T08:10:53Z,SPLINTERLANDS : MY 61ST END SEASON REWARDS !!!,16,1,1,Yael Chan,1030
70,MGs1UXMiIVI,2024-03-15T17:02:29Z,"Next-to-Last Splinterlands Season Chest Openings, What Now?",147,24,5,Bronzedrag0n Gaming,609
71,FuLK_ST2pT0,2024-04-09T04:15:00Z,ANSWERING SPLINTERLANDS COMMENTS - 4.8.2024,403,40,16,AfterSound Gaming,2510
72,dNV8tH0T3bY,2024-03-28T12:15:02Z,#94 A Mondroid Conversation | The People's Guild: A Splinterlands Podcast,370,29,35,The People's Guild,421
73,4cClHzjbngQ,2024-03-29T18:03:41Z,Splinterlands 101 - Ep 116: The End Of An Era,182,24,6,Bobaphet,170
74,iQnkey7JYjo,2024-04-02T20:47:11Z,"GINLT GWEN’S , DRAW AND SHOP SPLINTERLANDS NUEVO SISTEMA DE RECOMPENSAS",18,2,1,Yonilkar,104
75,QhYziSV8d90,2024-04-12T14:34:54Z,KGM JAM Hive Engine morning claims 04-12-24 #splinterlands #nft #crypto #dcrops #golemoverlord,31,7,0,KGM JAM,615
76,Ypqt2qHsUAg,2024-04-12T01:11:15Z,BIgTime and Splinterlands,22,2,2,SteveR82,4320
77,UA2oXv-8GKk,2024-03-18T07:00:19Z,EoS Reward Chests with Twelve58 | Splinterlands,258,16,13,Dwayne Cunningham,6400
78,V1LpLfYVCKA,2024-04-06T12:00:32Z,#95 The Web3 Dream | The People's Guild: A Splinterlands Podcast,114,14,3,The People's Guild,421
79,bR94kmiOWvE,2024-03-28T16:19:06Z,Splinterlands  Daily Rewards 3/28 - Diamonds shine again!,76,8,2,Gathering The Magic,786
80,9GovudzI0Xg,2024-03-20T11:15:01Z,"Daily Call 3/13/24 w/ Matthew Rosen: Co-Founder, Splinterlands",19,1,1,CryptoOracle Collective,168
81,R8SGWNCBSCM,2024-04-01T12:47:36Z,"Battle Mage Secrets Challenge,  FabFour ruleset from Splinterlands game",2,1,0,poplar2155,5
82,pmchAGTr6DM,2024-04-02T21:56:49Z,Splinterlands Community Creates a Meme Coin,90,17,3,Nick Plays Crypto,272
83,2p4c7bOzfTE,2024-03-24T05:26:13Z,Splinterlands Battle WIN! 03 - NFT Trading Cards $HIVE Blockchain Gaming vs NEPHYTE_620447 #HIVE 4K,4,0,0,Splinterlands Wins NFT Web3 HIVE Blockchain Gaming,0
84,KJto0kafeJ8,2024-03-27T15:43:47Z,"KGM JAM Splinterlands  Daily DCA, Land claims and pac openings 03-27-24 #splinterlands #nft #crypto",30,11,3,KGM JAM,615
85,ltI1aqEuiGA,2024-03-30T16:28:28Z,KGM JAM Splinterlands  Hive Engine game morning claims 03-30-24 #splinterlands #nft #crypto #dcrops,16,4,0,KGM JAM,615
86,8Vnj1jGIcgg,2024-04-06T11:44:43Z,"Splinterlands 101 - Ep 117: Opening 350 Chaos Legion Packs, Splinterlands Chat, Life Stuff",76,12,7,Bobaphet,170
87,MCPUqoqd4-U,2024-03-28T09:45:00Z,ANSWERING SPLINTERLANDS COMMENTS - 3.27.2024,505,38,10,AfterSound Gaming,2510
88,yp7A6sHgvzE,2024-03-16T20:05:33Z,Splinterlands: Season 43 EOS Chest Opening (86 Gold Chests),40,8,3,Bobaphet,170
89,QJWqwmGMPuo,2024-04-12T20:17:29Z,NEW GLINT IN SPLINTERLANDS REACTION FROM PLAYERS & INVESTOR SALT & CRITICISM QUITTING NFTs! #nftgame,0,0,0,Single Player Gamer,1230
90,HMdSvtoOdTQ,2024-04-04T16:24:44Z,Black Market Vending Machine Location April 4 2024 | Borderlands 3 | (The Splinterlands),2009,156,37,Black Market Vending Machine Location - BL3,5620
91,rZVUv8BXVUo,2024-04-04T14:36:00Z,KGM JAM Hive Engine morning claims 04-04-24 #splinterlands #nft #crypto #dcrops #golemoverlord,36,6,3,KGM JAM,615
92,7L1_tkM35Yw,2024-03-15T16:46:30Z,Open 9 Gold Chest Splinterlands at the end of season 15th Match 2024,3,0,0,i meow gaming,8
93,iL84lDbiyaM,2024-04-02T19:23:22Z,"Splinterlands für Anfänger: In welche Spiele INVESTIEREN, um GELD zu VERDIENEN in 2024?",9564,727,31,DeFiExpertise,71100
94,CCwNa-VLG0I,2024-03-31T14:37:43Z,KGM JAM Splinterlands  Hive Engine game morning claims 03-31-24 #splinterlands #nft #crypto #dcrops,30,7,2,KGM JAM,615
95,fmAn7rhevT8,2024-03-16T12:00:40Z,#92 A Truls Conversation | The People's Guild: A Splinterlands Podcast,258,23,6,The People's Guild,421
96,Tym0Fe-aSIc,2024-03-24T05:06:53Z,Splinterlands Battle WIN! 01- NFT Trading Cards $HIVE Blockchain Gaming  _SLBB_FRIGHTENEDCORAL #HIVE,9,0,0,Splinterlands Wins NFT Web3 HIVE Blockchain Gaming,0
97,y_UTZqpZwSs,2024-03-28T06:00:28Z,Splinterlands Gameplay - Promoted to Bronze III,9,0,0,Information Gateway,1270
98,rMJABId9ioM,2024-03-24T05:22:14Z,Splinterlands Battle WIN! 02- NFT Trading Cards $HIVE Blockchain Gaming  _SLBB_FRIGHTENEDCORAL #HIVE,1,0,0,Splinterlands Wins NFT Web3 HIVE Blockchain Gaming,0
99,O4oHnzCS3cI,2024-03-24T05:57:49Z,Splinterlands Battle WIN! 04 - NFT Trading Cards $HIVE Blockchain Gaming vs  _SLBB_REARBLUE #HIVE 4K,7,0,0,Splinterlands Wins NFT Web3 HIVE Blockchain Gaming,0
100,BjMuO0fXkRw,2024-03-28T04:14:57Z,Modern | Quick Rank Battles | Splinterlands | 03-27-24,29,9,2,Boltz85,26
101,-25tzKkImPM,2024-03-21T14:29:56Z,"KGM JAM Splinterlands  Daily DCA, Land claims and pac openings 03-21-24 #splinterlands #nft #crypto",30,10,3,KGM JAM,615
102,Hbm9SvlDlPc,2024-03-14T11:00:13Z,SPS Analysis | Rank Battle -Junker | Splinterlands | 03-14-24,47,8,7,Boltz85,26
103,7Jtrc_AhDrw,2024-04-12T01:33:55Z,BIgTime and Splinterlands,39,2,0,SteveR82,4320
104,dx3XknnMfrI,2024-03-22T16:24:10Z,The Art of War in Splinterlands & Thriving in the Explosive Weaponry Ruleset || Battle  Challenge,2,0,0,yousaf haroon khan,25
105,UGf_oflWs3U,2024-03-18T08:37:10Z,"Battle Mage Secrets Challenge,  Event Stevens ruleset from Splinterlands game",4,1,0,poplar2155,5
106,WKq7IkoS84E,2024-03-26T11:00:25Z,SPS Quick Analysis | Land Prices | Splinterlands | 03-26-24,27,4,0,Boltz85,26
107,Cpk1wZpdwjU,2024-04-10T15:19:03Z,KGM JAM Yet Another legendary! 04-10-24 #splinterlands #nft #crypto #dcrops #golemoverlord,22,6,3,KGM JAM,615
108,jGkUwH0RBHg,2024-03-22T17:09:08Z,"KGM JAM Splinterlands  Daily DCA, Land claims and pac openings 03-22-24 #splinterlands #nft #crypto",21,6,1,KGM JAM,615
109,9CJ1ivq8-ko,2024-04-06T14:47:36Z,KGM JAM Hive Engine morning claims 04-06-24 #splinterlands #nft #crypto #dcrops #golemoverlord,32,7,4,KGM JAM,615
110,c_XQ8nf3PnU,2024-04-07T15:09:10Z,KGM JAM Hive Engine morning claims 04-07-24 #splinterlands #nft #crypto #dcrops #golemoverlord,17,4,0,KGM JAM,615
111,CfqN6mMjgwE,2024-04-11T15:53:25Z,KGM JAM Hive Engine morning claims 04-11-24 #splinterlands #nft #crypto #dcrops #golemoverlord,34,5,4,KGM JAM,615
112,p8NOVEoPp3k,2024-04-12T13:30:06Z,Splinterlands GLINT REWARDS REACTION What is this NEW UPDATE! No More NFT Rewards! Feature CREEP,35,6,10,Single Player Gamer,1230
113,ABCwC1TMeH8,2024-03-17T04:56:30Z,"Battle Mage Secrets Challenge,  Event Stevens ruleset from Splinterlands game",5,1,0,poplar2155,5
114,k1iAqOWF8q0,2024-04-10T03:35:35Z,KGM JAM Another legendary card in a pack! 04-09-24#splinterlands #nft #crypto #dcrops #golemoverlord,23,3,2,KGM JAM,615
115,un0WTq9KmJw,2024-03-18T16:05:50Z,"KGM JAM Splinterlands  Daily DCA, Land claims and pac openings 03-18-24 #splinterlands #nft #crypto",46,9,1,KGM JAM,615
116,ixES5JmxBlI,2024-03-22T17:18:45Z,"Battle Mage Secrets Challenge,  Explosive Weaponry ruleset from Splinterlands game",4,0,0,poplar2155,5
117,VrNF5HcBICc,2024-03-30T03:01:40Z,"SPECIAL OPPS GUILD Weekly Drawing Video for March 29th, 2024. SPLINTERLANDS.",6,0,0,App Bap,6
118,V9v0GC2tCoc,2024-04-07T04:56:35Z,SPS Detail Analysis | Pack Openings | Rank Battles | GLINT | Splinterlands | 04-06-2024,58,10,4,Boltz85,26
119,pX3nbB7NWuE,2024-04-04T06:18:36Z,Splinterlands : Upgrade de Usut,9,1,0,Crypto yzzy,53
120,QRDFvqVVwHA,2024-04-01T13:07:00Z,splinter fit battles and motivational content training splinterlands how to win pack giveaway SPS,9,1,0,How to make a dollar ,3660
121,FcMj3h613MA,2024-04-08T13:19:18Z,"Battle Mage Secrets Challenge,  Fire & Regret ruleset from Splinterlands game",2,1,0,poplar2155,5
122,KkLd43IJLco,2024-03-15T19:24:50Z,Splinterlands.com Oyini Haqida. Komenta Ssilka orqali ruyhatdan utin.,1,0,1,Nodir.,0
123,rZVUv8BXVUo,2024-04-04T14:36:00Z,KGM JAM Hive Engine morning claims 04-04-24 #splinterlands #nft #crypto #dcrops #golemoverlord,36,6,3,KGM JAM,615
124,SADB4tZoP2Y,2024-04-02T13:00:06Z,Splinterlands Land 1.5: UPDATE to my LEGENDARY LAND! How to REMOVE CARDS in PRAETORIA #splinterlands,43,6,4,Single Player Gamer,1230
125,Qa2cuLinCsQ,2024-03-24T15:30:29Z,"KGM JAM Splinterlands  Daily DCA, Land claims and pac openings 03-24-24 #splinterlands #nft #crypto",35,8,1,KGM JAM,615
126,EIW0NWJJt1o,2024-04-08T14:42:34Z,"Battle Mage Secrets Challenge,  Fire & Regret ruleset from Splinterlands game",2,1,0,poplar2155,5
127,zez_dXoi9mc,2024-03-31T19:12:17Z,Splinterlands - Gaming looking for Fab Four battles,9,0,0,Yonilkar,104
128,dG1M8XQAXf8,2024-03-17T06:01:48Z,Splinterlands : Even Stevens,5,0,0,Crypto yzzy,53
129,mQgIpJa1Xaw,2024-04-08T16:45:02Z,SPLINTERLANDS NEWS! Ecco il Nuovo Sistema di Guadagno! Cosa ci aspetta ora?,90,10,2,Riccardo WAMIT - Guadagnare Giocando,1320
130,alQaT3el2Us,2024-03-21T14:01:19Z,Build wealth and have fun w/Splinterlands,93,3,0,The Official Koinos Blockchain Channel,1180
131,oJVwPEMO4pA,2024-04-02T17:03:05Z,KGM JAM Splinterlands  Hive Engine morning claims 04-02-24 #splinterlands #nft #crypto #dcrops,46,10,5,KGM JAM,615
132,uLb_x8iHLw8,2024-03-18T08:20:09Z,BATTLE MAGE SECRET SPLINTERLANDS 3 bulan puasa,4,0,0,AHMAD BADRUD DUJA,163
133,7uruBw3gV3I,2024-04-11T14:10:12Z,Protect Your Team But Let Your Opponent Suffer | Amazing Battle | Splinterlands,12,2,0,RTonline,360
134,a97AGu2k1pg,2024-04-03T17:02:45Z,KGM JAM Hive Engine morning claims 04-03-24 #splinterlands #nft #crypto #dcrops #golemoverlord,16,4,3,KGM JAM,615
135,9ahKAPvq3no,2024-04-05T08:18:43Z,Splinterlands battle Fighting in Diamond league,6,0,0,Online Earning Tutorial,30
136,qSk_mu7ko3A,2024-03-18T17:01:54Z,battle mage splinterlands. game card yang menarik.,5,1,0,AHMAD BADRUD DUJA,163
137,mIzM7trZtBM,2024-03-20T16:17:45Z,"KGM JAM Splinterlands  Daily DCA, Land claims and pac openings 03-20-24 #splinterlands #nft #crypto",32,11,3,KGM JAM,615
138,K7O9ylkDa9A,2024-03-23T15:24:44Z,"KGM JAM Splinterlands  Daily DCA, Land claims and pac openings 03-23-24 #splinterlands #nft #crypto",23,6,1,KGM JAM,615
139,YYQExYHTHw4,2024-04-01T18:53:43Z,battle mage secret splinterlands 2 APRIL 2024,1,0,0,AHMAD BADRUD DUJA,163
140,vey2eRjxCq0,2024-03-16T13:03:00Z,crypto $81.82 fortnightly profit end of season rewards #splinterlands,44,3,0,How to make a dollar ,3660
141,4GGdDxJ4n0M,2024-03-29T10:28:17Z,10 Мир Феодалов Splinterlands,28,0,0,thallid Golos,152
142,chfpyN_2nho,2024-04-08T13:30:06Z,Splinterlands Land 1.5: UPDATE to my PLOTS in PRAETORIA! RENT or STAKE? GRAIN DEFICIENCY! #NFT #GAME,31,7,1,Single Player Gamer,1230
143,EFDYB6l-AIs,2024-04-01T04:07:31Z,Splinterlands 10 NFT pack opening! EPICS!  3/31/24,40,8,5,Boltz85,26
144,LcMY9dpnvE0,2024-03-21T08:50:44Z,07-1 Мир Феодалов Splinterlands,30,2,0,thallid Golos,152
145,DBCB_F5c0Pw,2024-04-11T11:24:41Z,Neues Belohnungssystem in Splinterlands April 2024,31,7,0,Hatoto,425
146,eXO1jBNaScg,2024-03-29T10:09:21Z,09 Мир Феодалов Splinterlands,21,0,0,thallid Golos,152
147,Ybl9IRtuS34,2024-03-21T20:14:07Z,splinter fit  bill VS giotrix battles  triceps training splinterlands SPS reward changes,9,1,0,How to make a dollar ,3660
148,XkEL9I5XERg,2024-04-01T07:09:29Z,11 Мир Феодалов Splinterlands,23,0,0,thallid Golos,152
149,cvHfWuVWYPs,2024-04-05T14:42:23Z,KGM JAM Hive Engine morning claims 04-05-24 #splinterlands #nft #crypto #dcrops #golemoverlord,30,5,6,KGM JAM,615
150,Or2JuDU9nV4,2024-04-11T23:05:27Z,Splinterlands and chill controversial topics and battles,17,1,2,How to make a dollar ,3660
151,ALSXiTYMd30,2024-03-17T23:29:48Z,Playing Splinterlands,10,1,0,Online Earning Tutorial,30
152,CJg8IbHih2I,2024-03-15T15:19:45Z,A Victory Tale in Even Stevens || Splinterlands Battle Mage Secrets Weekly Challenge!,1,0,0,yousaf haroon khan,25
153,wJlzc0JCGsI,2024-03-14T08:42:56Z,06-1 Мир Феодалов Splinterlands,38,2,0,thallid Golos,152
154,diUXTQgBgXQ,2024-04-07T16:08:34Z,13 Мир Феодалов Splinterlands,36,3,2,thallid Golos,152
155,LvVKQUldTSc,2024-03-21T09:13:04Z,07-3 Мир Феодалов Splinterlands,42,0,0,thallid Golos,152
156,FZ5YFW4S1f0,2024-04-08T13:04:13Z,15 Мир Феодалов Splinterlands,42,2,3,thallid Golos,152
157,gfyBjHZGCu0,2024-04-09T06:10:30Z,16 Мир Феодалов Splinterlands,35,0,0,thallid Golos,152
158,uxggmfR1zG4,2024-04-07T15:38:04Z,12 Мир Феодалов Splinterlands,47,5,1,thallid Golos,152
159,M2GpgUSNjcE,2024-04-11T15:14:50Z,19 Мир Феодалов Splinterlands,18,1,0,thallid Golos,152
160,-wRE6Y81x5Q,2024-04-04T14:35:37Z,Splinterlands - Social Media Challenge - Play to Earn,20,1,2,Information Gateway,1270
161,zS31Zoq7g-I,2024-03-21T06:36:09Z,Splinterlands : Demise Archon Faust,10,2,0,Crypto yzzy,53
162,rui5sCPiG_g,2024-04-11T06:32:26Z,Splinterlands : Pallus,5,1,0,Crypto yzzy,53
163,3mC82FySz14,2024-03-15T08:13:19Z,06-2 Мир Феодалов Splinterlands,43,2,0,thallid Golos,152
164,Xys85kLAUXE,2024-04-04T12:00:24Z,#95 A GamesOnTheBlock Conversation | The People's Guild: A Splinterlands Podcast,313,24,31,The People's Guild,421
165,TQaIO1glDlI,2024-04-07T16:30:11Z,14 Мир Феодалов Splinterlands,52,3,0,thallid Golos,152
166,T2bYEoUUngY,2024-04-08T06:02:00Z,2024-04-08 Мир Феодалов Splinterlands,32,2,0,thallid Golos,152
167,lH_YoOm4BP4,2024-04-01T15:22:14Z,Daily Focus 16 Gold Chest Opening | Splinterlands,26,14,7,Bon Galaban,6050
168,mgUnitndZFQ,2024-03-21T08:58:10Z,07-2 Мир Феодалов Splinterlands,30,0,0,thallid Golos,152
169,CbCO0O5FgcA,2024-04-10T06:25:00Z,18 Мир Феодалов Splinterlands,23,0,2,thallid Golos,152
170,WS45JG6uUw4,2024-04-11T19:43:22Z,"Splinterlands, sistema de recompensas, SPS y más",5,1,1,Yonilkar,104
171,UthshNrnhnA,2024-04-10T05:58:10Z,17 Мир Феодалов Splinterlands,22,0,0,thallid Golos,152
172,VPR-mG1wMN4,2024-03-21T02:44:27Z,"Splinterlands SPS, packs y más",8,0,0,Yonilkar,104
173,115BA0ykAQg,2024-04-04T19:55:13Z,Mycelic Slipspawn Card Review | Amazing Battle | Splinterlands Social Media Challenge,8,1,0,RTonline,360
174,F7CL7oeEZBg,2024-04-09T03:13:35Z,"Opening elite rewards, 8 draws from splinterlands new reward shop. 4.9",12,3,0,Prisslo's games,59
175,mjWeyA8fAHk,2024-03-25T04:54:28Z,RankBattles w/ Rentals | Chaos Legion | Splinterlands | (2 of 2 cont.),27,4,5,Boltz85,26
176,FOdCmNYnQ4g,2024-04-09T22:30:02Z,Splinterlands Rewards Claim 4-9-24,6,4,4,vtmacguru,7
177,qygy9GzBhg0,2024-03-25T14:02:02Z,EXPLODING the Splinterlands user base,417,3,0,The Official Koinos Blockchain Channel,1180
178,2oap1FJ7LcY,2024-04-03T06:41:21Z,2024-04-02 Мир Феодалов Splinterlands,41,3,0,thallid Golos,152
179,JsTAXRGhDEk,2024-03-17T09:13:22Z,Play to Earn Web3 Gaming Projects  Splinterlands Illuvium Star Atlas,219,2,0,Web3 Wave Hub,1300
180,cxc3X-Ww7TA,2024-04-03T08:00:16Z,MAJ  sur splinterlands aujourd'hui 2 avril avec récompenses de saison!,3,0,0,H1r0 Mrtlm,11
181,Dd70oJav_kI,2024-03-26T09:16:37Z,magic vs magic #playtoearn #splinterlands #cardgame #cryptodude,24,2,0,Crypto Dude Channel,3430
182,fDW5o1UOwJQ,2024-04-07T15:57:52Z,A Week of Fire & Regret in Splinterlands || Strategies for Fire & Regret Success || play2earn 2024,3,0,0,yousaf haroon khan,25
183,ZvMedNRwbDQ,2024-03-27T20:32:37Z,Daily Overdose of memes in Splinterlands! #play2earn,7,0,0,master watch,5
184,ANW1EGPSlno,2024-04-07T06:09:59Z,Splinterlands : Fire & Regret,10,1,0,Crypto yzzy,53
185,EviF-91iv5o,2024-04-05T07:39:50Z,What a clutch game! #splinterlands #play2earn,11,1,0,master watch,5
186,vE52_XzY6hI,2024-04-09T01:49:52Z,Glint a nova recompensa em Splinterlands,34,3,0,Canal Weslen Mariano,439
187,FC9Rv1NWPEU,2024-03-30T07:21:22Z,I Made A Secret Splinterlands Office Dungeon,24,1,0,Goldmatters,781
188,ZJbLaykHxuA,2024-03-16T01:54:39Z,Splinterlands end of season rewards 67 bronze chest 3.16,9,2,0,Prisslo's games,59
189,UrE9iAimwyc,2024-03-31T06:59:10Z,Splinterlands : Fab Four,8,1,0,Crypto yzzy,53
190,yCzoeAnmzjQ,2024-03-30T04:32:23Z,Splinterlands 15 NFT pack opening! 03-29-24,46,11,4,Boltz85,26
191,OH8VJdMMRLM,2024-04-11T15:01:05Z,Splinterlands - Using Summoner Prophet Rosa - Play to Earn,3,0,0,Information Gateway,1270
192,1wLRiBOyXD0,2024-03-18T12:54:22Z,Splinterlands - Rebellion Release!,3,0,0,CabalC Gaming,5
193,kxFULgIhisk,2024-04-07T02:49:42Z,"Opening 10 master draw from splinterlands new reward shop, let's see what we'll get. 4.7",26,5,0,Prisslo's games,59
194,j5XZsO6vj4E,2024-04-06T20:46:22Z,Battle Mage Secrets Weekly Challenge! Fire & Regret Ruleset | Splinterlands,4,1,0,RTonline,360
195,xEZbZ5ucIuQ,2024-03-14T05:56:45Z,Splinterlands : Avarisdeus,5,1,0,Crypto yzzy,53
196,zJ8Lr-d2mrU,2024-03-15T16:32:23Z,KGM JAM Splinterlands  End of Season rewards 03-15-24 #splinterlands #nft #crypto,35,13,6,KGM JAM,615
197,H6u3dfeQsbo,2024-03-23T13:37:20Z,Splinterlands 101 - Ep 115: The Glint In His Eyes (The New Reward System),74,13,5,Bobaphet,170
198,iBdVUVMgpG0,2024-03-16T20:31:18Z,Battle Mage Secrets Weekly Challenge! Even Stevens Ruleset | Splinterlands,14,1,0,RTonline,360
