,Video ID,Published Date,Title,View Count,Like Count,Comment Count,Channel Title,Subscriber Count
199,F5540x3zQfc,2024-04-06T01:16:21Z,"SPECIAL OPPS GUILD Weekly Drawing Video for April 5th, 2024. SPLINTERLANDS.",7,0,0,App Bap,6
200,F5540x3zQfc,2024-04-06T01:16:21Z,"SPECIAL OPPS GUILD Weekly Drawing Video for April 5th, 2024. SPLINTERLANDS.",7,0,0,App Bap,6
201,MFGXDzwI_-s,2024-03-25T22:41:25Z,#splinterlands #เล่นเกมหาเงิน #playtoearn #cryptodude,23,3,0,Crypto Dude Channel,3430
202,g5Ed3tRLhWQ,2024-04-11T03:07:51Z,Opening another Gladius case from splinterlands 4.11,14,2,0,Prisslo's games,59
203,Mm1xmuLL_jE,2024-03-18T21:00:11Z,Welcome to The Splinterlands (Borderlands 3),6,0,0,ExtraToasty,15
204,PG9Xmg2n9_o,2024-04-05T02:17:25Z,"Opening another Gladius case from splinterlands 4,5",18,4,0,Prisslo's games,59
205,D0t_VIp-E1k,2024-03-16T16:02:08Z,"KGM JAM Splinterlands  Daily DCA, Land claims and pac openings 03-16-24 #splinterlands #nft #crypto",50,10,4,KGM JAM,615
206,XXG0Or_8nxI,2024-03-15T13:48:19Z,Splinterlands 101 - Ep 114: Behind The Avatar @killerdragon24,97,11,0,Bobaphet,170
207,4A_kzOu8JT0,2024-03-30T20:54:39Z,Battle Mage Secrets Weekly Challenge! Fab Four Ruleset | Splinterlands,10,1,0,RTonline,360
208,EdBCR8DwVSU,2024-03-18T01:00:10Z,Borderlands 3 | Re-Exploring Pandora For 100% / The Splinterlands (Episode 14),2,0,0,725 Journal,1160
209,LdudWA08u30,2024-03-31T13:07:00Z,splinter fit Strategies for splinterlands Weigh in 125.7KG guilds upcoming changes to SPS DEC,2262,8,1,How to make a dollar ,3660
210,XkF2L9JCH4w,2024-03-24T17:40:02Z,Rental Strategy | Chaos Legion | Splinterlands | (1 of 2),32,6,0,Boltz85,26
211,NnPlmT8alQE,2024-03-23T20:01:59Z,Battle Mage Secrets Weekly Challenge! Explosive Weaponry Ruleset | Splinterlands,9,1,0,RTonline,360
212,szdWnY_sUAI,2024-03-16T02:57:05Z,"SPECIAL OPPS GUILD Weekly Drawing Video for March 15th, 2024.  SPLINTERLANDS.",8,0,0,App Bap,6
213,r7swFU5OswA,2024-04-04T02:37:17Z,"The last end of season reward chest from splinterlands, 31 silver chest 3.4",24,4,0,Prisslo's games,59
214,Uxcx0IiYFSA,2024-03-15T02:49:43Z,battles with bill splinterlands how to train arms,9,2,3,How to make a dollar ,3660
215,jqlpL6GJ998,2024-03-14T17:04:13Z,"KGM JAM Splinterlands  Daily DCA, Land claims and pac openings 03-14-24 #splinterlands #nft #crypto",40,8,3,KGM JAM,615
216,jmhQ6QmZTl4,2024-03-29T02:08:20Z,Opening another Gladius case from splinterlands 3.29,7,3,0,Prisslo's games,59
217,G3ALJB8ypaQ,2024-03-29T14:57:12Z,Dica: jogar Splinterlands com o navegador Kiwi,4,0,0,Éverton Ehvinho,1
218,EqNlz7olsdE,2024-03-27T23:14:09Z,Splinterlands Карточная игра на блокчейне. Обзор #КриптоСреда Выпуск 3   Ru-En-De,41,12,1,Vicky Streams,76
219,yH-x7bS_idU,2024-03-22T03:25:32Z,#CapCut #motivation #motivational #motivationalvideo #Motivation #splinterlands #Matrix,2,0,0,How to make a dollar ,3660
220,E1_iVSamaU0,2024-03-28T20:58:01Z,Why is Runic Skyclaw So Useful to the Team? | Splinterlands Social Media Challenge,10,1,0,RTonline,360
221,Edi1mJK96N8,2024-03-19T02:24:54Z,Opening another Gladius case from splinterlands 3.19,13,2,0,Prisslo's games,59
222,IEZr5-LbAlo,2024-03-20T13:07:00Z,splinter fit  how to train back stoics rules splinterlands modern battles,2206,4,0,How to make a dollar ,3660
223,YvYQgjFn7Tk,2024-03-17T14:16:17Z,today Splinterland gaming video #viral #viralvideo #splinterlands #highlights,4,0,0,aburihan 2021,24
224,1TPPhqOxZqo,2024-03-26T03:33:25Z,"sps is getting consistent, splinterlands daily reward 11 bronze chest 3.26",20,2,0,Prisslo's games,59
225,pE6z0qJTB0o,2024-03-31T16:38:44Z,battle mage secret splinterlands 31 maret 2024,12,0,0,AHMAD BADRUD DUJA,163
226,oqq2upGLQcY,2024-04-02T09:57:44Z,récompense du 2 avril sur splinterlands,15,3,0,H1r0 Mrtlm,11
227,cTs0K6b7C_8,2024-04-07T20:42:30Z,splinter fit splinterlands talk Weigh in 124.5 starring bill and MRCRIPPLE new season changes SPS,3,0,0,How to make a dollar ,3660
228,BCqgUC0Ehss,2024-04-08T16:36:10Z,Splinterlands Around The World,140,3,0,Goldmatters,781
229,1AsDp0fWKjA,2024-03-21T02:07:26Z,"lot of sps for bronze chest, splinterlands daily reward 10 bronze chest. 3.21",3,2,0,Prisslo's games,59
230,UuaTuZLydFc,2024-04-11T17:00:28Z,Once again a very CLUTCH game! #play2earn #splinterlands,3,0,0,master watch,5
