,Video ID,Published Date,Title,View Count,Like Count,Comment Count,Channel Title,Subscriber Count
0,Lqlb33oB6D8,2024-04-12T20:46:32Z,The Backrooms Enter The Sandbox!,402,10,2,TheSandboxGame,155000
1,T7pvpE_72tk,2024-03-30T05:29:30Z,The Sandbox (SAND) Can It Reach $3.42 Expert Analysis & Price Targets,182,5,0,Crypto Chronicle,1910
2,TNIYFY_LOq4,2024-04-02T22:00:12Z,The Sandbox Takes Over Underground Boxing Event!,4445,427,59,Blazzy ,13300
3,qtplDU34xB4,2024-04-05T05:00:26Z,[The Sandbox] Habbo Sapce Hotel ∥ 47/47 All Quest 🏆,676,26,1,AEBack 🍀애백🍀,619
4,b-eUbhMEuHw,2024-04-07T01:15:13Z,"Joe Rogan: ""Sandbox VR is the Craziest Experience""",53242,772,51,JRE Daily Clips,385000
5,UNIcRoHawCg,2024-04-08T15:30:09Z,[The Sandbox] INNISFREE: THE ISLE Adventure ∥ 12/12 All Quest 🏆,576,26,4,AEBack 🍀애백🍀,619
6,lpkaLihEn9Y,2024-03-26T08:05:32Z,The Sandbox Game Review - User-Generated Crypto & Blockchain Games,49,1,0,TechStorm,1360
7,qSuZW936qlY,2024-04-15T19:35:40Z,"In The Sandbox Metaverse, Pretty Much Everything (Including The Limited Parcels of Land) is an NFT",44,0,0,Blockchain Journal,454
8,ycNq_1PykGo,2024-04-19T19:00:32Z,The Sandbox 0.10 Game Maker Feature Reveal and Giveaways with Alex and Lukus,153,8,2,TheSandboxGame,155000
9,nQQrwBWwRwU,2024-04-11T20:28:14Z,Tower Defense in the Sandbox! Play the GOBLIN SIEGE now!,75,420,2,box3 Studio,2270
10,DjS1meuODIM,2024-03-30T16:44:01Z,The Sandbox SAND Coin (Token) Nedir Fiyatı Analizi Hedefleri Geleceği Al Sat Bölgeleri,1508,103,11,EKO KRIPTO,25200
11,WM8U_aleSLY,2024-04-05T22:42:04Z,The Sandbox SAND price analysis,219,6,4,Crypto-Possible,171
12,9CnUlvdlaDI,2024-03-27T02:14:55Z,The Sandbox Tree : Nature's Dynamite,1509,23,0,The Curiosity Outlet,151
13,rwa2Ch6kwsk,2024-04-12T04:26:48Z,The Sandbox Game - Maradona Ascension Walkthrough 17 Quests,64,2,3,Sandbox Walkthrough,162
14,nlxmYtIchBk,2024-03-27T21:23:52Z,The Sandbox | Elemental Odyssey,7,0,0,TobiNCraft,12
15,TaezX1XsBpI,2024-03-25T17:05:58Z,Piggy Build Mode | The SandBox,12,2,0,Raul_WolfYT,31
16,adulWi0zWFs,2024-03-22T19:00:03Z,"1,000 Experiences published on the The Sandbox Map",251,15,3,TheSandboxGame,155000
17,gfKlZsh2DdM,2024-04-15T19:28:57Z,Who is the STRONGEST in ZOONOMALY?! (Garry's Mod Sandbox),106889,2860,194,SHOOTABIRDIE,3510000
18,eCC_KoFOC_8,2024-03-27T07:31:40Z,[The Sandbox] Adventure Land Chapter 2: Finding the Black Tower ∥ 27/28 Quest 🏆,375,6,5,AEBack 🍀애백🍀,619
19,MrFRdi_PiCc,2024-04-06T16:20:42Z,Ballin at the Sandbox,8,1,1,Felotive,15
20,UA7qmx6LIiI,2024-03-23T14:55:41Z,$SAND moving to $2.20 in the near future? #thesandboxgame #thesandbox #sandbox #crypto #cryptoworld,374,10,3,Tim Johnson,232
21,jHh4HRFNvM0,2024-03-29T03:41:45Z,First day in the Sandbox. Spring came),7,2,0,Sandbox Day,1
22,oVFqjXNmZjY,2024-04-09T08:30:36Z,[The Sandbox] INNISFREE  THE ISLE Adventure WALKTHROUGH ALL QUEST,46,2,0,SparkLife TV,17
23,JXexsmY5EI4,2024-04-12T04:19:50Z,The Sandbox Game - THE ISLE Adventure Walkthrough 12 Quests,31,1,0,Sandbox Walkthrough,162
24,BqDiCrJKQ-s,2024-03-28T17:00:08Z,THE SILLIEST NPC YET - Garry's mod Sandbox,114515,1611,130,TheFrizkyFrog,1030000
25,gu26wXLLhFA,2024-04-05T03:22:57Z,The Four Resting Places of The Sandbox Machine - Rec Room Shorts #shorts #recroom,5035,120,15,Budder Shnarf Gaming,789
26,o_no6hNdwRA,2024-04-09T20:10:19Z,"MASSIVE Sandbox Changes, Into the Light Update & Playlist Changes (Update 7.3.6) | Destiny 2",130508,4802,317,Aztecross,819000
27,yjWlN3SI2TQ,2024-04-08T13:13:06Z,DREDEY - FROM THE SANDBOX ft MaaL,16,1,0,Dredey,3
28,6u8X99Mv-8o,2024-03-25T14:06:58Z,my good friend Alex at sandbox news with the alley oop @sandboxxapp,387762,27269,443,Habitual Linecrosser,561000
29,s_rtSSZM15A,2024-04-09T06:52:58Z,The Bank Job | Teaser | The Sandbox,2,0,0,Loa Loa Games,2
30,Ufk5PRsA76w,2024-03-30T21:05:00Z,Life Lessons from the Sandbox,26,3,0,Time for a Ten,80
31,iB1VZttp4c4,2024-04-09T16:16:31Z,【The Sandbox】- The ISLE Adventure - All Quests Walkthrough!,51,4,1,mrPLO Sandbox,107
32,UJGoubCfG0I,2024-03-29T18:01:56Z,THE SANDBOX CRYPTO PRICE PREDICTION,462,11,4,Crypto Talk,396
33,bhIwGNsirms,2024-04-05T16:13:07Z,【The Sandbox】- Habbo Space Hotel - 47/47 Quests Walkthrough!,403,15,1,mrPLO Sandbox,107
34,RZ3pjCINmIY,2024-03-28T15:07:00Z,"ADIÓS Decentraland, The Sandbox, Axie… ESTE juego resucita al GameFi (SpaceCatch)",5944,422,122,La Ola Cripto,129000
35,zDeWf_-saZY,2024-04-08T10:31:05Z,Playing with toys in the sandbox! #toys heroes #makvin cars #Toys,1,0,0,Toys,1
36,Lzy0P37MCc8,2024-04-11T10:27:25Z,[The Sandbox] DOGAMÍ  DOGA CITY: WALKTHROUGH  ALL QUEST.....RUN......,40,5,0,SparkLife TV,17
37,9i0sQpLdKNc,2024-03-24T22:22:56Z,Line in the Sandbox,47,2,0,Michael Barder,5
38,0lbWbmqQI2s,2024-03-24T11:03:25Z,What if you invested MONTHLY $300 in The Sandbox for the past 12 Months?,6,0,0,Whatifcrypto,24
39,Pc10rTkXtFY,2024-04-01T14:00:13Z,2024 : ENFIN l'année du GAMING en CRYPTO ? Avec The Sandbox (Sebastien Borget),4042,171,8,Cryptoast,155000
40,qcnL-XvQhEU,2024-03-29T07:45:11Z,[The Sandbox] Entanglement Lubosan  RUN...... All  Quest,48,0,0,SparkLife TV,17
41,3002o7bXfHw,2024-04-12T00:39:33Z,Back to the Sandbox! | Battle Talent Demo,3,0,0,Kenway Black,15
42,-LeDqdEA_7E,2024-04-06T22:56:26Z,"Grounded Playthrough, Whoa! Difficulty Ep 10, Scavenging the Sandbox",28,1,1,pcdeltalink036,325
43,uS4VO58Y7Go,2024-04-05T23:06:39Z,JOE ROGAN on THE SANDBOX ZOMBIE EXPERIENCE,1,0,0,Frank,8
44,-grqMLZ9fRc,2024-04-10T15:04:29Z,Life in the Sandbox: Ron Price: Having Difficult Conversations-Part 3,4,0,0,KSJE FM,485
45,ysZGe8hvk1Q,2024-03-23T04:12:24Z,Gated Speaker Components In The Sandbox GM .9.11,32,3,1,Adam Sale,98
46,fzFeVZtICP8,2024-04-08T17:06:01Z,INNISFREE: The Isle Adventure | The Sandbox Game | @RossGuru,17,0,4,RossGuru,504
47,BOSslNj9A94,2024-03-23T12:00:17Z,African Animals and Prehistoric Dinosaurs Stuck in the Sandbox Muddy Adventure,9372,16,0,D for Dinosaur,5200
48,Y3EKs2BcJTE,2024-03-24T07:00:25Z,Saving Forest and Jungle Animals From the Sandbox | Educational Fun Facts for Kids,7739,16,0,Dino Island Park,22300
49,zKLQprJ4xzk,2024-04-04T11:00:53Z,My first Mammoth in the new server #albiononline #sandbox #farming #games,18658,846,32,Lusop,6700
50,ttwlyKsszBk,2024-04-16T19:39:53Z,Insurgency: Sandstorm - im in the sandbox,7,0,0,Mj Zathura,18
51,RPD2ijzApWE,2024-03-23T09:00:30Z,Jungle and Wild Animals Stuck in the Sandbox | Fun Learning Kids Videos for Kids!,4450,10,0,Kidiez World TV,84900
52,V-22JKH6uGU,2024-04-09T16:45:55Z,"From the Sandbox- Ep. 2 "" The Madness """,12,2,0,From The Sandbox,6
53,C8KgC89gC1k,2024-04-10T10:00:14Z,The Sandbox   Olive X #thesandboxgame #metaverse,1,0,0,pvtUnitfueler,2
54,KycHfCof6qg,2024-03-30T13:00:18Z,AutoRifles Ruined The PvP Sandbox (It’s Target Lock) Destiny 2 Crucible,9379,345,374,ItsJustSideways,419
55,gcszR815nbw,2024-03-26T12:12:37Z,The Sandbox 2024 03 22 20 45 01,1,0,0,Xaflindons,0
56,GVEJTAFAgH0,2024-04-16T00:12:21Z,Escaping the BubbleWrap Sandbox,45,2,2,nanovms,351
57,X5-asA6ExvY,2024-04-10T23:12:06Z,The Sandbox 2024 04 11 05 58 53,1,0,0,Harris s,0
58,ZPJPSjfXgN4,2024-03-25T22:37:33Z,"Understanding ""In the Sandbox Phase""",7,2,0,Meaning of the words,177000
59,c-5nAp1Iijc,2024-04-06T19:11:57Z,🔵I RUN THE SANDBOX | LoL🔵,13,2,0,JOY x JUMP,1520
60,xAH1oku8GOI,2024-03-27T23:15:16Z,Adventure Land - Chapter 1: The Secret of Red Eye | The Sandbox Game | @RossGuru,21,0,0,RossGuru,504
61,mj0FhWYzP6k,2024-04-06T00:07:06Z,Traxxas TRX4M Ford Bronco In The SandBox! #shorts #rccar #traxxas,6258,73,0,The Next Level RC,650
62,06wXqwF_imA,2024-04-21T10:00:00Z,The Sandbox   Dungeon of Dum Yz #thesandboxgame #metaverse,1,0,0,pvtUnitfueler,2
63,0FZmwh4fcnY,2024-03-28T03:09:34Z,Playing in the sandbox.,33,1,0,Chongomoto,20
64,0y0A7w2n10E,2024-04-18T05:30:23Z,"ILLUVIUM BETA 4 ACCESS, NEW GAME MAKER FROM THE SANDBOX & BUILDING INSIDE NIFTY ISLAND",23,0,0,Krafter,207
65,5DRJ6EdyPVA,2024-04-05T15:05:25Z,🔵I RUN THE SANDBOX | HALO & LoL🔵,13,3,0,JOY x JUMP,1520
66,i139PI3Qqb4,2024-04-18T19:00:17Z,The Greatest Sandbox Game of All Time,4850,321,72,Olexa,150000
67,QlKl6sj01II,2024-04-13T01:16:22Z,Playing With The Sandbox Mode In Tower Doomer !  #gaming #games,455,12,2,Beefton Ballon Games,16
68,iUikoIOnxy0,2024-04-09T01:27:24Z,The Sandbox tree also known as the dynamite tree is covered in Spikes full of poison #Sandbox Trees,427,7,0,DidYouKnow?,1060
69,zrG-MkblaOk,2024-04-09T15:29:43Z,The Sandbox - YesChef GJ - Hell's Kitchen Vegas,12,1,1,Radzinkx,779
70,FCVqgvrt35U,2024-04-17T10:00:13Z,The Sandbox   Care Bear #thesandboxgame #metaverse,0,0,0,pvtUnitfueler,2
71,vB7r720tR0A,2024-04-08T04:37:41Z,Lego Star Wars: Skywalker Saga #18 - Back to the Sandbox,7,0,0,CB Plays,182
72,3O3KCy5vtbI,2024-04-13T01:13:15Z,VoxEdit: Como Crear Un Cofre Interactivo Simple | Guía / Tutorial | The Sandbox Game,6,2,0,CriptoPlanet,172
73,FN7a4SR0Ikw,2024-03-31T07:00:07Z,Exploring the Forest Animals and Zoo Animals From the Sandbox' Fun Learning,54185,110,0,Dino Island Park,22300
74,ji2m5b-f41Y,2024-04-07T15:00:36Z,GROUNDED RETURNS! #7 Exploring the Sandbox for Armour,1,0,0,Pegether,41
75,K7suJ23NIuM,2024-03-26T11:00:07Z,What is the Sandbox | Types of Sandboxes | Governor Limits | Salesforce | #SalesforceNest,11,0,0,SalesforceNest,148
76,TAOkRJwiRkU,2024-03-23T22:00:20Z,TO THE SANDBOX AND BEYOND: Grounded FULL TWITCH VOD,2,1,0,Mr.LeeGamingVODS,6
77,7iaQbpOaQn8,2024-03-23T06:05:29Z,just made the longest stair on Untitled Sandbox game [reaching heaven],56,0,5,Brandon,0
78,Xr9B0u1AuWo,2024-04-05T10:06:32Z,The Sandbox - mecoVerse!,3,0,0,mediencollegeBerlin,76
79,IQ_zic2DYQ8,2024-04-09T10:55:57Z,[The Sandbox] Shadows Untold: BLOOD ISLAND .......Speed RUN..............,7,1,0,SparkLife TV,17
80,Ip5BL1lKh7Q,2024-04-13T19:56:48Z,the mpg version  #melonplaygroud #melonplaygroud #sandbox #art #trending #memes #meme,2118,39,2,Robfin5,295
81,pBDg6dw63X0,2024-03-27T01:19:46Z,Since The Sandbox (feat. Berner415 & Chris King),42,0,0,Joe Peshi - Topic,18
82,i9TkxZiZDys,2024-03-29T14:06:15Z,TSB_DUST Trailer The Sandbox,45,1,0,扎古菌Zakuui,139
83,SoyvVrz8uLc,2024-04-03T06:02:56Z,"The Sandbox MX in Fernley, NV - Half of a 17 Min Moto Practice",329,4,0,Simple Tree MX,85
84,RRWo72YoCH4,2024-03-29T02:26:19Z,【The Sandbox】- Adventure Land Chapter 2 Finding the Black Tower - All Quests Walkthrough!,102,3,0,mrPLO Sandbox,107
85,OG8toXEKfcQ,2024-04-07T02:00:17Z,Found Some Rootbeer Chert At The Sandbox! #rootbeer #chert #rockhounding #thesandbox,454,21,6,City Rockhounding,1010
86,QS2L6VHNAGc,2024-04-20T00:10:54Z,PA Dev Stream - TO THE SANDBOX!,44,6,0,BrOverShield,537
87,NeSdim4yGBs,2024-03-27T11:00:18Z,The Sandbox  Songkran Waterfight #thesandboxgame #metaverse,2,0,0,pvtUnitfueler,2
88,1wpImfedpO8,2024-04-13T23:16:49Z,Wide open at the sandbox!,815,25,0,TTMX WILD,281
89,IiZBLuNl7cY,2024-04-17T08:41:09Z,[The Sandbox] MAGNIFICENT CENTURY: EXPERIENCE  ALL QUEST WALKTHROUGH,155,5,2,SparkLife TV,17
90,U8uAtiutgLM,2024-04-03T03:02:22Z,THE SANDBOX 2Dアクションに適したシンプルな床作り　Post Process Effectsも使ってみる Game Maker,122,7,1,いまから！THE SANDBOX,1160
91,qsWAaRFEqnE,2024-03-23T11:00:31Z,Build and Monetize your Virtual World in The Sandbox #shorts,412,5,0,Satoshi Sisters,55
92,A74NFjZvoOI,2024-04-07T09:09:40Z,the battle bricks: corrupted sandbox thingy,1105,18,17,Blue Slushy Cookie's Arrows,305
93,15BTxFbvoWI,2024-04-07T05:31:24Z,Digging in The Sandbox,429,8,0,Octane,295
94,LKKJqsThc-E,2024-04-13T03:03:45Z,THE SANDBOX COIN PRICE PREDICTION 2024 | SANDBOX COIN NEWS TODAY | खरीदें या नहीं? क्या करना सही?,76,7,0,Kri Trade,1280
95,v4g-pJqme2o,2024-04-01T05:16:54Z,Dirty Rotten Imbeciles - Syringes In The Sandbox (Music Video),1,0,0,Beanut's Media Archive,108
96,ue4FEEvhAFE,2024-03-30T09:37:58Z,all the pros of roblox verses all the sandbox bacons,126,3,0,DreamDJ_trickshootGAME,28
97,p9dpDQJekP0,2024-04-09T16:40:58Z,"Episode 11 | The Sandbox, Video Podcast by smartShift | Mark Stupeck, VP of IT, Tiffin Motorhome",6,0,0,smartShift,53
98,du7l3ZNPgI0,2024-04-11T20:23:30Z,The 550 Million Against One Sandbox Advantage,11,0,0,ActualTech Media -,3280
99,I4veJYE3E8U,2024-04-08T05:54:41Z,The Sandbox Game - Iftar Dinner Walkthrough 25 Quests,17,1,0,Sandbox Walkthrough,162
100,Yzk2cgufVKI,2024-04-12T17:23:33Z,Bratz digital dolls in The SandBox Game  #bratz,137,3,0,Flickplay,495
101,1zMRudGxQZA,2024-04-04T17:38:52Z,Directions to the Sandbox,35,0,0,UCLA Office of Advanced Research Computing (OARC) ,6130
102,j-xusgbhPTI,2024-04-08T03:32:06Z,Cute baby playing in the sandbox with a great imagination,29,4,0,Comstock Family ,1620
103,9lgNpszWVzI,2024-04-03T10:00:06Z,The Sandbox   Shattered Time #thesandboxgame #metaverse,1,0,0,pvtUnitfueler,2
104,oTsKTpnxYfQ,2024-04-20T08:30:06Z,Kral Şakir: Devler Uyandı! Hem Sinemalarda Hem de The Sandbox Metaverse'te!,376,3,1,The Sandbox Türkiye,585
105,DyX1GLAkWb8,2024-04-11T15:35:05Z,Cleaning up messy code for the sandbox map | Daybreak modding,71,3,0,Vicious Sal,1120
106,xelaKvBBUNI,2024-04-09T09:42:13Z,The Sandbox - Entanglement Puzzle- Green Voxel,0,0,0,playWing with a W,21
107,scYIwzzNHFw,2024-03-22T17:15:02Z,RUN - Action City - The Sandbox - All Quests,50,3,4,Le Voyageur du VirtualUniVerse,105
108,0HbqDmBeKrA,2024-04-16T21:30:00Z,THIS SANDBOX VIDEO GAME MOST POPULAR GAME IN THE WORLD (MINECRAFT) #minecraft #sandbox #shorts,317,16,1,Rivaldi Shorts Official,83
109,8B_JfmdhhbY,2024-04-19T18:34:14Z,"The Sandbox.Space Weekly #019 (April 17, 2024)",8,0,0,GDEX,323
110,1gFEJW6UBHI,2024-04-01T21:49:23Z,he is the best #dad #sandbox #diy #toddleractivity #outdoors #fun #love #playactivities #kids,4784,73,1,The Martinez Family Adventures,312
111,E4G_qMTANPw,2024-04-03T15:00:01Z,Life in the Sandbox: Ron Price: Difficult Conversations-Part 2.,6,0,0,KSJE FM,485
112,8--y2ENTxIQ,2024-03-30T00:54:55Z,Adventure Land - Chapter 2: Finding the Black Tower | The Sandbox Game | @RossGuru,20,0,0,RossGuru,504
113,vOYEJ4w_X9U,2024-04-07T01:51:00Z,The sandbox evolution,2,0,0,ProleaugeLive,1
114,J-waExl7dh8,2024-03-27T18:04:35Z,Getting the sandbox island! Roblox,240,4,1,Kate’s Kreative,5190
115,yuBWC5ca3SY,2024-04-03T16:01:00Z,Ancient Cities: The Sandbox tribe,125,6,0,Thaurius,3340
116,YbrQZ3-Bo38,2024-04-06T12:44:20Z,【The Sandbox】解任務拿sand幣！｜十萬訂閱加班耐久台# 69｜倒數15小時｜PFY玩給你看,1310,46,0,PFY玩給你看,101000
117,hr88pGBrxOI,2024-03-25T19:02:50Z,The Smart Stars- Hide & Seek (In The Sandbox,0,0,0,The Smart Stars,241
118,-1NyKfahs8Y,2024-03-24T17:28:30Z,New update to the GC Football Sandbox! #gymclassvr,1898,39,4,Gym Class - Basketball VR,3220
119,byy-ZaKq0Ew,2024-03-26T03:04:46Z,"LIVE in the Sandbox! Games, News Giveaways!",0,0,0,TEMPEST STUDIOS,44
120,heQU9AIJmYE,2024-04-07T06:08:57Z,Off Kilter - Control (with drum cam) - The Sandbox 3/23/2024,41,1,0,Wadspo,442
121,IfGO1_No_Hk,2024-03-25T14:00:13Z,FREE TO PLAY TO EARN GAMES LIVE NOW | The Sandbox #shorts,491,7,0,PlayToEarn,14400
122,s_v7GpGaH-g,2024-04-04T04:25:23Z,Catnap got extra help digging in the sandbox,6937,91,9,Denis's Huggies & Other Plush Toys,8020
123,wGh5NOUdilM,2024-04-09T05:26:29Z,Chinese room in the sandbox丨Simple sandbox丨 #sbb2,8,1,0,Simple sandbox-Logicallynon逻非,4
124,DqFsvEAu_b0,2024-04-12T07:00:08Z,【番外編】クラウドファンディングの結果をご報告【The Sandbox】,38,4,0,スタジオパッチ👻いけもとしょう,208
125,hBaAbAWvm4U,2024-04-17T00:18:01Z,【未経験からゲームを作る！】The Sandbox オンラインクリエイター講座 ～第六回 Health(体力)やリスポーンが理解できれば、もうGM上級者！～,120,11,0,The Sandbox Japan,171
126,rne_0gB2w18,2024-04-07T11:00:44Z,The Sandbox of Students Works,34,3,0,The Route Podcast,107
127,dDEJfJSKYZs,2024-04-18T20:05:06Z,I Wumboed The Sandbox │ Doom 3 (Episode 1) │ BACKSEAT GAMER,6,1,0,MNTL Studios,75
128,AZ7AcNogJZc,2024-04-11T18:44:26Z,Project Garden: RELOCATING THE SANDBOX Part 1 #garden #project #diy,2311,8,0,JKNL ,1250
129,vYL51YorB1E,2024-04-12T11:00:48Z,One of the BEST FAME FAME methods #albiononline #sandbox #albiononlinepve,6480,251,12,Lusop,6700
130,orIOGgMB238,2024-04-13T21:35:12Z,Beating 3 star DEATHBRINGER + messing with the sandbox [After the rework],21,0,1,BaconTheKing,384
131,DqFsvEAu_b0,2024-04-12T07:00:08Z,【番外編】クラウドファンディングの結果をご報告【The Sandbox】,38,4,0,スタジオパッチ👻いけもとしょう,208
132,d-gn8brfShg,2024-04-15T07:39:06Z,艾肯娛樂在 The Sandbox 元宇宙推出《Voices of Taiwan》體驗 將台灣文化帶入全球舞台,24,4,0,The Sandbox 中文頻道,1570
133,8--y2ENTxIQ,2024-03-30T00:54:55Z,Adventure Land - Chapter 2: Finding the Black Tower | The Sandbox Game | @RossGuru,20,0,0,RossGuru,504
134,vOYEJ4w_X9U,2024-04-07T01:51:00Z,The sandbox evolution,2,0,0,ProleaugeLive,1
135,wvRLA3F_snU,2024-04-09T23:11:33Z,duo in the arena. Albion online.#mmorpg #gaming #sandbox #gameplay #albiononline #albionpvp #gamer #,2420,46,0,DLopes94,654
136,yuBWC5ca3SY,2024-04-03T16:01:00Z,Ancient Cities: The Sandbox tribe,125,6,0,Thaurius,3340
137,xAydZhfqEZI,2024-04-15T21:17:46Z,W.C.S. SNIPING COBRA PILOT TO SECURE THE ROUND!  #armareforger  #fps #milsim #sandbox #shorts,454,7,0,Nizarati,27
138,YbrQZ3-Bo38,2024-04-06T12:44:20Z,【The Sandbox】解任務拿sand幣！｜十萬訂閱加班耐久台# 69｜倒數15小時｜PFY玩給你看,1310,46,0,PFY玩給你看,101000
139,bR5286Ee4p0,2024-03-30T14:45:02Z,Get Creative with the Sandbox   A Fun and Messy cleaning outside,92,11,0,Rose Marie Love Cleaning,39900
140,uzR56Tf5wqM,2024-04-04T19:00:24Z,The Right Size Managerial Sandbox with Phil Geldart #shorts,44,1,0,Cynthia Corsetti,129
141,hBaAbAWvm4U,2024-04-17T00:18:01Z,【未経験からゲームを作る！】The Sandbox オンラインクリエイター講座 ～第六回 Health(体力)やリスポーンが理解できれば、もうGM上級者！～,120,11,0,The Sandbox Japan,171
142,byy-ZaKq0Ew,2024-03-26T03:04:46Z,"LIVE in the Sandbox! Games, News Giveaways!",0,0,0,TEMPEST STUDIOS,44
143,OEcgqJUuOlU,2024-04-02T13:00:19Z,Friends in the sandbox #chickens #chickenvideos #cutechickens #friendly #pets,30,0,0,Carrie Paxson,103
144,InygFnwXOgM,2024-04-18T16:03:20Z,So i was just messing around in the sandbox- (ULTRAKILL),228,13,12,EclipsedMoon,174
145,0XSzE4b_LJg,2024-04-07T06:09:59Z,Off Kilter - All My Life (with drum cam) - The Sandbox 3/23/2024,74,1,0,Wadspo,442
146,orIOGgMB238,2024-04-13T21:35:12Z,Beating 3 star DEATHBRINGER + messing with the sandbox [After the rework],21,0,1,BaconTheKing,384
147,dDEJfJSKYZs,2024-04-18T20:05:06Z,I Wumboed The Sandbox │ Doom 3 (Episode 1) │ BACKSEAT GAMER,6,1,0,MNTL Studios,75
148,i2-Asmcs1VE,2024-04-19T18:30:34Z,SAND WILL X1000 AFTER THIS NEWS!! IT'S POSSSIBLE?? - The Sandbox PRICE PREDICTION 2024 NEWS,26,0,0,Mrkey Crypto,8570
149,CO1I2kglLM8,2024-04-05T13:21:25Z,THE BEST GUN IN THE GAME #joerogan #shortsfeed #shotgun #sandbox #zombie,12569,382,2,CentralCutss,5310
150,kpydQToQ86s,2024-04-15T07:10:54Z,[The Sandbox] RAGNAROK - PRONTERA FIELD  WALKTHRUOGH RUN..........,8,1,0,SparkLife TV,17
151,XTU9IElDPtQ,2024-03-26T17:15:00Z,RUN - Care Factory Co. - The Sandbox - All Quests,51,3,1,Le Voyageur du VirtualUniVerse,105
152,cVgla2Iizsc,2024-04-09T16:45:28Z,THE BEST SECRETS IN ULTIMATE TOWN SANDBOX,1908,27,22,Zooty-o,11
153,XOlbC6v1OGU,2024-04-19T23:01:42Z,I Hatched The *NEW* Sandbox World Secrets In Rebirth Champions X! (ROBLOX),243,10,13,Exible,6190
154,Wb-0FOEbIew,2024-04-11T14:30:09Z,SPAWNING THE WEIRDEST STUFF IN GMOD! - Garry's mod Sandbox,44810,489,73,TheFrizkyFrog,1030000
155,VN_rzjVP0DM,2024-03-29T12:19:05Z,Megacity Parkour - PvP in The Sandbox Game,9,0,1,oaksixbuilds,11
156,zYryRacXjrA,2024-04-17T09:04:18Z,The mole | Paper Cup Animal | Playing in the sandbox | Playing in the garden | Mole mound | Toy,75,1,0,Make Easy Crafts,63500
157,woyXwIVw7G0,2024-04-08T16:04:26Z,What is the Google Sandbox and How to Outsmart it?,1121,21,0,BluShark Digital,245
158,OSiUt5K0dNw,2024-04-07T06:09:51Z,Off Kilter - Remedy (with drum cam) - The Sandbox 3/23/2024,27,0,0,Wadspo,442
159,_DTZaJgAOLM,2024-03-27T02:13:11Z,LIVE in the Sandbox! MONOCHROME collection is LIVE!,0,0,0,TEMPEST STUDIOS,44
160,sHjTkVd_Qek,2024-04-16T02:21:36Z,The Sandbox- CARE BEARS and The Rainbow Tower Guardian (ONLY Heart Tower),15,0,0,playWing with a W,21
161,Y7gpC8ppWno,2024-04-05T10:56:11Z,The cast vs zombie apocalypse at the sandbox vr room,5,1,0,Life with Cecil,21
162,Kdi58Rcszyw,2024-03-25T06:00:07Z,Rescuing forest and dwh animals from the sandbox- kids educational videos,304,4,0,DWH Animals,426
163,IUCb6rLAjYw,2024-04-14T18:10:06Z,#MHUR Rank {PC} continues • Shigaraki Troubles {pt.1}; The Sandbox evolution • #streamer,6,0,1,rodimusPrime86,1350
164,_BWHnO5ghSY,2024-04-05T23:04:57Z,"ALGORAND, APECOIN E THE SANDBOX - MÉTRICAS 5 DE ABRIL! ESTAMOS TENDO UMA OPORTUNIDADE DE MUDAR $$$$!",23,3,0,CRYPTO TRADE com Rapha,358
165,faEgROVt8kI,2024-04-09T16:00:25Z,How should publishers prepare for the Privacy Sandbox?,1608,35,7,Chrome for Developers,739000
166,3Ov09fwsRpo,2024-04-20T08:58:30Z,SPACE COLONIZERS THE SANDBOX GAMEPLAY,175,0,0,CG.,76200
167,IVMSINiEQTY,2024-04-12T09:24:33Z,The WIP Meetup 04/11/2024 Raw Footage ft. Fabiano Sandbox Game & Competition,12,1,0,The WIP Meetup,28
168,d5orGPId4Wo,2024-03-24T11:00:28Z,The Sandbox   The Smurfs: Giant Tree Expedition #thesandboxgame #metaverse,0,0,0,pvtUnitfueler,2
169,BqkYHSTxn2w,2024-04-17T08:54:28Z,THE SANDBOX　ゲームメーカーを使ってみる,1,0,0,ハイパーメタバースクリエイターになりたいメタ子,0
170,NOORIuWJJmQ,2024-04-01T23:04:41Z,MUDSHVL in the Sandbox...,8,1,0,Ty Hoffbeck,3
171,4mauCNw2Zp4,2024-04-15T08:52:18Z,W STREAMING / THE SANDBOX with [BIG]NastyCat,30,2,0,BIG AI,50
172,ITQtweiDH1s,2024-04-15T07:59:04Z,[The Sandbox] MITTARIA MAGIC RUN......,17,0,0,SparkLife TV,17
173,jN4X6MXxCGs,2024-04-09T12:30:26Z,Livestream | The Sandbox Game Jam Awards : GoGo Game Jam,214,8,7,TheSandboxGame,155000
174,pRAyIjm7nWY,2024-03-24T21:15:02Z,ROBERT KIYOSAKI: SAND WILL X5000 AFTER DEAL WITH CHATGPT?? - The Sandbox PRICE PREDICTION 2024 -2025,124,0,0,Mrkey Crypto,8570
175,iN8e8wptDT8,2024-04-04T16:00:37Z,Month of Sharing - Social Hub - The Sandbox,29,1,0,Le Voyageur du VirtualUniVerse,105
176,1kj2YbxtJ2c,2024-04-19T07:07:18Z,What is The Sandbox (SAND) Coin | SAND CryptoCurrency Review,4,0,0,crypto reviews,1650
177,akx0toaOJyM,2024-04-04T23:16:34Z,Today we’re playing the sandbox,6,1,2,XDLUCAS,10
178,5vsd2-_CpHg,2024-03-26T12:00:08Z,"Jurassic Adventures: Lion, Giraffe and Dinosaurs Encounter in the Muddy Sandbox 🦖🦕🦁🦒",35358,73,0,D for Dinosaur,5200
179,uUoa89TKb-k,2024-04-19T19:49:53Z,The Sandbox #36 в 4K,69,3,0,MisterGame999,66500
180,Ur6bZgkZ2Xw,2024-04-09T16:15:01Z,RUN - THE ISLE Adventure - The Sandbox - All Quests,37,2,0,Le Voyageur du VirtualUniVerse,105
181,JH-DfY7BOKw,2024-04-04T14:42:14Z,"Discover the Meaning of Minecraft, the Popular Sandbox Game! 🎮 #Gaming #MinecraftExplained",292,12,0,Kunj Ujjwal,28400
182,LXxiFfXAG_w,2024-04-12T18:38:27Z,Project Garden: RELOCATING THE SANDBOX #Garden #diy Part 1,33,5,0,JKNL ,1250
183,cfOkgGHF2lg,2024-04-15T16:00:26Z,King Shakir Parkour Experience - The Sandbox,72,5,0,Le Voyageur du VirtualUniVerse,105
184,tffqppDYL5s,2024-04-05T16:00:48Z,Iftar Dinner - The Sandbox,31,5,0,Le Voyageur du VirtualUniVerse,105
185,OSiUt5K0dNw,2024-04-07T06:09:51Z,Off Kilter - Remedy (with drum cam) - The Sandbox 3/23/2024,27,0,0,Wadspo,442
186,XTU9IElDPtQ,2024-03-26T17:15:00Z,RUN - Care Factory Co. - The Sandbox - All Quests,51,3,1,Le Voyageur du VirtualUniVerse,105
187,zYryRacXjrA,2024-04-17T09:04:18Z,The mole | Paper Cup Animal | Playing in the sandbox | Playing in the garden | Mole mound | Toy,75,1,0,Make Easy Crafts,63500
188,2krMnNperXo,2024-04-02T16:00:04Z,Deep Sea : Chapter 0 - The Sandbox,8,2,0,Le Voyageur du VirtualUniVerse,105
189,Kdi58Rcszyw,2024-03-25T06:00:07Z,Rescuing forest and dwh animals from the sandbox- kids educational videos,304,4,0,DWH Animals,426
190,faEgROVt8kI,2024-04-09T16:00:25Z,How should publishers prepare for the Privacy Sandbox?,1608,35,7,Chrome for Developers,739000
191,IUCb6rLAjYw,2024-04-14T18:10:06Z,#MHUR Rank {PC} continues • Shigaraki Troubles {pt.1}; The Sandbox evolution • #streamer,6,0,1,rodimusPrime86,1350
192,Y7gpC8ppWno,2024-04-05T10:56:11Z,The cast vs zombie apocalypse at the sandbox vr room,5,1,0,Life with Cecil,21
193,RpZnP2X0YLo,2024-04-08T13:50:49Z,【未経験からゲームを作る！】The Sandbox オンラインクリエイター講座 ～第五回 メッセージってなに？Speaker・Askerでクエストを作る～,166,13,0,The Sandbox Japan,171
194,pRAyIjm7nWY,2024-03-24T21:15:02Z,ROBERT KIYOSAKI: SAND WILL X5000 AFTER DEAL WITH CHATGPT?? - The Sandbox PRICE PREDICTION 2024 -2025,124,0,0,Mrkey Crypto,8570
195,HqptJqL3kkU,2024-04-02T18:00:11Z,PRAIRIE DOGS ARE THE MOST ADORABLE THING EVER! Planet Zoo Console Sandbox Zoo,6371,238,133,Iron Matty,6170
196,3Ov09fwsRpo,2024-04-20T08:58:30Z,SPACE COLONIZERS THE SANDBOX GAMEPLAY,175,0,0,CG.,76200
197,v_D0sa1dFWA,2024-04-16T16:00:44Z,Hero of Troy - The Sandbox,23,1,0,Le Voyageur du VirtualUniVerse,105
198,viBPWpNKBM4,2024-03-30T17:00:41Z,ACC Children LAND : PART1 - The Sandbox,17,4,0,Le Voyageur du VirtualUniVerse,105
199,Y6ZMow4-BZ4,2024-03-27T13:49:53Z,💗boss fighting?!! 😎💗 || with gnar and saph 🤗 || more clubbing at the sandbox,0,0,0,Eerie Adventures,50
200,s3EgXMfnti4,2024-04-05T18:00:23Z,ADDING CAIMANS TO THE REPTILE HOUSE - Planet Zoo Console Sandbox Zoo,6348,204,145,Iron Matty,6170
