,Video ID,Published Date,Title,View Count,Like Count,Comment Count,Channel Title,Subscriber Count
207,2YiyD9T_mbI,2024-07-18T15:42:58Z,Собираем команду из NFT для игры Wild Forest! Зарабатываем без вложений!,31709,1104,109,Avseenko-life,180000
208,V5h8F5oxVMY,2024-07-26T20:00:11Z,Wild Forest Rain: Say Goodbye To Stress With Soothing Rain For Ultimate Serenity | Asmr,140,0,0,Rain Night,26
209,pzcybBTQZUg,2024-07-11T06:01:27Z,"HOW TO GET IN TOP 1,000 FOR P2A WITH EASE | Wild Forest Tips & Tricks",187,40,74,Mac AttackXD,162
210,bSv0-HN3f6w,2024-07-03T09:32:50Z,"Gratis Play to Airdrop Kripto, Game Wild Forest NFT Game (Forge & Essence Fitur)",789,18,5,XPlay W3,28800
211,KB4ZIP0of7M,2024-07-02T09:32:25Z,Wild Forest | Làm Sao Để Mint NFT Units Ra Bán ??,993,15,40,zBlue,4130
212,yxM-JT0wh-M,2024-07-01T06:27:39Z,Wild Forest Battle Pass и награды в $WF. С чего начать и как заработать?!,25154,779,120,Avseenko-life,180000
213,bpfUQlkqZyo,2024-07-23T09:31:02Z,Wild Forest of Sumatra Fishing Camp Hasil Memuaskan Sungai Bening Ikan Melimpah,7440,230,59,Hantu Air Channel,11300
214,eaQAWIUzJzA,2024-07-02T22:27:30Z,REFERRAL NO WILD FOREST - 02/07/2024,27,4,2,TIO DOUGLAS GAMES,7110
215,pPpdAZ02EAc,2024-07-04T13:00:07Z,Wild Forest Animals 8K ULTRA HD | Wildlife Movie With Relaxing Piano Music,403,17,0,8K Ultra,18000
216,Pf91e5Nr4Ko,2024-07-23T18:22:00Z,Основные стратегии игры в Wild Forest | Play-to-Airdrop 2 season,6789,153,24,Crypto Juli,94800
217,FTOU2YFNi0c,2024-07-06T19:11:08Z,No Pierdas El AIRDROP De WILD FOREST y Sigue Estos Consejos🤑,1225,28,17,Brizzio,6740
218,jy_psnAbDRs,2024-07-18T04:16:35Z,🌲 Wild Forest Play-to-Airdrop сезон 2! Зарабатываем токены $WF,20959,781,106,Avseenko-life,180000
219,WygBC_pa4OM,2024-07-26T19:02:41Z,BATTLE PASS PREMIUM WILD FOREST VALE A PENA?,316,29,9,Seu Bubu NFT,2050
220,Vtf5yhYSb3E,2024-07-22T20:00:11Z,"Extreme Survival: How I Dug My Own Cave in the Wild Forest, ASMR.",18,2,2,fearless explorers,1
221,0eblv4sismo,2024-07-13T17:15:00Z,Building a house underground in a wild forest,1413,26,4,Survival in the wild forest,272
222,ErpB_Oc8sUM,2024-07-04T18:00:12Z,"Como ganhar mais pontos no airdrop do Wild Forest, Dicas para progredir no jogo #wildforest #airdrop",46,2,0,Vivendo de NFT,31
223,52_Pj4tVsGI,2024-07-27T14:33:32Z,Wild forest#naturelover #animallover #musiclove,7,2,0,Sampraju's -World of Wonders,11
224,X5gWtrjfejE,2024-07-28T22:58:44Z,"The Real Sound of Natural Wild Forest | Birds Crickets Singing | Relaxation, Healing and Meditating",0,0,0,Surga Hutan,0
225,V_UtViMjiFA,2024-07-17T18:23:25Z,Passo a Passo do Staking de Lords do WILD FOREST e varias Dicas,146,11,3,katchuca,7490
226,qZfxmpgm0sg,2024-07-22T16:34:36Z,Tryhardeando el Top 15 del Leaderboard Día 13 | Wild Forest,282,20,2,Criptomamadas,3290
227,MqVNQ6GvnBw,2024-07-11T05:50:10Z,(Wild Forest GameFi) Hướng dẫn chơi Wild Forest - Cơ hội kiếm Ngàn Đô $WF,250,5,4,Viet Nam GameFi Community,2420
228,q3DpLpeYciI,2024-07-12T04:22:33Z,Tryhardeando el Top 6 del Leaderboard Día 5 | Wild Forest,194,15,4,Criptomamadas,3290
229,6TKcJBbbHtw,2024-07-10T11:59:17Z,birds in wild forest  #nature #birds #videoshort,416,10,0,Animasi Project,43
230,aQWNt4M4zdM,2024-07-05T12:35:26Z,BIG Update for WILD FOREST ⚔️ (Forge & Cashing out),895,67,35,"The Crypto Asian - Gaming, NFT, Tokens",8030
231,Cc5DNHefOrI,2024-07-08T19:03:51Z,¿Cuánto cuesta un equipo competitivo? | Wild Forest,633,51,42,Criptomamadas,3290
232,B0AJZs-Mv84,2024-07-04T15:05:33Z,🟢Como Farmear El Play-To-Airdrop De Wild Forest | Wild Forest,236,7,6,KalipsoCrypt,118
233,yOfQwvkSbCA,2024-07-24T12:20:49Z,ANTS VS PRAYING MANTIS!! | Ant Colony: Wild Forest - Part 5,137,4,10,Banana Peel,5390
234,PkiLQgvWmxU,2024-07-24T23:30:17Z,¡Cómpralo con Esencia! | Wild Forest,274,28,36,Criptomamadas,3290
235,gUj97lj9UhM,2024-07-02T08:16:38Z,AIRDROP WILD FOREST 2ª TEMPORADA COMEÇOU!,682,61,8,Seu Bubu NFT,2050
236,8Wz1vIghl40,2024-07-01T14:57:17Z,"Wild Forest |  Play to airdrop 2 !!! jogue e ganhe tokens do game , sensacional jogo de estratégia",118,13,5,Pingolino's World,78
237,_vayMK9nGDM,2024-07-09T16:52:26Z,Wild Forest Airdrop Season 2,29,0,0,Assyifaxie,332
238,zowrpbi7KeI,2024-07-12T14:21:32Z,PIXELS: TASKBOARD FAQ SOLVE AND WILD FOREST MY FAVORITE PERKS IN NINJA UNITS,2502,38,17,NinjaFarmer,6650
239,Vjh2ZdZhbEA,2024-06-29T21:00:21Z,Bamboo Shoot Harvesting in the Wild Forest #BambooHarvest #forestharvest,26,1,0,Rural life,1450
240,wIcGBhxybqA,2024-07-20T13:58:38Z,"ارض الغابات البرية، سجادة من طبقة سميكة من الطحالب-Wild forest floor, a carpet of thick moss",1,0,0,alimunriza,2800
241,LaKnXULjuGI,2024-07-16T15:00:21Z,Alone in the wild forest under a tent #bushcraft,11,3,0,Ahmet Agayev,5360
242,yn8fv3XQstM,2024-07-10T04:29:33Z,Tryhardeando el Top 5 del Leaderboard Día 3 | Wild Forest,228,16,9,Criptomamadas,3290
243,7vAFXkRl5-g,2024-07-01T12:34:22Z,When the young mother lived in the wild forest#survival #camping #nature,31965,396,2,Hoang Dã ,81600
244,x2Aj4rhIYo0,2024-07-25T10:31:08Z,"Beautiful Forest Stream, Song of Wild Forest Birds, Sounds for Sleeping, Studying, Meditating, ASMR",742,17,0,Relaxing Water Sounds,2240
245,SHS1l18mQgU,2024-07-13T11:00:20Z,Ant Colony: Wild Forest Best Ant Game Mobile Android ios Gameplay,17,0,0,PLAYER 7,13500
246,kYCbS0xHiZI,2024-07-01T09:12:48Z,Camping 🏕️🥾 In Wild forest 😯 #camping #wildlife,494,21,0,Lav Thakur Vlogs ,4210
247,AOq60dYyhQc,2024-07-26T20:38:47Z,Sextou jogando - Team X3 -  Pirate Nation - Spellborne - BackWoods - Wild Forest,225,26,1,Crypto Games X3,2520
248,IJ6nO2y-c9c,2024-07-26T12:50:44Z,"Гайд по Wild Forest, заработок без вложений, F2P Play to Earn Web3 игра, зарабатываем $WF",987,19,14,Блог HighFive - заработок на криптовалюте,50
249,ORPuQfdo-S4,2024-07-26T20:00:08Z,Wild Forest - Skins de Campeão - Premiação de participação do Play2Airdrop Season 1!,72,9,4,Cryptomoedas News,1890
250,Ac9cbKR4Z34,2024-07-15T05:58:40Z,Wild Forest: Полный Обзор Второго Сезона Play To Airdrop,17480,958,100,Roman Pushka,109000
251,unGOgdwBINc,2024-07-20T16:44:44Z,"""Exploring Wild Forest: The Ultimate Play-to-Earn NFT Game Experience!""",108,7,0,Tesyafe,2
252,fhr7Kvlyqzg,2024-07-07T21:51:42Z,tarantula at wild forest.😍,420,2,3,Daddy'xy ,570
253,Ey_2G7-U8yg,2024-07-13T09:04:04Z,Bolimowski Park Krajobrazowy. Lato. Evening sky. Flat panorama. Wild Forest. Dron 4k HD,392,3,0,merioni.visual,14
254,sURTdGnwBEE,2024-07-13T13:57:02Z,Wild Forest free token claim trick | Wild forest free to play airdrop guide | Crypto P2A Airdrop,751,45,24,Dip Karmakar,6390
255,5N1arf_3ON0,2024-07-25T21:16:59Z,WILD FOREST P2A SEASON 2 | AXIE SEASON 4 UPDATES | RONIN GAMES,33,6,0,FamBonds,2370
256,FL2_4p2dlDE,2024-07-03T11:12:49Z,The girl lives alone in the wild forest. Complete the dining hut,1066,24,2,SINH MY ,11100
257,lHBxYHlVbjI,2024-07-11T08:49:41Z,WILD FOREST INTERFAZ PARTE 2,22,2,0,EL CHAMO NFT,1670
258,ubfjOCS2zIs,2024-07-25T07:29:17Z,WILD FOREST P2A,134,11,0,JETHRAWR,10
259,dN6gY0f7KAQ,2024-07-09T13:45:23Z,WILD FOREST AIRDROP,4,0,0,NFT GAMES ESPORTS,940
260,ZBXV5NkxuHs,2024-07-11T18:56:05Z,The forest awakens. A day in the life of the wild #forest #alone #forestview,12,4,0,Taeen Design House,76
261,tlJ79QheL9A,2024-07-13T09:03:43Z,Bolimowski Park Krajobrazowy. Lato. Up. Evening sky. Wild Forest. Dron 4k HD,92,0,0,merioni.visual,14
262,ToA1XE3LfAY,2024-07-23T12:25:32Z,#big cat#hunting# zebra #wild forest,3,2,0,prakash Chandra,100
263,q6MsMmKgjK0,2024-07-19T04:36:24Z,wild buffalo in bandipur forest #rain#mysore#forest#viral #trending #youtubeshorts,447,15,0,Nilambur food and travel ,634
264,xUWAtMLLGRM,2024-07-05T16:20:12Z,# Big wild #forest #short video #trending video,37,4,3,Alauddin ki Duniya,10
265,19TrK--N8uY,2024-07-10T22:21:39Z,NÃO PERCA! COMO LUCRAR COM O AIRDROP DO WILD FOREST: GUIA COMPLETO PARA INICIANTES!,1323,53,20,REI DO NFT,15300
266,40Pjjm1kxjo,2024-07-01T16:44:19Z,LANÇOU o Wild Forest CORRE!!! O jogo ta uma UVA vem $$$,157,10,2,Kedellzinho Gamer,241
267,gNgr3-Hv65I,2024-07-19T14:55:51Z,Kedell News - Pixels/Axie Infinity/Wild Forest,26,3,2,Kedellzinho Gamer,241
268,HoHd6olKzIc,2024-07-08T23:38:47Z,Wild Forest P2A S2 Day 8/28+ Pixels! YGG GAP S6 July 10!,17,4,0,zionXstatic,1490
269,fB2c3hfH8vk,2024-07-10T13:23:57Z,WILD FOREST | TU NE DOIS PAS MANQUER CE NOUVEL AIRDROP !,60,4,5,Virtual Value Gaming,134
270,NudSBg7QT4A,2024-07-11T16:03:45Z,Wild Forest (RTS) NFT Play to Airdrop,67,4,1,Mikin,225
271,YfJhxJM-gmo,2024-07-11T13:00:06Z,Wild Forest Animals 8K ULTRA HD | Amazing Landscapes Of Wild Animals With Soothing Music,316,5,0,8K Ultra,18000
272,3DMemDkVP64,2024-07-18T15:46:23Z,My didgeridoo playing in the wild forest. #didgeridoo #nature,410,8,2,Mystery of Sound,36
273,jucfs9W1a28,2024-07-10T14:00:39Z,Building a Bushcraft Tree House | Building in the wild forest | Cozy TREE HOUSE | Part 2,7890,219,23,EMRE OUTDOORS,22100
274,UolQg_e6-Ao,2024-07-25T04:30:19Z,Rizki berburu madu hutan liar,755,14,0,MADU HUTAN JAWA BARAT,2200
275,fUNhGcEC7fQ,2024-07-16T08:37:49Z,Meet Wild forest Perks✨||Another review video,548,113,13,NFT TECH,2140
276,BwrYlfddWwg,2024-07-02T14:57:00Z,Wild forest Pré Season 2,14,0,0,Alexandre J Merig,474
277,gc6Mc_SK1lU,2024-07-21T18:46:11Z,Wild Forest Rain: Say goodbye to stress with soothing rain for ultimate serenity | ASMR fireplace,1766,6,0, 수면 시간 - Relax,3880
278,KgRZ8c6sNIM,2024-07-02T17:57:22Z,#trekking#wild#forest#fallen#leaves #adventure #monsoon#rain#lost #nature #travel #badweather #trees,455,2,0,V Christine Mawite,3390
279,rfZ8FHPvhZY,2024-07-03T12:50:26Z,WILD FOREST - PLAY 2 AIRDROP 2 DISPUTADO DEMAIS! LIVE,37,10,0,TIO DOUGLAS GAMES,7110
280,XW3WrUPr4To,2024-07-16T17:09:39Z,WET AND WILD FOREST RUN pt5 BIG FORD BRONCO RC #offroad #yikong #rc,59,6,7,ace_rc79,580
281,tzpxk_aHE4s,2024-07-21T08:06:43Z,wild buffalos in bandipur forest #viral #nature #trending #wild,213,12,2,Nilambur food and travel ,634
282,cruOgDDlljg,2024-07-11T01:51:24Z,Obtén TOKENS $WF (Wild Forest) GRATIS ✅️ Saca Más PUNTOS en su Play To Airdrop 🔥,202,10,0,Tonyrodriz Nft,5350
283,mstpzK8e670,2024-07-11T16:59:09Z,PLAY TO AIRDROP: WILD FOREST SEASON 2 GANHE TOKENS JOGANDO!,23,2,0,Mattz,953
284,gHNsoz8H3ak,2024-07-26T08:54:55Z,Cute cat kitten alone in the forest - #tree #wild #pet #Shorts,10719,189,1,JFStyle TV,2990
285,r4VGBonwpHY,2024-07-05T14:51:20Z,#big cat#hunting#wild forest #for surviving,4,3,0,prakash Chandra,100
286,jd4osq93VaY,2024-07-10T18:34:06Z,Wild Forest 新game試玩 玩賺 打金 擼空投 好機會？！,65,5,0,80後的生活頻道,1040
287,Hl4-I-I9DIA,2024-07-05T01:42:52Z,play full tutorial (Ant Colony: wild forest),69,2,1,ItzIffatYT,649
288,UX36MISWzHQ,2024-07-18T16:13:24Z,Tryhardeando el Top 15 del Leaderboard Día 10 | Wild Forest,195,11,2,Criptomamadas,3290
289,G_zO1nBqDqU,2024-07-11T05:05:59Z,Wild Forest | What is the Forge? | New Referral System,46,3,6,Viar Cryptonation,288
290,szyyRohxD1I,2024-07-15T22:36:27Z,Sistema de Perk do WILD FOREST Novas passivas e Rank Up de 5 Unidades,640,14,10,katchuca,7490
291,P4KZz6g_Umg,2024-07-02T18:22:33Z,ABANDONED Scottish 1800's House 🏴󠁧󠁢󠁳󠁣󠁴󠁿 Lost in WILD Forest,1095,82,3,BKR,12300
292,CqpVCd_K3fY,2024-07-21T11:00:07Z,Full Video: Young Girl Camping in the Wild Forest - Relaxing Sounds of Nature ASMR,29703,80,2,HOA CAMP,2850
293,DRa-LbhruX0,2024-07-03T00:42:51Z,COMO JOGAR WILD FOREST EM 12 MINUTOS,190,8,9,BlackTavernX,308
294,pj7bkpz_sw8,2024-07-12T01:29:29Z,WILD FOREST P2A SEASON 2,121,4,1,mark simbulan,413
295,xMzs7LLBoQc,2024-07-14T07:09:43Z,Chơi game kiếm tiền Wild Forest,129,3,1,Quy Nhan Pham,126
296,M6ceJxZx6es,2024-07-20T14:44:18Z,Into the Woods - Woods are lovely dark and deep #woods #wild #forest #reel #woodenbridge #dam #gavi,410,8,0,NURA EGROEG,313
297,ONgVYT86YZs,2024-07-06T04:18:35Z,wild forest.!! #peacock,503,10,0,Shashi Joshi,56
298,gTtIApBgfX8,2024-07-06T11:00:41Z,"Tutorial Airdrop Wild forest, Tutorial Wild forest pemula , Detail Airdrop Wild forest Quest",122,3,1,Assyifaxie,332
299,vJFrqnjLo7Y,2024-07-06T02:49:30Z,CRIPTO FOI DE VALA? + GAMEPLAY WILD FOREST,213,32,7,Seu Bubu NFT,2050
300,JUq2qcsGznA,2024-07-11T06:09:46Z,EXPLICANDO MENU DE WILD FOREST CON EL CHAMO,25,2,0,EL CHAMO NFT,1670
301,4SwH5NtUB1I,2024-07-18T05:28:53Z,Live Crypto Farmando Airdrops- Pirate Nation -  Wild Forest! !airdrop !illuvium !membro !nuuvem,472,28,0,Liga do Jorel,39400
302,omdpPir2yBI,2024-06-30T01:50:46Z,[Wild Forest] Ra mắt phiên bản chính thức và những thông tin quan trọng về Play to Airdrop Season 2,627,25,5,Quân Gaming,527
303,k_dmsMDxB7o,2024-07-13T15:00:43Z,Walking in the field of fireweed. #outdoors #plants #wild #forest #flower  #fireweed,100,0,0,RomanmadventuresTV,404
304,OEb3GHSxU_M,2024-07-23T09:30:15Z,Wild Forest: Play To Airdrop Up To 10.000$ || REF CODE: 4KKJYU,144,5,6,William Wu,1
305,hchIoztN4XU,2024-07-03T04:02:17Z,"FARMANDO AIRDROP WILD FOREST, O QUE JÁ APRENDI",498,47,7,Seu Bubu NFT,2050
306,ct0WHJCFxpc,2024-07-06T18:03:56Z,🚀NO PUEDES PERDERTE EL AIRDROP DE WILD FOREST | EL MEJOR DE TODOS,582,25,16,MobR,1880
307,8_vsomHg9Ig,2024-07-05T10:23:27Z,PRUEBO por Primera vez el Wild FOREST ¿Algun Consejo? | NFT GAMES | RONIN,93,3,0,Harold875,3240
308,a14h0n1OOT8,2024-07-02T05:53:56Z,#big cay hunting #wild forest,2,2,0,prakash Chandra,100
309,pRHuleIyZCY,2024-07-20T00:41:20Z,🔥ULTIMOS  DIAS DEL P2A DE WILD FOREST🔥 aprovecha el modo arcade  gana puntos  #p2a #wildforest #nft,139,16,6,Esteban Garcia,11
310,5zbQJcNhecc,2024-07-21T12:00:07Z,100 days of survival in the wild forest. Taking refuge in an abandoned house since ancient times,92248,144,9,Ly Thi Kieu,9350
311,XubvrctW8Ow,2024-07-20T09:48:19Z,WILD FOREST ОБЗОР ВТОРОГО СЕЗОНА AIRDROP🚀,1704,49,0,Roman Cryptoman,32700
312,8v0qU8DFCZc,2024-07-12T14:00:07Z,भालू Tent के अंदर घुस गया | Night Camping in Dangerous Wild Forest of Kashmir | Camping in India |,23247,407,91,camping trip,1230
313,DGDEYXCDrU4,2024-07-17T16:13:04Z,Solo Camping Experience in the Wild Forest 🤩 | Solo Adventure Girl - Cooking in nature Bushcraft,439,5,0,Mia_Hanan Adventure,724
314,0lF5dOy2JHE,2024-07-02T13:42:01Z,Wild Forest: Zocken = Geld verdienen (Play2Airdrop),492,12,12,Der Geldmentor,4620
315,T29YjktmbQk,2024-07-13T00:00:14Z,Full Video: Young Girl Living Alone In The Wild Forest - Lý Thị Sếnh,299948,817,20,Lý Thị Sếnh,36600
316,w9kqfYcf1Uw,2024-07-01T19:46:58Z,GUIA RAPIDA DEL PLAY TO AIRDROP 2 DE WILD FOREST,70,3,1,Alig7777,137
317,ZqVLY2GKXkg,2024-07-16T13:18:51Z,Wild people.Exploring A Wild Forest To Find Durian Fruit For My Raw Vegan Diet,483,8,0,Wild people cooking,1930
318,Sw002qj-dUw,2024-07-21T08:30:08Z,The Entrepreneurial Rollercoaster + Photoshoot In The WILD Forest,122,13,0,Deja Vu Loft Casino,38
319,7MyKHGI2_Z4,2024-07-13T04:35:01Z,PIXELS: NEW QUEST + 400 REPUTATION AND WILD FOREST INVITE FOR HONOR,1390,20,20,NinjaFarmer,6650
320,gzvBcMxslJk,2024-07-19T13:39:40Z,(part1). 7 days-of birth in the wild forest - building a shelter by the stream | Trieu Thi Phuong,57,4,2,Triệu Thị Phương ,14
321,RIDxTHGx8C0,2024-07-21T15:57:06Z,"Build a wooden survival shelter alone in the wild forest, trap fish /time lapse",1729,16,1,Wild Adventure Alone,1200
322,sJPX9DHf6Sc,2024-07-09T17:00:07Z,The girl went hunting snails alone in the wild forest #cooking #food#mukbang #shortvideo#shorts,588,8,0,Lâm Bushucraft,6680
323,1tyHtbp98yw,2024-07-07T11:56:51Z,PIXELS - WILD FOREST AND MY META TEAM FOR  FREE2PLAY PALDO PLUS TIPS ALTERNATIVE FOR WINE MAKING,1183,27,28,NinjaFarmer,6650
324,5RbN9loxt8E,2024-07-07T10:59:36Z,"It's Monsoon Season, Time For Wild Forest Mushroom Curry- ବଣ ଛତୁ ତରକାରୀ",948,32,8,ଲୁନିLuni,62
325,1d49olNuFco,2024-07-09T07:46:17Z,WILD FOREST - PLAY TO AIRDROP SEASON 2 - LIVEPLAY,53,5,0,RENAN WEB3,404
326,lpT-_oUozmY,2024-07-01T22:26:55Z,WILD FOREST 🎮⚔️ 2PLAY TO AIRDROP ESTA POTENTE 🎮⚔️,143,21,16,Gr3g0r NFT Gaming,367
327,ltl_bCR1t9Q,2024-07-01T07:13:54Z,Wild Forest | Play to Airdrop | Moku Wild Forest packs,118,9,8,Viar Cryptonation,288
328,Yyt7zBnjUcM,2024-07-08T13:06:06Z,The lonely old man survived alone in the wild forest,91,6,0,Hà Giang NEWS,13500
329,OS3bzdWFmJM,2024-06-30T17:00:13Z,Ant Colony Wild Forest | Hormigas contra Cangrejos (Nivel del Tropico) 🐜,109,7,0,El Arenero RPG,1440
330,KtnCNc50Ysw,2024-07-08T11:30:21Z,30 Days SOLO SURVIVAL CAMPING In RAIN | Bushcraft Survival Shelter | Wild Forest Life | ASMR,119522,648,20,Bushcraft,85200
331,RbYcOOiw8mk,2024-07-26T17:19:39Z,WildForest   Review và hướng dẫn chơi game Wild Forest  win tran kho choi,1996,1,0,Su Gia,1020
332,UWWyDTJBdYk,2024-07-26T16:44:53Z,📍 Nagarhole wild forest #wildlife ##nagarholenationalpark #elephante #elephantelephant #wildbulls,2034,18,2,My 2little gems 2nd channel ,28
333,S9NQqJA5ZGA,2024-07-25T15:41:51Z,game Wild forest,2,0,0,Long Đinh xuân,0
