,Video ID,Published Date,Title,View Count,Like Count,Comment Count,Channel Title,Subscriber Count
0,twOUF3pzA0o,2024-10-12T10:40:13Z,Harvesting Soursop in the wild forest Go to Market Sell | Come with me to explore the mystery,4031,543,12,An Phu Daily Life,13100
1,SeDm7gsfvE0,2024-10-08T13:39:26Z,"Coziest Bushcraft Campfire Place Near a Wild Forest Hut, Forest Furniture, Cooking in the Forest",34148,1301,103,Asbjorn Olsen-Berg Bushcraft,740000
2,oS2XU-Xewd4,2024-10-09T09:24:00Z,Chief reacts: Dabuddah's Wild Forest TGE Explained,10,2,1,E4E,211
3,8ozs5xgirV4,2024-10-08T20:00:06Z,"CRYPTO GAMES: WILD FOREST, #NFT GAME 186 #CryptoGames #WildForest #NFT #PlayToEarn #FreeToPlay $WF",5,1,1,ANDREW PANDA GAMES,1790
4,fANh0A1XuSU,2024-10-09T00:00:07Z,"CRYPTO GAMES: WILD FOREST, #NFT GAME 187 #CryptoGames #WildForest #NFT #PlayToEarn #FreeToPlay $WF",25,2,1,ANDREW PANDA GAMES,1790
5,DEXSz3YMD_I,2024-10-13T21:35:09Z,2 VS. WILD in Sons of the Forest | Folge 6,32727,2435,24,CSYON,1070000
6,xmSPntmK8sQ,2024-10-09T13:30:39Z,"Cozy Camping in the Forest | Alone in the Wild Forest,ASMR",13,3,4,Wild solo camp,7
7,oKQY4QFtm2Q,2024-10-11T19:34:59Z,Rain in the Wild Forest: Say goodbye to stress and heal with the rhythmic melody of the rain | ASMR,2605,25,0,Cave Sound,12100
8,o_DtpJzzH5s,2024-10-08T17:13:31Z,KIRKTONHILL TOWER - Hidden in WILD Forest - SCOTLAND,983,119,19,BKR,13800
9,8P9P21m6Io0,2024-10-08T05:37:31Z,Triệu Thương-48 hours building a bamboo house in the wild forest,7313,108,2,Triệu Thương ,434
10,W0R45Wdqubk,2024-10-09T17:28:26Z,ANCIENT SCOTTISH CASTLE 🏴󠁧󠁢󠁳󠁣󠁴󠁿 Abandoned in WILD Forest,3226,96,3,BKR,13800
11,BKy8TZQlHwg,2024-10-07T18:00:06Z,"CRYPTO GAMES: WILD FOREST, #NFT GAME 185 #CryptoGames #WildForest #NFT #PlayToEarn #FreeToPlay $WF",35,1,2,ANDREW PANDA GAMES,1790
12,j-llUPDTCAs,2024-10-08T06:47:00Z,The old wild forest has lost its way back to the birds,0,0,0,garykidml,0
13,lUK_kka85as,2024-10-09T11:00:08Z,live alone in the wild forest and build a roof of corrugated iron to cover the machinery,6772,304,18,Nông Văn Bình,9690
14,ZUV7aFi8l-M,2024-10-08T22:00:32Z,"Forest music, rainforest, wild forest, positive reinforcement, good vibes, serene energy",103,8,2,Relaxing Soul Channel,17100
15,4UYw_ThRTYM,2024-10-09T10:00:14Z,"Coziest Bushcraft Place Near a Wild Forest Hut, Forest Furniture, Cooking in the Forest",1399,42,57,Wochenende,10800
16,6LROuUZaVQQ,2024-10-08T12:00:08Z,Game NFT Wild Forest | Hướng dẫn kiếm tiền từ Wild Forest từ A tới Á - X GameFi,1720,18,12,X GameFi,8200
17,Alpz3Ab3n7k,2024-10-09T17:24:17Z,FORGOTTEN SCOTTISH CASTLE 🏴󠁧󠁢󠁳󠁣󠁴󠁿 Lost in WILD Forest,2196,141,4,BKR,13800
18,pmhzf81u-as,2024-10-08T10:17:51Z,Wild Forest Mahjong: Level 08,2,1,0,Katharma,239
19,0bjSIdwzK20,2024-10-07T16:46:39Z,FORGOTTEN Scottish ICE HOUSE 🏴󠁧󠁢󠁳󠁣󠁴󠁿 Buried Under WILD Forest,493,45,1,BKR,13800
20,-vP-_EQTTOs,2024-10-08T06:05:00Z,Python Angry because Disturbed | giant python | Anaconda | wild forest #wildanimal #explore,2359,20,0,Wija Matajang,181
21,1_yIvHNskxk,2024-10-08T12:00:01Z,"Wild Forest - Roadmap Outubro, Novembro e Dezembro - TGE em Novembro!? Será??",94,15,4,Cryptomoedas News,2110
22,m-fC_6Oh42s,2024-10-10T09:01:40Z,Coorg wild/forest Mushroom curry,29,4,0,Vanya world kannada ,86
23,BI_4cM3ckGg,2024-10-08T14:00:09Z,Ant Colony: Wild Forest - Trópico en dificultad media | Gameplay |,3,1,0,Tocrem,2
24,9H7e4_XSs2Y,2024-10-08T02:00:10Z,Plucking some fresh blackberries in wild forest #nature #padachari #friends #london #fruit #fresh,106,2,0,Pādachāri,2610
25,2Gn4uDgLdCQ,2024-10-09T16:13:03Z,Camping in a wild forest of Nepal #shorts #nature #wildcamping,424,34,3,Baba Bunny,976
26,t4HHiB9dPDk,2024-10-07T14:32:18Z,Wild forest survival part 6,1,0,0,sam_urai123,0
27,OKLvcM7hGkk,2024-10-09T13:20:29Z,Cute baby #deers #wild#forest#beautiful #trending #short,430,4,0,My Funny world ,3420
28,_GdaeZFQrwQ,2024-10-08T04:00:31Z,"Bushcraft skills, in the wild forest #survival #forest #bushcraft #outdoors #shorts",0,0,0,Ava Light,29
29,acS9z4V5kAo,2024-10-08T14:00:03Z,Wild World of Wolves: Guardians of the Forest 🐺🌳#wildworldofwow  #wolf   #WolvesOfTheWild #wolves,1148,48,1,Wild World of WOW,26
30,yuJHQ2WADww,2024-10-08T07:21:41Z,Wild #wildlife #knowsley #tiger #lion #forest #life #moments #happiness #safari #adventure #couple,544,10,2,Life_of_daffodils,281
31,wcM1Ol6hivw,2024-10-10T04:27:20Z,"A Forest Nook for Birds and Wild Animals, October 9, 2024",26,4,0,Rysx,555
32,1U4ZQI9rBUk,2024-10-09T06:53:08Z,Wild #nature #animals #forest #autumn #vibe #rainy #day #,115,0,0,WildWild W Est,193
33,MqfXDIqBmog,2024-10-09T23:52:57Z,Wild Kittens Discover Forest,266,14,2,Catchefff,2030
34,0QWTz2lA8t0,2024-10-10T00:18:37Z,Forest Animals🫎4K UHD | Colors of the Wild🎵 Calming Music,440,6,0,Colors of the Wild,1650
35,ZOyfSzrkNyM,2024-10-08T15:03:56Z,Nature's beauty is wild and free | #wildlife #videography #forest |,507,15,0,Pradyu_natural,11
36,DkHD7GN8eyo,2024-10-09T11:05:04Z,The forest is filled with wild birds,538,8,0,Dunia kicou,4
37,8B1EtkFEMdE,2024-10-09T06:30:02Z,wild photography #wildlife #forest #nature #rider #adventure,526,17,0,Dream Catcher,89
38,vEBa5lYEmhM,2024-10-08T11:46:42Z,Wild Men of the Forest- From Fairies to Bigfoot: Karbi Giants,496,6,2,Fairy Encyclopedia,282
39,sK1exhmLPiU,2024-10-07T18:04:57Z,Wild edible Fruit #Fresh #wild #edible #yummy #Fruits #tropical #forest #trending #viralvideo #fyp,433,9,0,Green Shoot Organic,892
40,xGYH83af4kA,2024-10-09T10:00:59Z,Survival Skills! Wild Boy! Amazing Cooking Cow Head in forest,891,11,2,JK Wildboy,2220
41,cMSzlo4g9XM,2024-10-09T10:28:24Z,#Wild dog # wildlife#forest #nature #Pench tiger reserve,3,1,0,Kumar _India Forest ,24
42,pmine5-Q3Bo,2024-10-08T12:55:35Z,Royal #atack # in forest # bangal  #tiger #atack # wild  animal #💯😍,525,11,1,Forest life uk07,52
43,AktBHZd2xO8,2024-10-09T15:24:02Z,Wild life 🌳 #shortsfeed #shortsyoutube #trendingshorts #viralshorts #viralvideo #forest,8,1,0,Little Angel_Kashi,181
44,XnhriYq9E0E,2024-10-09T16:36:56Z,"Photo shoot,forest full of wild animals,dark night #photography  # wildlife #russia",31,1,0,Anju Sidhu,2
45,vGZTaA-9lxM,2024-10-09T05:42:16Z,Discover the Wild Authentic Sounds of the Deep Forest.BinSam Wild Nature,5,2,0,BinSam Wild Nature,5
46,z7WeEI-CRNM,2024-10-07T15:55:17Z,Wild cows in Dutch forest Leemputten,1443,12,0,Slava FiLL 💕🌷 IRL Streamer @FillFlower,163
47,oM5EMF1QsCI,2024-10-08T11:06:29Z,Forest and Animal Habitat in Wild Jungle Painting Blue Parrot with Acrylics Art Process Film,8,3,1,Chaotic Art Pieces,17
48,9-NhhHD3Kes,2024-10-10T22:08:01Z,"WESTERN BIG MOVIE $ FOREST VALLEY $ Wild West Must See all , Cowboy Film HD",35365,147,2,Flicks & Frames,2480
49,Ej6atkrRcpk,2024-10-09T02:09:29Z,Tiger #tiger #animals #zoo #wild #usa #zooanimals #nature #viralvideo #viralshorts #wildlife #forest,98,6,0,GratefulTraveller,104
50,LnKK2yP1q4c,2024-10-09T08:47:55Z,Wild Discovery: How Animals Survive and Thrive After Forest Fires Devastate Their Habitat,11,5,0,Wild Discovery,2490
51,5kLIHAGeaDQ,2024-10-09T04:58:36Z,Save The Peacocks #wildlife #forest #birds #canon #wildlifephotograpy #Majestic #peacock #more #wild,421,17,0,Samiulla Horkeri,895
52,3Ni7vsucoCM,2024-10-09T08:47:54Z,Wild Discovery: How the World’s Largest Herbivores Shape Grasslands and Forest Ecosystems,14,5,0,Wild Discovery,2490
53,pfvExOpVb9s,2024-10-09T00:30:36Z,The Wild Robot Of The Forest || nature status || animationshorts #robothand #aklove24#share,471,15,2,AK LOVE 24,1510
54,6gFc49j3oMw,2024-10-08T00:53:16Z,Wild Forest 4ª Temporada e Novidades do Axie Infinity 🚨 GAZETA RONIN,710,76,0,Gustavo Nenesk,52200
55,AIeE6pi9CyM,2024-10-08T10:15:36Z,Deep Forest Search For Wild Berries And Wild ropes,444,2,0,The Explorer,4
56,GRTJQsP66EQ,2024-10-09T01:00:10Z,Building A Wall In The Forest (with a wild ghost rider) #shorts #gaming #sonsoftheforest,412,8,0,Cup of Toes,19
57,-4IRteO_YvY,2024-10-08T15:23:43Z,"Surviving alone in the humid forest, the girl made a wild animal trap to survive",7,1,1,Country Girl,206
58,d1okbico6JM,2024-10-09T06:05:00Z,Guard Python | giant python | Anaconda | wild forest #wildanimal #explore #pythonsnake,1361,8,0,Wija Matajang,181
59,pej7g7q1tfE,2024-10-10T02:09:47Z,"Wild Forest Waterfall Nature Sounds, Birds and Crickets Chirping for Stress Relief and Relax",28,0,0,Forest Resident,1070
60,ngAlf5C_IBM,2024-10-09T13:37:02Z,WILD FLOW forest session ✨🌱🌲🌱✨ #wildflow #dance #nature #marissamuzaca #freedom,518,4,0,Marissa Muzaca,11
61,wdnusM61SqQ,2024-10-08T01:41:38Z,Building a Bamboo House in the Forest: A Solo Adventure in Wild Building,1,0,0,Pankaj kumar ,40
62,OoddzmqH7I8,2024-10-08T15:24:46Z,Old Scottish 1700's Cottage 🏴󠁧󠁢󠁳󠁣󠁴󠁿 Abandoned in WILD Forest,756,36,0,BKR,13800
63,0mqHB6YAc7U,2024-10-08T14:16:52Z,Real wild Rabbit at NewYork Forest,32,0,0,JARISA-AKKEY,45
64,mdpe-ZVy44c,2024-10-09T05:15:06Z,Tiger And Wild Goat In Forest,804,12,0,Global Defence TV,743000
65,jGyaY6NgmZ0,2024-10-07T17:07:00Z,Wild edible Fruit #Fresh #wild #edible #yummy #Fruits #tropical #forest #trending #viralvideo #fyp,441,2,0,Green Shoot Organic,892
66,R6FLLDdcdJM,2024-10-09T09:29:08Z,Beautiful scean of pakistan forest! Searching a beautiful wild wolf! #animals #beauty #jungle,0,0,0,Animals World 🌍,237
67,7AaN_ZVMe84,2024-10-09T14:26:23Z,"Green Stream Flowing in Wild Forest. Nature Sounds, Forest River Sound, White Noise for Sleeping.",22,1,0,Andwater Ville ,1090
68,n1x-fErk-Wc,2024-10-07T17:07:21Z,#shorts 💥 MABON 💫 WILD MUSHROOMS FROM THE FOREST #mabon #magic #mushroom #wildlife #ritual #pagan,409,12,0,blacktrinity paint,101
69,oLRct6y4aL0,2024-10-09T11:52:53Z,Wild Men of the Forest- From Fairies to Bigfoot: Mi- Go,408,15,0,Fairy Encyclopedia,282
70,6yvPGnj6zuM,2024-10-08T04:45:01Z,Most Amazing Giraffe In Wild Life Forest,977,19,0,Global Defence TV,743000
71,nNVkcEQiJ88,2024-10-08T06:39:57Z,Build a house high in the forest to avoid wild animals #bushcraft #build #camp #camping #survival,49,5,0,Epic Expeditions,6400
72,lcqtdChaVs0,2024-10-07T21:07:29Z,Wild- Knight Rider #automobile #mountainoffroad #offroad #forest #mountains #naturelovers #nature,9,6,1,Život je Selo,279
73,yNksEuCTemI,2024-10-10T06:34:01Z,A new day in the wild - new forest episode!!,406,27,8,Leah Screen,57900
74,kf2jufc0MPE,2024-10-09T16:17:30Z,Serow was the rare wild animal in the forest and deer was the lovely animal,411,1,0,Lovely animals,49
75,rTPm5iCA-r4,2024-10-09T15:35:04Z,Nature Forest and Wild Life For Traveller From Music Producer Alex Dwornik #shorts,535,3,0,Alex Dwornik,96
76,Nc8XbFadNFw,2024-10-10T08:08:00Z,WILD FRUITS IN FOOD FOREST. WHAT IS ROBBING OUR FRUITS? #foodforest #forestfoods,511,5,4,Napoleon GARDENING AdvenTOUR TV,5800
77,LETbNPm2oKY,2024-10-07T17:37:17Z,#dudhwanationalpark #wild#elephant #carj #sal forest #uplakhimpurkheri #india #like aur#sascraibe,5,0,0,Papu Dudhwa 🐱🌴,60
78,9WENMlRMQ9Y,2024-10-09T08:15:00Z,Crystal Clear Sparkling | Forest with Wild Animals,468,6,0,Abhisekh N. OFFICIAL,1680
79,F_4FQt7nyaU,2024-10-08T05:00:09Z,Wild Fireplace In a village near the Forest  -  Relaxing Fireplace Stress Reliever,34,0,0,OWAF,34
80,SpU_P5TaVIA,2024-10-09T06:03:47Z,"a big red dog, to a wild lumberjack in the forest#dog #cute #shorts",600,17,0,Aksara AI,560
81,5vrr4fXa3jQ,2024-10-09T05:23:22Z,Harvesting Pure Forest Honey 🍯 | Raw & Wild Honey Straight from Nature | Honeybeee.in,1,0,0,Honey Beee,1380
82,vOvNUfrC_f4,2024-10-08T15:25:47Z,"Surviving alone in the humid forest, the girl made a wild animal trap to survive #survivalbuilding",4,3,0,Country Girl,206
83,SFNlrPkjp7c,2024-10-09T12:35:38Z,"Tigers of Agarzari Zone, Tadoba Forest: Secrets of the Wild!  #tiger #tadobaandharitigerreserve",55,5,0,Jungle Boy Safari,2770
84,YdMBSZxU_rc,2024-10-09T10:59:11Z,Crocodile vs Deer #wildlife #deer #music #wild #crocodile #amazon #travel #forest #travel,18,0,0,News 9 World,496
85,eGgE6pIxN_0,2024-10-08T18:52:13Z,"Go wild, for a while    #travel #wildlifephotography #wildlife #nuture #forest @TrekTales_",21,1,0,Trek Tales,31
86,ngTzLTCou30,2024-10-10T05:18:17Z,a herd of wild animals running through a forest #wildanimals #youtubeshorts #youtubereels,2,0,0,Ai animation 2.0,35
87,KXbQWmUq8A0,2024-10-09T17:01:02Z,HAUNTED Scottish House 🏴󠁧󠁢󠁳󠁣󠁴󠁿 Abandoned in WILD Forest,441,20,0,BKR,13800
88,aIyv6X4zDzQ,2024-10-08T15:41:26Z,🌳 Forest Guardian: Keeper of the Wild 🌲 #AnimeVibes #GuardianOfNature,6,0,0,ɪʟʟᴜsɪᴏɴ,65
89,_B6n-Yc1dmc,2024-10-09T11:44:18Z,"Living off the grid in the forest, harvesting wild vegetables and selling them at the market",224,3,1,Dien Tay Ca Ca,72
90,9WQT-6GVAKM,2024-10-08T13:59:26Z,hunting fat wild buffalo in the forbidden forest,567,3,0,sundries zone 86,8060
91,ToD0trjQJdQ,2024-10-10T01:51:28Z,Forest guard and wild life guard mains examination qualified 2024,47,10,4,Satyam ratna SSC,140
92,2gCh-P2uCyg,2024-10-09T10:03:41Z,चीते की अपनी बच्चे को ट्रेनिंग ।#wild #wildlife #cheetah #forest #deer #animals #wildanimals,4,1,1,Entertainment Shorts House ,16
93,IqCvKUgfmUY,2024-10-11T01:22:04Z,"Blizzards Echoes in Forest | Blizzard Sounds for Sleep, Relax | Wild Winds and Blowing Snow",45,1018,0,Winter Fury,7
94,5h3mubP22_4,2024-10-08T10:09:25Z,Echoes of the Wild- sound journey in the heart of the forest-Praful #flute  #ukelele #music #looping,528,20,2,Prafulmusic,4220
95,XpzQDjqzkrc,2024-10-08T06:14:21Z,Survival Guide and clear Forest entrance dungeon|| Defeat Forgotten guardian boss|| wild Darkness 🥱😎,26,3,0,R.B.C Gamer (D.S),95
96,BDo-clxeAh8,2024-10-08T03:49:04Z,Wild Life Week Observed By Boudh Forest Division | Khabar Odisha,17,0,0,Khabar Odisha,32200
97,KYj6fuRldxc,2024-10-08T12:30:20Z,Make a crossbow to hunt wild chickens. life and forest,11,2,0,Life and forest,813
98,MP-01gYZh_Y,2024-10-07T23:00:53Z,"Forget Summer Heat with Fresh Sound of Forest Streams and Wild Birds, Sound of Dawn in Green Forest",5,0,0,Butterfly Harmony Waters,276
99,0p1vGPY-Tmw,2024-10-08T22:09:52Z,"Forget Summer Heat with Fresh Sound of Forest Streams and Wild Birds, Sound of Dawn in Green Forest",1,0,0,Butterfly Harmony Waters,276
100,TjuAgOI1hq8,2024-10-08T13:21:57Z,"Forget Summer Heat with Fresh Sound of Forest Streams and Wild Birds, Sound of Dawn in Green Forest",5,1,0,Butterfly Harmony Waters,276
101,i8-m21_jrYY,2024-10-09T20:58:35Z,Friends in the Magical Forest - 23 (Takin、Wild Horse、Giant Salamander）,4,2,0,Sea Boy,7
102,dHSZoFhaLo8,2024-10-10T04:23:09Z,Harvest wild berries in forest - delicious traditional berry cook recipe in village | gardening,4100,691,2,Hồng Tươi,25200
103,a4QIJdJy25k,2024-10-09T14:09:41Z,আমাজন অরণ্য || Animals of Amazon ||Amazon rain forest || The untold theory || Wild life of amazon,18,0,0,The Untold Theory,6
104,GQxDhjdrPlg,2024-10-09T00:00:08Z,"Forest Sounds, White Noise from Waterfall, Forest Stream Sound, Wild Green Forest, Relaxing Sounds",24,0,0,Dream of Joy,1070
105,DD_TQCje3-s,2024-10-09T05:30:04Z,"""A Tranquil Night in Gir Forest - Exploring Gujarat’s Wild Beauty | Sasan Gir Adventures""",470,8,2,Ckb Goat Farm,33900
106,l79TCnGvU0U,2024-10-09T05:00:33Z,A Tranquil Night in Gir Forest - Exploring Gujarat’s Wild Beauty | Sasan Gir Adventures,452,10,2,Ckb Goat Farm,33900
107,cYSw8R3NftA,2024-10-07T23:13:46Z,Rare Millipede Hunt Goes WILD in Tropical Forest!,1479,8,0,Millipede Explore & Hunt,3020
108,5u-X9339YP0,2024-10-08T16:33:06Z,"Trip Episode -12 | Forest Area , Wild GArlic , Hill top ride & Water falls ( The End )",96,4,0,Mr Rho,9000
109,9Gc4Umtlw_k,2024-10-09T16:30:03Z,Thes Amazon forest life | man vs wild | জংলী জীবন ফানি ভিডিও 😆 #funny #short,7,1,1,Rk UniqueComedy,62
110,2Uk4YpUBJfA,2024-10-10T05:45:45Z,SAVE WILD LIFE 🌎 Save Forest 🌳 Save Nature ❤️,3,0,0,Nature is everything ,76
111,rZ5Fm_mot8A,2024-10-07T14:04:34Z,UPSSSC Forest Guard / Wild Life Guard Recruitment 2023 Eligibility Result 2024 for 709 Post,63,1,0,JOBS INFO WITH AKS,113
112,utaFjhzW0L4,2024-10-08T03:47:35Z,"Natural wild bees, beehives in the forest, under trees #wildbees #bee #natural #nature",1089,32,0,Mengly Vlong,25800
113,o40glB1ENIk,2024-10-07T21:20:00Z,🔴 LIVE | Sons of the Forest - 4 vs. Wild | Ankunft auf einer Kannibalen versuchten Insel! 😤,1016,99,0,TschimyGaming,9030
114,gy9lcpCJ4sg,2024-10-08T11:47:16Z,Lot's of wild mushrooms boletous in forest. Poland #grzyby #grzybobranie #bolete #boletous #porcini,781,12,0,Vegetable garden Groch z kapustą,10200
115,x72WG39hn7Q,2024-10-07T13:33:21Z,wild cheetah Attack vs Babu in forest... jangal me cheetah ka hamala... Brave...🥰💓..,748,2,0,DIVYA 247,3880
116,gAclHSKLiZ0,2024-10-08T07:07:07Z,Vidéos en préparation #animaux #forest #chasseur #wild,562,7,0,bruqt aventure,933
117,hmTklHXpves,2024-10-10T06:30:06Z,Madheswaran malai kovil 🛕| Wild animals🦁 | deep forest |karnataka state |#explore #r15v4 #travel,111,8,0,TELEPORT RIDERS,1260
118,9h_hPxI-xog,2024-10-07T16:15:26Z,upsssc forest guard and wild life guard Result 2023...#result #upsssc #forestguard #motivation,6,1,0,Zindagi,13
119,Z4MmUBynk3Q,2024-10-08T15:02:13Z,"Wild Moto Camping - Galloway Forest Park, Scotland",151,15,10,MotoCrad,905
120,Ktwd3DeUsIU,2024-10-08T02:21:21Z,UPSSSC Forest Guard / Wild Life Guard Recruitment 2023 Eligibility Result 2024 for 709 Post,31,1,0,Technical success planner,652
121,mRIlrvZyZSk,2024-10-08T11:52:00Z,wild Bison #forest #coorg #beauty #natur,512,7,0,Crown of coorg 👑,20
122,MlS4-RaTc5c,2024-10-07T12:12:08Z,"Chased by wild monkeys, NOMI finally got out of the forest",2792,103,70,SAKA.I.S ANIMALS,20400
123,Pd4WsnomvWc,2024-10-07T12:53:19Z,"Harvesting wild mushrooms, taking care of wild boars - Green forest farm #farmlife",909,6,6,Healthy life 1986,320
124,CF2m8Xf6Zmw,2024-10-08T12:00:13Z,Forest Survival 101: 2 Girls vs. The Wild! 🌳💪l Sunny Daily Life,8,0,0,Sunny Daily Life,36
125,Zp1S0TiYxZg,2024-10-07T18:00:29Z,Pizza Delivery Into The Forest At Midnight! | Wild Camping Food | Cooking Burgers On A FIRE.,270,33,37,Burton Outdoors,2540
126,WwBz5c5t9gY,2024-10-08T13:46:34Z,Panda vs wild Tiger (epic fight in Bamboo Forest) #wildlifebattle #animals #animalbattle ##panda,560,14,0,versusszooo,384
127,2QYxkRj4q3I,2024-10-12T04:28:31Z,Shinchan Becomes Lion!! Part 1 | Kasukabe Wild Forest!! | Explanation in Tamil | Topputucker,15299,345,27,Topputucker,43600
128,4DfiwkdqU6E,2024-10-09T15:00:06Z,"Fofanny hammock wild camp, forest harvesting!! Mourne mountains",444,25,35,Bestlife Wild Camping & Outdoors,791
129,h739JxrWSNk,2024-10-07T11:49:43Z,Awareness about Wild Life Conservation by Forest Department,265,10,0,New Era Public High School Bilaspur ( KANGRA),260
130,lm-3vhsQPC0,2024-10-11T06:05:00Z,Python Hideout | Guard Python | giant python | Anaconda | wild forest #wildanimal #explore,1594,15,0,Wija Matajang,181
131,2v-E14SABNE,2024-10-10T11:00:05Z,12 days solo camping - relaxing stream bathing wild forest life,165,3,2,Wild nature girl,112
132,nD4gqJjUSzY,2024-10-10T14:37:14Z,night solo camping in wild forest with tent #unknowndreamer #tagesorakel,20,2,0,india camping ,192
133,csKwTN5tqGg,2024-10-10T21:00:31Z,TODAS LAS NOTICIAS SOBRE WILD FOREST,234,20,4,CriptoMoii,6300
134,B0IOc2hu4AM,2024-10-14T02:09:46Z,"Nature Sounds of Deep Forest, Natural Water Sounds and Wild Forest Birds, White Noise for Relaxation",1158,25,0,Relaxing Water Sounds,5400
135,yHJh5fxRLE0,2024-10-13T10:15:04Z,All cows going to wild/forest,74,0,0,Cow and Bull,2670
136,_NYxMukoF1s,2024-10-11T14:00:38Z,Ant Colony: Wild Forest - Semidesierto en dificultad alta | Gameplay |,3,1,0,Tocrem,2
137,i_AXvwtePO0,2024-10-10T15:38:20Z,Whatever's Wild Episode 5 Old-Growth Forest Management and False Promises by the B.C. Government,180,11,0,Wilderness Committee,651
138,U1LMifCAM8M,2024-10-10T18:02:26Z,"WILD ANIMALS,CHILDREN CARTOON,FOREST,ANIMALS,BIRDS,",6,0,0,N-CREATION,2
139,uGmkPB6WjoY,2024-10-11T15:01:07Z,Forest animals name|Wild animals vocabulary|Animals for kids,1,0,0,Kids School,1470
140,-PTdxBeuVbU,2024-10-10T12:30:06Z,The girl went into the forest to get wild vegetables. She met the forest man.,2845,6,0,Triệu văn bộ,1060
141,Mj5snkHaOdc,2024-10-11T04:03:59Z,“Step into the wild—where the mall meets the forest and pandas roam in a shopping paradise!” #forest,434,14,0,Rafi Ahamed Syed,59
142,gDLQUDviimY,2024-10-11T02:22:38Z,"The term ""the forest"" often evokes images of wild nature, tranquility #relax #jazzgenre #relaxing",311,13,0,Relaxing Instrumentals,11
143,agnECw8q7V4,2024-10-12T15:45:00Z,24 HOURS in wild mountain FOREST Bushcraft and Cooking | ASMR,3,0,0,Bushcraft & Survival,0
144,uC7FsINdM8I,2024-10-11T15:05:26Z,Hunting Humans | Animals hunting | Wild life  | Forest life | Wild Animals,4,0,0,Ag Shorts ,2
145,Rfy1YkNnEEQ,2024-10-12T08:01:11Z,Wild siberian cat loves the forest😸 #cat #siberian,541,10,0,Quesi and Misha,148
146,BXOMF33TsPI,2024-10-13T15:53:59Z,hunting cook wild chicken in forest ep#1🐦🐓🦜,108,6,2,KAREN MSOW FAMILY,869
147,lKeTVghjEA4,2024-10-11T13:17:07Z,"""Majestic Tigers of Rajasthan's Tiger Reserves: Guardians of the Wild"" #tiger #forest #india",405,13,0,Journey With Roots,653
148,bmWro-mDlvQ,2024-10-12T06:45:23Z,Painting for#Abhimanyu#Elephant #sorts#video#viralvideo#forest #dasara #wild #karnataka #jumbo,257,10,0,Life In Wild,33700
149,QDV_TG7VFA8,2024-10-10T15:14:07Z,Dark Forest Trails: Terrifying Adventures in the Wild,1,0,0,ShadowTales,0
150,HF-hjLi_-r4,2024-10-10T13:22:50Z,"""Let's us fence Malava forest to reduce wild animals destroying people's property """,68,3,2,Elvis Nyama Ndogo,2240
151,C9n0AzTZ6l4,2024-10-09T09:29:41Z,Elephant in Forest #nepal #elephant #wild #wildlife #valmikinagar #roadtrip #bihar #viral #bigboss,266,19,2,The Honest Saga,24
152,2w55uWggNCg,2024-10-07T11:43:51Z,Ambient-Wild Cosmos Forest,17,2,0,Zefis'co,3050
153,XaWR6FMP30A,2024-10-10T10:00:40Z,Forest animals name for kids| wild animals vocabulary |Animals name,86,1,0,Kids School,1940
154,i94L2lhqqWM,2024-10-12T06:00:50Z,Deers in the wild #bandipur #deer #forest #wild,510,11,0,Raj,72
155,0q_lTO5iIkw,2024-10-11T09:51:02Z,go into the forest to trap wild chickens and build a kitchen on the farm,560,14,5,Mountain people,1410
156,ZfAF30jFFfQ,2024-10-10T10:00:39Z,Wild Amazon: Unveiling Life in the World's Largest Tropical Forest,59,0,0,Journeys of Knowledge,282
157,WpkzU3h2abE,2024-10-11T16:41:21Z,"Wild Animal Pajama Party 🦊🎉 Forest Fun with Raccoons, Monkeys & Deer | Kids Show",92,0,0,KiddoJuniorTV,184
158,E7Q4V9WJjFc,2024-10-13T07:30:04Z,వైల్డ్ క్యాచర్ 🐷🐷#wild#wild catcher#forest#hunterxhunter#ttvlogs #shorts#yt#vairalvideo,482,10,0,TT vlogs ,227
159,lMlHEY6ORHE,2024-10-12T12:27:12Z,Wild Life in the Forest,69,1,0,AI AI,6
160,v7KL03lNVSE,2024-10-12T13:49:52Z,The Wild Cats vs The Forest Explorers | Unofficial CGT Scrim,8,1,0,Wrench The Caster,65
