,Video ID,Published Date,Title,View Count,Like Count,Comment Count,Channel Title,Subscriber Count
0,KgMS82q1jzA,2024-07-28T09:00:16Z,LIVE OPENING of PREMIUM BATTLE PASS and ESSENCE EXPLAINED in WILD FOREST,605,18,17,Aftermath TV,14000
1,JyaKIdoMhVM,2024-07-06T08:44:59Z,WILD FOREST BASIC GUIDE,3190,27,34,Dagdag Kita,51200
2,dpOXXh8-tsA,2024-07-28T11:00:07Z,"Build a Shelter Under a Rotten Tree - Building Skills, Wild Forest Beauty",11938,176,14,Wild Forest Beauty ,41600
3,Y9OSP7FvFPI,2024-07-10T11:00:07Z,"Pumaldo Ng ₱2,000 sa Wild Forest? (WALANG GINASTOS) | Wild Forest Update",1927,31,35,Coach Rev,30900
4,XyD_oE3hzRI,2024-07-29T09:46:00Z,WILD FOREST - SIGNAL FIRE IS HERE!,824,65,13,Insane on Crypto,16700
5,piV8SNTETOI,2024-07-14T01:20:06Z,Wild Forest Play-to-Airdrop,123,1,5,Khang Nguyễn,0
6,QZf9qthGBXU,2024-07-15T19:49:36Z,⚔️ ¡Domina Wild Forest! Equipo META Imparable y Estrategias para P2AS2,1135,124,8,JayBe Music,12600
7,tAFog7GZl1I,2024-07-29T13:00:07Z,PART 2 || EXPLORING INSIDE THE WILD FOREST AT GARDENS BY THE BAY SINGAPORE,72,42,34,LaBhelian 'D' Traveller&Mix Vlog,4850
8,ep0S1NKvKeI,2024-07-12T13:00:41Z,Building a Bushcraft Tree House | Building in the wild forest | Cozy TREE HOUSE | Part 2  #treehouse,469726,15560,18,EMRE OUTDOORS,22100
9,CEw88JeHj4Y,2024-07-11T14:28:38Z,How to win ARCADE MODE! WILD FOREST,484,3,4,Cường Sophie,27
10,5Xkh-UI1Lbk,2024-07-29T05:04:54Z,Wild Forest | P2A S2 / S1 / Day 28 - Season Finale!,20,1,0,Purzival Plays,16
11,iys_nnlhoRk,2024-07-14T13:18:23Z,What is Wild Forest? How to earn money from Wild Forest P2A,316,2,0,Clarissa Morgensen,2
12,b8DzM9hKUeU,2024-07-16T23:04:50Z,WILD FOREST :: AUMENTE SEUS PONTOS NO AIRDRROP + PERRKSS FAVORITOS,643,29,0,Fidelis,15300
13,bDTz_Wp2Ssc,2024-07-01T13:57:19Z,Wild Forest Aggressive Gameplay For Play to Airdrop Season 2,111,5,0,Hiyori,0
14,zcmlRu3grkM,2024-07-23T08:45:56Z,3 Years Alone in the Forest - Harvesting WILD FOREST FRUIT to sell,1873,1356,0,Lý Thị Na,2420
15,n62UYnCRNbs,2024-07-26T19:26:24Z,Новая функция Wild Forest - Signal Fire | Play-to-Airdrop 2 season,1248,115,20,Crypto Juli,94800
16,be7YF3ukoxY,2024-07-05T15:22:43Z,🔥 LOS MEJORES CONSEJOS para GANAR el PLAY TO AIRDROP | Wild Forest,2530,90,32,Sarraf,54700
17,oQ3dWxPoglE,2024-07-23T16:10:11Z,Built a Bushcraft Log Cabin in the wild forest from fallen trees - No power tools Part 2,27471,962,15,Asbjorn Olsen-Berg Bushcraft,734000
18,2rsCVc0C0vU,2024-07-27T20:00:33Z,como não jogar wild forest,9,0,0,Fabyo Hunter,9
19,mJKh_2Opa30,2024-07-04T03:10:07Z,Wild Forest P2A Season 2 Daily Grind,333,11,1,RR GaminG HuB,2450
20,6iPdq3-kHfQ,2024-07-04T15:37:46Z,Wild Forest P2A season 2: Top 10 leaderboard battles_Ep1,61,1,0,Lambrador,1
21,c6sHhpUBTcs,2024-07-02T14:27:09Z,Wild Forest P2A S2 short gameplay!,29,0,0,WILDFOREST P2A,0
22,jFiiYTkkT0o,2024-07-28T18:36:24Z,Wild Forest Lost strategy,39,2,0,Life Realization,13
23,A5x0Va5l65s,2024-07-01T13:08:17Z,Wild Forest | Chính thức Mainnet và P2A Season 2 Bắt Đầu. Anh Em Được Bao Nhiêu $WF ??,1621,20,36,zBlue,4130
24,lP5Kwl2IK4M,2024-07-28T14:15:23Z,wild forest P2A,5,1,0,clt,0
25,1OfqvC0E2ak,2024-07-21T13:57:33Z,WILD FOREST - Triple Air Build (Climb to League 3-4 Easy),116,2,1,Point618,1
26,nJ78AvsutIk,2024-07-17T03:07:04Z,Wild Forest | P2A S2 / S1 / Day 16 - The cheap pyromancer!,23,1,0,Purzival Plays,16
27,FZAgY9oiCtI,2024-07-27T11:15:04Z,Foolish Man's Wild Forest Meeting Leads to Naughty Love Affair,1177,0,0,Nhụt Single Mom ,9910
28,RR5UOmSoEmU,2024-07-18T15:26:00Z,Wild Forest | Розыгрыш NFT Пака | Прокачка Персонажей | Перки | Заработок на P2E Играх,983,69,89,Crypto Gamers,32000
29,1_kbGCX9SXk,2024-07-28T15:11:55Z,Wild Forest: How do I join Play-to-airdrop?🎮,16,2,0,GMod Skibidi,9890
30,uB4uhXjyzuI,2024-07-29T00:07:30Z,girl in the wild forest,435,9,0,Giang Thi Van,787
31,XCC-fUi8o0A,2024-07-03T12:09:21Z,Opening a Wild Forest premium pack and got a MYSTIC lord 🦁♥️,38,0,2,Nico5D,3
32,tEcaxSo7oI4,2024-07-20T01:17:10Z,Wild Forest | P2A S2 / S1 / Day 19 - The Shield Knight,26,2,1,Purzival Plays,16
33,KgkyVopEX0Q,2024-07-08T17:42:51Z,DICAS PRÁTICAS WILD FOREST MONTAGEM DE TIME,316,32,8,Seu Bubu NFT,2050
34,xEXUmdaHZ-0,2024-07-29T02:51:33Z,Tryhardeando el Top 50 del Leaderboard Día 20 Parte 3 | Wild Forest,180,24,0,Criptomamadas,3290
35,40NYL-XyUpc,2024-07-21T04:38:01Z,Normal day as league 5 Wild Forest,725,6,2,Đạt Võ,6
36,qNAv5eGYMq0,2024-07-06T21:15:16Z,COMO MONTAR UM TIME NO WILD FOREST,652,33,0,Fidelis,15300
37,aNeOyqVAgj4,2024-07-18T08:16:50Z,Overhauled Perk System for WILD FOREST ⚔️,1033,52,27,"The Crypto Asian - Gaming, NFT, Tokens",8030
38,_1EEnKTfjxA,2024-07-18T09:11:58Z,Obscure Mechanics in WILD FOREST ⚔️ for Advanced Players,1411,47,28,"The Crypto Asian - Gaming, NFT, Tokens",8030
39,ya2aCXVth4s,2024-07-27T15:38:49Z,Wild Forest | P2A S2 / S1 / Day 27 - Almost end season. Thoughts?,26,1,0,Purzival Plays,16
40,TIQq1qVgu-c,2024-07-28T17:45:49Z,wild forest p2a,0,2,0,kenedy luiz,1
41,soo5HX02Uq0,2024-07-03T06:23:06Z,Wild Forest Game Launch | P2A Season 2 Budget Team | Road to Top 100,174,6,0,ArZeus,14
42,IR9DhA20k_c,2024-07-26T16:55:17Z,Wild Forest Top 1 gamefi 2024,25,7,4,MinhQuan,13
43,Q56zANKDaRQ,2024-07-10T15:19:15Z,Wild Forest P2A Season 2 Gameplay (League 5),123,5,3,Steviemax,5
44,qRgME1mcA1g,2024-07-19T09:01:13Z,WILD FOREST | УСПЕЙ ЗАЛУТАТЬ AIRDROP | ЗАРАБАТЫВАЙ БЕЗ ВЛОЖЕНИЙ!,355,20,5,PanTbIkva,15400
45,DhNfEINIu4E,2024-07-04T01:29:14Z,Wild Forest : Gameplay Live | Play Game & Earn $WF crypto token Airdrop Now - Web3 game PTOE,12,0,0,Web3 Game Airdrop Play To Earn,56
46,mzjqcMhlyvQ,2024-07-29T05:45:29Z,Wild Forest P2A Season 2!,158,7,2,S Cari,2
47,TKuNmDAJlrA,2024-07-25T03:21:20Z,#solobushcraft #survival #solobushcaft #bigtree  Build a shelter in the wild forest,10338,164,0,trieuvannhay,107
48,7F1yfKym2Io,2024-07-10T21:51:22Z,Asi GANARAS Criptomonedas Con Wild Forest🤑,1224,24,31,Brizzio,6740
49,3rtjm3ppwD4,2024-07-26T11:06:14Z,Mi proyecto de vida la Reserva Wild Forest | Dulcinea,2090,231,15,Dulcinea. Una vida en el bosque,704000
50,zPnABHdTvm0,2024-07-20T06:05:40Z,Wild Forest Play To Airdrop Season 2 | Easiest Way Win Matches,71,13,3,I-Brand,74
51,ywDK28yxacA,2024-07-16T20:00:19Z,REVISAMOS PERKS EN WILD FOREST,653,107,3,Androxmx,37700
52,JPPNrfKjbfU,2024-07-08T02:48:20Z,"Wild Forest Game Launch, P2A Season 2",541,3,0,Thăng Nguyễn,5
53,HNsvANWo4p4,2024-07-28T18:59:36Z,WILD FOREST IN RONIN! S2 Airdrop..,290,4,3,DomAirDropsNFTs,9
54,QJ_ra2-j7RE,2024-07-12T07:56:30Z,Wild Forest Game Launch and P2A Season 2,125,1,0,捌玖,0
55,A5x0Va5l65s,2024-07-01T13:08:17Z,Wild Forest | Chính thức Mainnet và P2A Season 2 Bắt Đầu. Anh Em Được Bao Nhiêu $WF ??,1621,20,36,zBlue,4130
56,UWOoTG5DNGI,2024-07-02T23:53:30Z,WILD FOREST EARN FREE $WF TOKEN ZERO COST,57,0,2,NFT GAMES ESPORTS,940
57,Zr2FNptUDLs,2024-07-28T06:31:12Z,RETA FINAL WILD FOREST | QUAL PRÓXIMO JOGO VOU FOCAR,314,24,5,Seu Bubu NFT,2050
58,G8FBJqcd5ZM,2024-07-08T18:15:47Z,ABANDONED Scottish Castle History 🏴󠁧󠁢󠁳󠁣󠁴󠁿 Hidden in WILD Forest,2314,99,6,BKR,12300
59,7F1yfKym2Io,2024-07-10T21:51:22Z,Asi GANARAS Criptomonedas Con Wild Forest🤑,1224,24,31,Brizzio,6740
60,lTByVzIRi9I,2024-07-25T19:05:43Z,Forest School Vs. Wild Forest,270,50,3,Orangutan Outreach ~ redapes.org,32800
61,KgkyVopEX0Q,2024-07-08T17:42:51Z,DICAS PRÁTICAS WILD FOREST MONTAGEM DE TIME,316,32,8,Seu Bubu NFT,2050
62,8vzswcDguaY,2024-07-01T18:06:05Z,Wild Forest  Play to Airdrop Seaso 2  #wildforest,277,19,1,cripto pta,388
63,Jp5AOToBWPI,2024-07-01T15:47:57Z,Wild Forest | P2A S2 now LIVE. Day 1 Game Launch!!,20,1,0,Purzival Plays,16
64,uegbuEj7cQM,2024-07-15T11:17:29Z,🔥 WILD FOREST | ROAD 2 TOP 1000 | AIRDROP SEASON 2 | GAMEPLAY & CHILL 👀 DAY 1,42,1,0,Wunshkonzrt,2250
65,ZdVpcBMKK7I,2024-07-09T20:07:36Z,Lifehacks for survival in the wild forest 💡🌳 #bushcraft #forest #outdoors #survival #camping,261680,3929,8,Bokoch,1630000
66,oDNVhtyVhx4,2024-07-26T09:44:11Z,Wild Forest Play to Airdrop! LFG!! Last 3days for Airdrop!,11,0,1,nazh slash,0
67,eAMNVZVam4I,2024-07-27T05:16:06Z,Wild Forest Arcade Mode,1,0,0,TerPits ,177
68,ON7FSUcqgHg,2024-07-03T00:30:12Z,#1 Hướng dẫn chơi Wild Forest kiếm tiền play to airdrop SS2 trên Ronin,2822,9,12,Gamefinity,13100
69,4pnv9VvDiQY,2024-07-03T06:24:36Z,¡Segundo Día del Play-To-Airdrop de Wild Forest! 🚀🎮 | WarriorVEN,100,9,4,WarriorVEN,2690
70,ndQACCuGfyY,2024-07-28T15:44:47Z,WILD FOREST CHEGOU NA VERSAO FINAL.,2,1,0,Cripto Is the Future,4
71,JtvdfbJNH8Q,2024-07-27T06:47:42Z,Wild Forest and Play-to-Airdrop,111,7,0,69Meth420,8
72,l0zPaRNHa1E,2024-07-28T12:55:08Z,wild forest battle,0,0,0,Олексій Калга,0
73,UPxUijdN6H0,2024-07-25T11:05:28Z,Wild Forest How to Rule the Game Tips and Strats Your Favorite Perks to use,1524,109,0,AruelPlays,5390
74,TihzAJp9U9s,2024-07-24T11:44:55Z,Ya Puedes COMPRAR el Battle Pass Con ESSENCIA en Wild Forest,239,15,8,Brizzio,6740
75,43iw_P8E3-E,2024-07-27T09:34:42Z,Wild Forest Game Play P2A Session 2,28,16,0,GIRAS OFFICIAL,2160
76,YlYmMRfomtA,2024-07-29T07:00:10Z,Wild Forest Airdrop mùa 2,1,0,0,Hoa Mai,0
77,KurHrE5I4FU,2024-07-28T04:45:32Z,Wild Forest Play to Airdrop S2 budget team Strategy to reach 2k points,134,16,13,Crypto Jao,10
78,IQ8Cn7Pn2ag,2024-07-26T12:36:34Z,Forest frog Wild-forest frog @QuangMinhToan,5371,24,0,QuangMinhToan,2640
79,DsNUfsi0bKQ,2024-07-15T15:52:09Z,Wild Forest P2A Season 2 - Quick Guide,183,59,1,Pasiyah,85
80,IznSWUWTYzY,2024-07-23T13:12:55Z,Built a Bushcraft Log Cabin in the wild forest from fallen trees - No power tools Part 1,9861,365,5,Asbjorn Olsen-Berg Bushcraft,734000
81,z331NKkHMLw,2024-07-29T06:56:57Z,Wild forest A Great Game That Is Not Just A Game!,107,1,0,̇,9
82,m6966NzJVxc,2024-07-02T23:03:52Z,AIRDROP DO WILD FOREST! TUDO SOBRE O PLAY-TO-AIRDROP SEASON 2,585,20,7,TIO DOUGLAS GAMES,7110
83,fj0xuxDr7uY,2024-07-28T18:20:03Z,How to play Wild forest l Urdu Hindi version 2024 l Wild forest play to airdrop season 2,55,3,2,Rehan Khan VLOGS,122
84,2opucpRTKOc,2024-07-29T01:05:10Z,Wild forest Play To Airdrop gameplay,1,0,0,Soywilderjesus,0
85,O37IHaWVudE,2024-07-29T09:22:47Z,video wild forest test game,123,0,0,Uyên Võ,0
86,wRgKdkWRCh4,2024-07-18T16:03:02Z,Live Gameplay & Meta Team Showcase for WILD FOREST ⚔️,1677,90,27,"The Crypto Asian - Gaming, NFT, Tokens",8030
87,2Iw67i4Nyik,2024-07-17T21:00:01Z,🌲🔥 WILD FOREST AIRDROP INSANO GRÁTIS! 🌟 | Jogo NFT Free to Play | PC e Mobile 🌟🔥,2938,255,22,DIEGOLA,49400
88,cFiFLnP_ajc,2024-07-25T23:01:56Z,EL MEJOR EQUIPO PARA EMPEZAR Y COMPETIR EN WILD FOREST | CODE,1970,131,32,SonLe,2440
89,Wwx_u4lEa6M,2024-07-01T16:44:34Z,La S2 del P2A de Wild Forest acaba de empezar!,410,20,9,SoloNFT,2110
90,kP8b3PzroaY,2024-07-29T03:06:19Z,Wild Forest P2A season 2 PIGCopter GAMEPLAY,18,1,0,Wild Forest srat.,1
91,4mZ7ZLfTA8U,2024-07-01T11:30:06Z,"VIDEO FULL ; Complete shelter construction, How to trap wild boar - Wild forest beauty",30003,150,9,Wild Forest Beauty ,41600
92,vFqJKCNmZ5E,2024-07-29T00:00:21Z,"CRYPTO GAMES: WILD FOREST, #NFT GAME 022 #CryptoGames #WildForest #NFT #PlayToEarn #FreeToPlay $WF",6,1,1,ANDREW PANDA GAMES,1790
93,svSqf9lpgMU,2024-07-28T08:36:05Z,Wild kitchen adventure | hadzabe Cooking rare food in the forest,8395,187,2,Hadzabe Tribe Unveiled ,570000
94,GSLILJju2kg,2024-07-28T16:56:39Z,Wild Forest - P2A S2,1,0,0,Rare Axies,0
95,Jj4_fljNVTk,2024-07-13T09:08:34Z,Wild Forest Game Launch and P2A Season 2,147,15,2,Stan.,5
96,SAxXHHsRWy0,2024-06-30T23:25:52Z,"Airdrop Wild Forest Season 2, TUDO QUE VOCÊ PRECISA SABER!",642,21,9,Vivendo de NFT,31
97,EyEgCpy0HnE,2024-07-29T10:17:00Z,ant colony: wild forest tropics gameplay part 4,0,0,0,LMG 67,6
98,h84J-d6s4ig,2024-07-27T13:34:06Z,Tentando chegar em liga 6 no Wild Forest,5,1,0,Nobre24,1370
99,KSMsfobQdZM,2024-07-28T19:03:01Z,Wild Forest 2024,292,1,0,fras Himikoas,0
100,AQKwO49dm9g,2024-07-27T10:52:08Z,Play Wild Forest Arcade mode [ Play to airdrop ss2 ],15,0,0,Phat Nguyen,9
101,zoUZHwXCl1s,2024-07-28T10:53:23Z,Arcade Mode Wild forest so fun,2,0,0,papoy xyz,0
102,n9WyslQ2v0Y,2024-07-23T05:33:25Z,Equipo META para el Segundo Play-To-Airdrop de Wild Forest,2925,196,49,Muke Gaming,5380
103,kwLeYhnL--U,2024-07-25T17:32:33Z,ABANDONED Scottish 1800's House 🏴󠁧󠁢󠁳󠁣󠁴󠁿 Hidden in WILD Forest,695,30,1,BKR,12300
104,vR3yKE9Fy3k,2024-07-01T04:29:38Z,QUEMA TUS ASSETS! VIENE EL 2DO P2A A WILD FOREST!,58,4,2,LadyMufaTV,589
105,zoUZHwXCl1s,2024-07-28T10:53:23Z,Arcade Mode Wild forest so fun,2,0,0,papoy xyz,0
106,vR3yKE9Fy3k,2024-07-01T04:29:38Z,QUEMA TUS ASSETS! VIENE EL 2DO P2A A WILD FOREST!,58,4,2,LadyMufaTV,589
107,Wwx_u4lEa6M,2024-07-01T16:44:34Z,La S2 del P2A de Wild Forest acaba de empezar!,410,20,9,SoloNFT,2110
108,rFbCapvag0k,2024-07-28T17:24:41Z,Wild Forest arcade mode play to airdrop s2,1,0,0,CryptoDiortv,0
109,MNHzAL-OMq0,2024-07-02T14:16:07Z,"Fitur Forge, Essence, dan konversi aset beta  || Wild Forest - Episode 33",409,10,18,LAOSHI FERDY,16600
110,WidZFU0SyoY,2024-07-01T06:14:43Z,LAS ESTRATEGIAS PARA SER UN BUEN JUGADOR | Wild Forest,985,124,37,WarriorVEN,2690
111,n9WyslQ2v0Y,2024-07-23T05:33:25Z,Equipo META para el Segundo Play-To-Airdrop de Wild Forest,2925,196,49,Muke Gaming,5380
112,Rb74IGQwojs,2024-07-18T05:00:25Z,🎯 Wild Forest - Play-To-Airdrop 🏆  Season 2,10,1,0,FishDom DvaUshka,25900
113,S_LU9UgyMQM,2024-07-02T16:06:05Z,Consigue ESCENCIA con FORGE - Items VALIOSOS | WILD FOREST,1822,55,45,Muke Gaming,5380
114,RGNpMu0egZc,2024-06-30T09:00:20Z,ACQUIRE WF TOKENS and LORD STAKING EXPLAINED in WILD FOREST powered by the RONIN NETWORK,949,15,15,Aftermath TV,14000
115,VJJg-Pl7FiA,2024-07-23T20:17:17Z,New play to earn game! Wild Forest!!!!,251,1,0,Adrian Palaganas,0
116,tYaczuPj8nY,2024-07-06T18:51:28Z,Wild Forest Gameplay,15,1,0,Legendbeast Guides,148
117,juZgJo0XEsE,2024-07-05T17:31:13Z,adventer in the wild #forest #wild #music #waterfall #water #hiking,16,3,0,CoolCatEcho,35
118,kYr56DYPiz8,2024-07-11T11:00:16Z,Build A Tree House In The Middle Of A Wild Forest - Grilled Chicken - Log Cabin - How To Survive,6742,1837,14,New Wild Land / Off Grid,4970
119,EC7-7zB_AVg,2024-07-21T14:07:25Z,Pregnant mothers independently build houses in the wild forest,1351,10,0,Lý mẩy ca,16
120,32gdfYmpX3I,2024-07-20T17:20:28Z,WILD FOREST: ARCADE GAME PLAY,123,6,1,Thunder Flash,3
121,tGrkELI41Uw,2024-07-21T16:37:18Z,WILD FOREST ACCOUNT EASY TUTORIAL !!!,133,1,0,"Mejia, John Jerick C.",1
122,rnb6moLcIJ4,2024-07-25T04:34:58Z,Estrategias del Juego para subir el WinRate en Wild Forest,883,52,66,Muke Gaming,5380
123,GERyGt_6Kds,2024-07-19T08:47:49Z,Wild Forest _ Launch Game & Airdrop Mùa 2,270,24,26,Vinh Dang,28
124,GWFGSbqcjYc,2024-07-17T16:00:18Z,Squirrel in wild forest survival #bushcraft,19,4,0,Ahmet Agayev,5360
125,ny6-CETiMK8,2024-07-26T13:56:00Z,Wild Forest mashroom #shorts #foryou,560,16,2,Organic farming,492
126,gkTLQFiVw8I,2024-07-27T20:00:06Z,"CRYPTO GAMES: WILD FOREST, #NFT GAME 017 #CryptoGames #WildForest #NFT #PlayToEarn #FreeToPlay $WF",2,1,1,ANDREW PANDA GAMES,1790
127,qkLzouTHPMk,2024-07-02T05:18:18Z,¡Aprovecha el último Airdrop de Wild Forest!,1160,29,31,Criptomamadas,3290
128,AWEPfhQFko0,2024-07-01T17:03:21Z,شروع فصل دوم ایردراپ بازی Wild Forest,282,7,11,TheBlockunity,1400
129,dfTdDpI7lQ4,2024-07-06T07:26:15Z,iqreeb in wild forest 🥰 #lovesong #music,420,28,1,Hadia's creations ,613
130,Hjyo5HqjttA,2024-07-21T07:46:01Z,"Wild Forest , I'm new to the game, can anyone tell me how to get units?",655,0,0,NewBie WildForest,0
131,O76a0DeG7gU,2024-07-21T08:11:09Z,[ Wild forest ] Thua đầu game và cách lật kèo cực kì hay  trong game wild forset. #gamefi,683,0,0,Hà_Linh_33,0
132,whWGPbkhZ5A,2024-07-19T11:15:07Z,COMO COMPRAR EL BATTLE PASS DE WILD FOREST CON ESSENCE #WILDSFOREST #AIRDROP #NFTGame,845,28,14,CriptoMoii,5930
133,MTGwaPE4_jQ,2024-07-28T08:38:08Z,Play to airdrop with Wild Forest | P2A #WildForest,207,1,0,Bất Động Sản Việt Nam,0
134,ThGB5bZghvw,2024-07-02T04:40:10Z,Wild Forest | Getting my First Epic. What Perk did I get?,18,1,0,Purzival Plays,16
135,y0Z10LZPWHA,2024-07-28T04:25:43Z,Tryhardeando el Top 50 del Leaderboard Día 18 | Wild Forest,260,27,0,Criptomamadas,3290
136,y2q5J60_PXE,2024-07-03T03:58:41Z,SHOULD YOU BUY THE PREMIUM BATTLE PASS???? | Wild Forest,269,14,5,Mac AttackXD,162
137,23KVEmEZzgk,2024-07-22T13:57:15Z,$WILD FOREST PLAY 2 AIRDROP SEASON 2. One of S-TIER Play to Airdrop this Year! 🔥 #ronin  #f2p,108,6,3,martinclarixaWeb3,12
138,LyB1gu9m3ZE,2024-07-09T22:33:48Z,AIRDROP GRATUITO NO WILD FOREST: GUIA COMPLETO PASSO A PASSO PARA INICIANTES (MUITO POTENCIAL!),3441,273,36,Rodrigo Moura Crypto ,49700
139,FLsJfcjtCbc,2024-07-26T14:07:51Z,My Wild Forest game #foryou #follow #games #earnmoneyonline,73,19,3,Haq Nawaz khan,12
140,I2IeHxj38F0,2024-07-29T08:12:24Z,Wild Forest gameplay video,1,0,0,thiago 5,0
141,XMeyw7yt5Uc,2024-07-28T23:00:26Z,Sound of Wild Forest with Animals Voice Around | Suitable for Meditating Relaxing and Soothing Mind,0,0,0,Surga Hutan,0
142,toFC3dFqQc4,2024-07-22T04:02:51Z,"Wild Forest | P2A S2 / S1 / Day 21 - League 6 tonight, tomorrow, forever or never?",29,2,3,Purzival Plays,16
143,suqjMS_9nYg,2024-07-27T22:51:02Z,Road to Top 50!!!! Solo en Wild Forest  ;),27,1,0,thbluechicken,12
144,B7LQZvOa4zo,2024-06-29T21:00:09Z,Wild Forest: Vai começar a Season 2 e vai Pagar Muito - Jogo NFT Grátis de Estratégia Pagando,2564,144,17,Clem NFT,64600
145,Ekz2_pySoWk,2024-07-18T20:37:35Z,wild forest,6,1,0,troca de jogo,21
146,xSStquRu9Wk,2024-07-29T01:43:22Z,Wild Forest | Hướng Dẫn Cho Người Mới Bắt Đầu Chơi,4,0,0,Lê Quỳnh Giao,0
147,3nXoQVjmPzk,2024-07-20T03:44:29Z,Wild Forest 2024 07 20 10 39 45,714,0,0,Killer Baby,0
148,ZFOkq_DZSGo,2024-07-24T12:00:36Z,Wild Forest - Campanha na Moku e saiu o Passe Premium por Essência no Shop do Game.,125,12,10,Cryptomoedas News,1890
149,UqaykZPG3TM,2024-07-05T03:49:04Z,#leopard fight #for meal # wild forest,4,2,0,prakash Chandra,100
150,ZI616Omo0Dk,2024-07-21T02:22:12Z,Primeros pasas y push en Wild Forest,16,3,0,thbluechicken,12
151,ELMHRUKCke8,2024-07-15T18:55:09Z,Wild Forest Rain: Say Goodbye to Stress with Soothing Rain for Ultimate Serenity | ASMR Fireplace⛈️🔥,4553,14,0,Rain Today,1670
152,szl8ayNCEMk,2024-07-22T15:01:00Z,WILD FOREST Season 2 Battle Highlights #13 Play-to-Airdrop #wildforest #wildforestgameplay,50,2,2,Kenn Let's Play,4280
153,hMeMv7d0dy0,2024-07-02T05:53:12Z,Wild Forest | Play to Airdrop | Light the Signal Fire,269,50,10,Viar Cryptonation,288
154,Pw7oR7o4ubA,2024-07-02T11:00:29Z,WILD FOREST | ЗАПУСК ВТОРОГО AIRDROP СЕЗОНА | ВСЕ ЧТО НУЖНО ЗНАТЬ!,436,18,13,PanTbIkva,15400
155,d_96qQHhBhc,2024-07-02T16:08:43Z,SEGUNDA TEMPORADA DEL AIRDORP DE WILD FOREST | ¿COMO EMPEZAR A JUGAR? | BECAS COMPETITIVAS GRATIS,1126,19,7,SonLe,2440
156,ZAsUcfje5a0,2024-07-14T15:00:35Z,WILD FOREST Season 2 Battle Highlights #06 Play-to-Airdrop #wildforest #wildforestgameplay,13,3,2,Kenn Let's Play,4280
157,h5t-ccRAcEQ,2024-07-11T17:00:24Z,We Building Secret Underground Home in the Heart of the Wild Forest!,30203,608,8,Ruslan in the Woods,22800
158,KNJJu9-QqCc,2024-07-16T18:16:58Z,Wild Forest!Jogo NFT grátis que dá dinheiro #Airdrop Ainda vale a pena jogar?,144,8,4,Joker,154
159,zPnABHdTvm0,2024-07-20T06:05:40Z,Wild Forest Play To Airdrop Season 2 | Easiest Way Win Matches,71,13,3,I-Brand,74
160,FCz6xawinGY,2024-07-28T06:57:43Z,Battle of the Wild: Tiger vs. Forest Guard #shorts #tiger #joju_wildjunket,22679,750,1,Joju_Wildjunket,95500
161,ZdGobafntG8,2024-07-15T15:00:29Z,WILD FOREST Season 2 Battle Highlights #07 Play-to-Airdrop #wildforest #wildforestgameplay,14,4,3,Kenn Let's Play,4280
162,5XhC4TowGPY,2024-07-29T15:10:23Z,"The Real Sound of Natural Wild Forest | Birds Crickets Singing | Relaxation, Healing and Meditating",0,0,0,Surga Hutan,0
163,Mw2YsiBC7cE,2024-07-19T15:00:19Z,WILD FOREST Season 2 Battle Highlights #10 Play-to-Airdrop #wildforest #wildforestgameplay,39,4,2,Kenn Let's Play,4280
164,UF3DCruQjgY,2024-07-24T21:13:30Z,The most precious honey! Wild bees at work! #bee #honey #wild #forest #rocky #animal,3,1,0,AnimalSecrets,84
165,b3Bu1LZ7mTk,2024-07-24T17:34:15Z,Wild Forest,66,2,0,Peter'sTV-MDA - Topic,6
166,u1SSersWNQk,2024-07-19T01:39:01Z,#Ooty masanagudi wild forest elephant crossing time#inside baby elephant,183,10,0,kodaikanal tourism  driver life ,1530
167,nH5FUXJGPjU,2024-07-01T12:23:01Z,Новая система чек-инов в Wild Forest: Как заработать на Signal Fire!,15261,1075,98,Roman Pushka,109000
168,ZAsUcfje5a0,2024-07-14T15:00:35Z,WILD FOREST Season 2 Battle Highlights #06 Play-to-Airdrop #wildforest #wildforestgameplay,13,3,2,Kenn Let's Play,4280
169,FcymdbGPvV4,2024-07-06T13:45:32Z,Wild Forest Play to Airdrop 5000  essence spent,85,1,1,WILMEX,1530
170,FCz6xawinGY,2024-07-28T06:57:43Z,Battle of the Wild: Tiger vs. Forest Guard #shorts #tiger #joju_wildjunket,22679,750,1,Joju_Wildjunket,95500
171,ZdGobafntG8,2024-07-15T15:00:29Z,WILD FOREST Season 2 Battle Highlights #07 Play-to-Airdrop #wildforest #wildforestgameplay,14,4,3,Kenn Let's Play,4280
172,5XhC4TowGPY,2024-07-29T15:10:23Z,"The Real Sound of Natural Wild Forest | Birds Crickets Singing | Relaxation, Healing and Meditating",0,0,0,Surga Hutan,0
173,Mw2YsiBC7cE,2024-07-19T15:00:19Z,WILD FOREST Season 2 Battle Highlights #10 Play-to-Airdrop #wildforest #wildforestgameplay,39,4,2,Kenn Let's Play,4280
174,UF3DCruQjgY,2024-07-24T21:13:30Z,The most precious honey! Wild bees at work! #bee #honey #wild #forest #rocky #animal,3,1,0,AnimalSecrets,84
175,b3Bu1LZ7mTk,2024-07-24T17:34:15Z,Wild Forest,66,2,0,Peter'sTV-MDA - Topic,6
176,u1SSersWNQk,2024-07-19T01:39:01Z,#Ooty masanagudi wild forest elephant crossing time#inside baby elephant,183,10,0,kodaikanal tourism  driver life ,1530
177,Ym0kV0SqD_A,2024-07-19T16:00:29Z,Wild Forest - Battle Pass Premium com Essência na Loja!!,98,9,12,Cryptomoedas News,1890
178,NsK994FlDss,2024-07-11T17:00:16Z,I am BUILDING a NEW HOUSE above ground in a wild forest. 10 days of solo bushcraft,7291,221,82,bushcraftua,19300
179,CgLSasgConM,2024-07-04T18:10:21Z,Wild forest play to airdrop season 2,33,3,0,Zhyler Oliver,35
180,xbZAl1kg6a8,2024-07-26T16:09:32Z,The challenge of catching strange worms in the wild forest #bushcraft #camping #bamboo #shorts,466,7,1,Vivu-hoang dã,201
181,c3KLbhChEVs,2024-07-01T14:54:06Z,WILD FOREST GAMEPLAY,589,5,17,Phan Ngọc Tiến,110
182,sE_LEUz6u90,2024-07-23T11:03:33Z,Wild Forest Skin Airdrop,47,0,1,NanekTV,521
183,wVzbAS0dynM,2024-07-04T11:00:55Z,Wild Forest Game Play ‐ A melhor estratégia para iniciante.,76,5,2,FREITAS INVESTMENTS,2050
184,R4VeguS4EBc,2024-07-04T04:24:47Z,WILD FOREST P2A SEASON 2  X2.5% REWARD,13,1,0,InfoNet,77
185,GI50PKFPKH0,2024-07-17T16:37:18Z,Tryhardeando el Top 15 del Leaderboard Día 9 | Wild Forest,240,13,9,Criptomamadas,3290
186,a8s8pr-FmO8,2024-06-30T19:02:18Z,Wild Forest Forge System ! & Earn 115 PIXELS ! || Live Series - Episode 17,1275,37,2,LAOSHI FERDY,16600
187,XXlC3ZbliDs,2024-07-04T14:15:39Z,Wild forest  #music #football #melonplay #musichumor,49,4,3,Gooeylife,7360
188,0kVDxCbdQuc,2024-06-29T17:48:41Z,Recursos P2E do WILD FOREST abrindo Passe da Season 8 e Estrategias,63,4,2,katchuca,7490
189,_1Go3X0Wai0,2024-06-29T17:41:19Z,Moku Mint Allowlist GIVEAWAY + Wild Forest Forge UPDATE!,1967,88,160,ShiboSan Gaming,31100
190,3QApsyUxY14,2024-07-16T18:44:55Z,ABANDONED SCOTTISH MANSION 🏴󠁧󠁢󠁳󠁣󠁴󠁿 Hidden in WILD Forest,894,68,2,BKR,12300
191,ExM2vqO6UAI,2024-07-25T16:00:27Z,"CRYPTO GAMES: WILD FOREST, #NFT GAME 008 #CryptoGames #WildForest #NFT #PlayToEarn #FreeToPlay $WF",7,1,1,ANDREW PANDA GAMES,1790
192,bfOGHDI50xU,2024-07-13T09:04:18Z,Bolimowski Park Krajobrazowy. Lato. Evening sky. Flat panorama II. Wild Forest. Dron 4k HD,314,7,0,merioni.visual,14
193,QfYJ3jLaDp0,2024-07-02T21:25:27Z,Camping in the wild! #forest #wildlife #camping,2,2,0,Aditya Goyal,54
194,oJMV599sRGs,2024-06-29T17:23:19Z,فصل دوم ایردراپ بازی Wild Forest,159,2,3,TheBlockunity,1400
195,mt_c8O5PEJw,2024-07-21T11:51:43Z,Wild Forest Play to Airdrop Season 2 - Ranking up rare archer to epic archer with perks revealed 🤩,37,2,0,Sports and Gaming Wild,66
196,jIcaq9nNJeI,2024-07-22T09:50:50Z,Wild Forest: Как Получить Эйрдроп Токенов WF и Достичь Успеха в Игре,8784,427,44,Roman Pushka,109000
197,BzU4-STiTrg,2024-07-24T08:00:27Z,"CRYPTO GAMES: WILD FOREST, #NFT GAME 004 #CryptoGames #WildForest #NFT #PlayToEarn #FreeToPlay $WF",7,1,1,ANDREW PANDA GAMES,1790
198,_ARRgRD7wn0,2024-07-23T18:47:20Z,WILD FOREST СИЛА ЮНИТОВ,1624,65,1,Roman Cryptoman,32700
199,y4Ug-i9MHuE,2024-07-02T21:33:20Z,Vende tus recompensas gratis | Wild Forest,629,38,49,Criptomamadas,3290
200,4nm97YjPXic,2024-07-08T05:11:13Z,# hunting for life # in wild forest,559,10,0,prakash Chandra,100
201,edvU3bgjNFE,2024-07-20T11:28:56Z,the bowl of vegetables in the wild forest #survival #bushcraft #camping #views,6621,57,0,Vivu-hoang dã,201
202,WKnnez-kEHk,2024-07-16T00:26:13Z,"Wild Forest P2A season 2, Extremely quick wins tactic Road to next league, and how to get paid !",409,12,9,CryptoBro's,14
203,4Q72sTvzVo4,2024-07-14T04:19:31Z,Tryhardeando el Top 6 del Leaderboard Día 7 | Wild Forest,169,12,4,Criptomamadas,3290
204,0YilzVydVqo,2024-07-16T01:09:51Z,Sistema de Perk do WILD FOREST Novas passivas e Rank Up de 5 Unidades,120,5,0,katchuca,7490
205,MvRcKIdoAPw,2024-07-17T03:29:14Z,SOMEWHERE IN AMAZON RAIN FOREST  #wild#forest#viral#shortsviral#trending #bus #entertainment,1,0,0,Himanshik,0
206,FeXrdierDAs,2024-07-16T08:20:16Z,New Referral system added in Wild forest game 🎯❤️‍🔥,462,66,10,NFT TECH,2140
